Name,Specs,Features,GPT3-Outputs,Brians_custom_descriptions
"EVGA GeForce RTX 3080 Ti FTW3 Ultra Gaming, 12G-P5-3967-KR, 12GB GDDR6X, iCX3 Technology, ARGB LED, Metal Backplate","{'Brand': 'EVGA', 'Graphics Coprocessor': 'NVIDIA GeForce RTX 3080 Ti', 'Video Output Interface': 'DisplayPort', 'Chipset Brand': 'RTX 3080 Ti', 'Graphics RAM Type': 'GDDR6X'}","Real Boost Clock: 1800 MHz; Memory Detail: 12288 MB GDDR6X. Real-Time RAY TRACING in games for cutting-edge, hyper-realistic graphics. Triple Fans + 9 iCX3 thermal sensors offer higher performance cooling and much quieter acoustic noise.","Looking for the best graphics card on the market? Look no further than the EVGA GeForce RTX 3080 Ti FTW3 Ultra Gaming. This card is packed with features, including NVIDIA GeForce RTX 3080 Ti graphics, 12GB GDDR6X memory, and support for Real-Time Ray Tracing. Plus, with three fans and nine iCX3 thermal sensors, you'll enjoy higher performance cooling and much quieter operation. So don't wait any longer, order your EVGA GeForce RTX 3080 Ti FTW3 Ultra Gaming today!","You'll never look at gaming the same way, not when you have the EVGA GeForce RTX 3080 Ti FTW3 Ultra Gaming graphics card. This card is packed with features, including NVIDIA GeForce RTX 3080 Ti graphics, 12GB GDDR6X memory, and support for Real-Time Ray Tracing. Plus, with three fans and nine iCX3 thermal sensors, you'll enjoy higher performance cooling and much quieter operation. So don't wait any longer, order your EVGA GeForce RTX 3080 Ti FTW3 Ultra Gaming today!"
VINTAGE CANDY CO. 30TH BIRTHDAY RETRO CANDY GIFT BOX - 1992 Decade Childhood Nostalgic Candies - Fun Funny Gag Gift Basket - Milestone 30 THIRTIETH Birthday - PERFECT For Man Or Woman Turning THIRTY,"{'Item Form': 'Roll', 'Size': '3 Pound (Pack of 1)', 'Brand': 'Vintage Candy Co.', 'Occasion': 'Birthday', 'Pattern': '30th Birthday Candy'}","SAY HAPPY 30th BIRTHDAY & GIVE SOMEONE A BIG BOX OF FRESH VINTAGE CANDY.  Everyone likes to celebrate on their birthday, and were talking about the BIG 30.  We've completely loaded this box down for you.  You'll get nearly 3 lbs of classic, old time, retro nostalgia candies for an instant blast you into the past.  Everyone's got a story so gather round and hear about the first time they tried their favorites 90s candies!. THE PERFECT 30th BIRTHDAY CANDY GIFT FOR HIM OR HER.  Our Milestone 30th Year Birthday Candy Gift Box makes an excellent (And dare we say.  PERFECT) gift for men or women turning Thirty Years Old.  Your wife or husband, mom, dad, brother, sister, cousin, or friend will delight in fond memories of an era gone by with these amazing blast from the past nostalgia candies.  So, lets go for it and add this to your cart right now.  What better way to celebrate a great 30th Milestone Birthday?. YOUR COWORKERS WILL LOVE IT, TOO.  Our Vintage Candy Co.  Happy 30th Birthday Candy Assortment was crafted with love AND designed to be work friendly & safe! So even if you're buying for an associate, boss, acquaintance, or coworker, we've got you covered! Your candy thirty years birthday gift will surprise your whole office with delicious semi retro sweets.  When the lull of a Wednesday afternoon rolls around, someone down the hall will have a big box of vintage birthday candy to share with the en. UNIQUE, FUN, MEMORABLE, AND SURE TO GET SOME GOLD NUGGETS.","Looking for a fun, unique way to celebrate a 30th birthday? Look no further than the Vintage Candy Co. 30th Birthday Retro Candy Gift Box! This box is packed with nearly 3 lbs of classic, old-time, retro nostalgia candies, sure to take the birthday boy or girl on a trip down memory lane. And what better way to say “Happy 30th birthday” than with a big box of delicious candy? The Vintage Candy Co. 30th Birthday Retro Candy Gift Box is the perfect way to show someone you care on their milestone birthday.","Have a sweet celebration with the Vintage Candy Co. 30th Birthday Retro Candy Gift Box! This box is packed with nearly 3 lbs of classic, old-time retro nostalgia candies, sure to take the birthday boy or girl on a trip down memory lane. And what better way to say “Happy 30th birthday” than with a big box of delicious candy? The Vintage Candy Co. 30th Birthday Retro Candy Gift Box is the perfect way to show someone you care on their milestone birthday."
"U.S. Art Supply 30 x 40 inch Stretched Canvas 12-Ounce Primed 3-Pack - Professional White Blank 3/4"" Profile Heavy-Weight Gesso Acid Free Bulk Pack - Painting, Acrylic Pouring, Oil Paint","{'Brand': 'U.S. Art Supply', 'Color': '3-Pack', 'Size': '30"" x 40""', 'Paint Type': 'Oil,Acrylic'}","Multi-Use: Heavy-Weight 12-Ounce Primed Surface accomodates all types of media types - Acrylic, Oil, Watercolor, Tempera, Gouache, Pouring, Airbrushing & More. Durable Construction: 100% Cotton Canvas - Hand Stretched & Back Stapled Over 3/4"" Kiln-Dried Stretcher Bars from Environmentally Managed Forests. Professional Artist Quality: 3/4"" Thickness Profile & 12-Ounce Triple Primed with Acid-Free White Gesso. Heavy-Weight: 12-ounce triple primed with acid-free titanium gesso provides the perfect surface for painting masterpieces.","Looking for a high-quality canvas that can accommodate all types of media? Look no further than the U.S. Art Supply 30 x 40 inch Stretched Canvas 12-Ounce Primed 3-Pack! This professional-grade canvas is perfect for oil, acrylic, watercolor, tempera, gouache, and more. It's also durable, thanks to its 100% cotton construction and 3/4"" kiln-dried stretcher bars. Plus, the triple primed surface with acid-free titanium gesso provides the perfect foundation for your masterpiece.","Finally, a canvas that can accommodate all types of media. This professional-grade canvas is perfect for oil, acrylic, watercolor, tempera, gouache, and more. It's also durable, thanks to its 100% cotton construction and 3/4"" kiln-dried stretcher bars. Plus, the triple primed surface with acid-free titanium gesso provides the perfect foundation for your masterpiece."
"Azar Displays 105540 Floating Acrylic Wall Frame with Silver Stand Off Caps: 30"" x 40"" Graphic Size. Overall Frame Size: 34"" x 44"", clear",{},"Sold 1 Per Pack. HARDWARE INCLUDED - Each floating sign holder frame set includes 2 acrylic panels that are 3/16 thick, 4 silver standoff caps and hanging hardware.  Note: Large format sizes: 24 x 36 and 30 x 40 include 6 standoffs and caps. LOCATION - Wall Mount Floating Frames are ideal for displaying artwork, photos, posters or branding in your office, home, boutique, museum, lobby, retail store, school or anywhere else.  Frames can be used vertically or horizontally. QUALITY -These clear double panel floating frames with silver caps are strong, stable, as well as easy to clean and maintain. MANY SIZES - These frameless frames can be used vertically or horizontally.  Many sizes available, find the best size frame that fits your needs.  Showcase your artwork, poster, graphics, and prints and keep them protected from the elements.","Looking for a way to display your artwork, photos, posters or branding in a unique and stylish way? Look no further than Azar Displays 105540 Floating Acrylic Wall Frame with Silver Stand Off Caps. This clear double panel frame is perfect for displaying your prints vertically or horizontally and comes with 4 silver standoff caps and hanging hardware. It's also easy to clean and maintain, making it a great choice for any space. Choose from a variety of sizes to find the perfect fit for your needs.","Azar Displays presents the latest addition to their popular acrylic floating frame line. This clear double panel frame is perfect for displaying your prints vertically or horizontally, and comes with 4 silver standoff caps and hanging hardware. This clear double panel frame is perfect for displaying your prints vertically or horizontally and comes with 4 silver standoff caps and hanging hardware. It's also easy to clean and maintain, making it a great choice for any space. Choose from a variety of sizes to find the perfect fit for your needs."
6PCS Cool Face Masks for Small Children - Washable Reusable Adjustable Fashion Cloth Facemasks,"{'Size': 'Kids', 'Brand': 'DOVFAN', 'Color': 'Purple', 'Material': 'Cotton', 'Closure Type': 'Elastic', 'Reusability': 'Reusable'}","Elastic closure. Fashion Kids Cool Face Masks 6 Pcs small kids cool face masks are specially designed to meet more needs, with multiple colors and different designs to meet your needs.  We specialize in designing various, unique and fashionable masks.  Various colors and unique designs allow you to show different personalities well. High Quality Fabrics The skin-friendly, comfortable, soft and elastic material makes this mask fit your face comfortably, and is designed with a stretchable close-fitting fabric to provide maximum comfort and protection when going out.  Comfortable and breathable, the soft fabric can prevent skin irritation and can be worn for a long time every day. Reusable and Washable The high-quality cotton material can be reused and washed.  You can use it once a week to get the best results and reduce environmental waste caused by other masks. Suitable for Daily Use It is suitable for indoor/outdoor use, and can be used in various places, such as going to school, shopping, fishing, biking, walking the dog, running, playing or other outdoor activities, so that you can have fun and use it easily. Quality Service If you find a problem with the product, you can contact our customer service for free.  We provide return and exchange services because we have the responsibility to make you perfect.  Make your shopping happy.","Looking for a kids' face mask that's both stylish and functional? Look no further than the DOVFAN 6PCS Cool Face Masks for Small Children! Made of high-quality cotton, these masks are soft and comfortable to wear, and can be reused and washed for lasting use. With a variety of colors and designs to choose from, you can find the perfect mask to match your child's personality. And because they're reusable, you'll be helping reduce environmental waste compared to disposable masks. So why not try the DOVFAN 6PCS Cool Face Masks for Small Children today?","It's time to give your kids superpowers! Well, maybe not superpowers, but you'll be their hero when you help them look their best with the DOVFAN 6PCS Cool Face Masks for Small Children. Made of high-quality cotton, these masks are soft and comfortable to wear, and can be reused and washed for lasting use. With a variety of colors and designs to choose from, you can find the perfect mask to match your child's personality. And because they're reusable, you'll be helping reduce environmental waste compared to disposable masks. So why not try the DOVFAN 6PCS Cool Face Masks for Small Children today?"
"LaView 32GB Micro SD Card, Micro SDXC UHS-I Memory Card – 95MB/s,633X,U1,C10, Full HD Video V10, A1, FAT32, High Speed Flash TF Card P500 for Computer with Adapter/Phone/Tablet/PC","{'Brand': 'LaView', 'Flash Memory Type': 'Micro SDXC, SD, Micro SD, Micro SDHC', 'Color': 'Black', 'Hardware Interface': 'SDXC', 'Secure Digital Association Speed Class': 'Class 10'}","High-speed: LaView Micro SD card up to 100MB/s & 20MB/s read & write speeds respectively.  (performance may vary based on host device, interface, usage conditions, and other factors). U1,C10,V10 support smooth as well as continuous shooting and Full HD video (1080P) recording.  For apps, A1 (App 1) performance helps not only run faster by Micro SDHC card, but also save devices' storage space memory.  (TF cards actual performance will have some discrepancy due to difference of hardware/software platform. ). LaView 32GB Micro SD UHS-I Memory Card supports up to 4 hours 1080P videos, up to 6 hours 720P videos, 7,000 photos, 3,000 songs.  (1GB=1,000,000,000 bytes.  Due to different capacity algorithms and partial capacity are used for system files, management and performance optimization, so the actual available capacity may be less than the identifying capacity. ). Ideal for LaView camera,Android smartphone, tablet, drone, dash camera, camcorder, high-res photos, gaming, music, DSLR's, driving recorder, digital SLR camera, surveillance camera, sport camera, Bluetooth speaker, VR, computer and laptop.  LaView TF card is compatible with all MicroSD and wide application of full-size SD card if you have suitable SD adapters, such as compatible with Galaxy, Huawei, Xiaomi, Redmi, Vivo, realme, OPPO, Reno, Nintendo Switch, Fire Tablet, 3DS, DJI. Reliable & Durable: Shockproof, temperature-proof(32F -158F), waterproof(IPX7), and X-ray-proof.","Introducing the LaView 32GB Micro SD Card! This high-speed memory card is perfect for capturing Full HD video and high-resolution photos. With read and write speeds of up to 100MB/s and 20MB/s respectively, the LaView Micro SD card is ideal for use with LaView cameras, Android smartphones, tablets, drones, and more. With a storage capacity of up to 4 hours of 1080P video or 7,000 photos, the LaView Micro SD card is a must-have for any photographer or videographer.","Not enough space for your vacation photos? LaView is here to help. Introducing the LaView 32GB Micro SD Card! With read and write speeds of up to 100MB/s and 20MB/s respectively, the LaView Micro SD card is ideal for use with LaView cameras, Android smartphones, tablets, drones, and more. With a storage capacity of up to 4 hours of 1080P video or 7,000 photos, the LaView Micro SD card is a must-have for any photographer or videographer."
"SAMSUNG 32"" Odyssey G3 Ultrawide Gaming Monitor, 1500R Curved Display, 165Hz, 5ms, AMD FreeSync Premium, Borderless Design, Eye Saver Mode, Black (LC32G35TFQNXZA)","{'Specific Uses For Product': 'Gaming', 'Refresh Rate': '165 Hz', 'Brand': 'SAMSUNG', 'Screen Size': '32 Inches', 'Total HDMI Ports': '2'}","PANORAMIC IMMERSION: The Odyssey G35T Monitors 1500R curved display with futuristic design and ultrawide game view wraps around your vision to draw you right into the character's shoes and deliver more heart-pounding gaming. UPGRADED GAMING PERFORMANCE: 5ms response time and 165Hz refresh rate eliminates lag and motion blur for exhilarating gameplay with ultra-smooth action. AMD FREESYNC PREMIUM: Enjoy effortlessly smooth gameplay with AMD FreeSync Premium, which reduces screen tearing, stutter, and input latency. FULL SCREEN DESIGN: The monitors 3-sided borderless design unveils maximum space for bigger, bolder gameplay; Line up two displays precisely in a dual monitor setup, so no enemies slip through the crack. SEE THROUGH THE DARK: A whopping 3000:1 contrast ratio lets you see dangerous objects or enemies with greater clarity; Blacks are deeper and whites are brighter with more levels of shades in between.","Looking for an immersive and exciting gaming experience? Look no further than the Samsung Odyssey G3 32"" Ultrawide Gaming Monitor! With its 1500R curved display and ultrawide game view, you'll be right in the thick of the action. Plus, the 5ms response time and 165Hz refresh rate eliminates lag and motion blur for smooth, exhilarating gameplay. And with AMD FreeSync Premium, you'll enjoy effortlessly smooth gameplay with reduced screen tearing, stutter, and input latency. Plus, the borderless design unveils maximum space for bigger, bolder gameplay. So don't miss a beat – or a enemy – with the Samsung Odyssey G3 32"" Ultrawide Gaming Monitor!","Do you want to be the next eSports champion? Great! You're going to need a monitor that can handle all your enemies crowding the screen. With its 1500R curved display and ultrawide game view, you'll be right in the thick of the action. Plus, the 5ms response time and 165Hz refresh rate eliminates lag and motion blur for smooth, exhilarating gameplay. And with AMD FreeSync Premium, you'll enjoy effortlessly smooth gameplay with reduced screen tearing, stutter, and input latency. Plus, the borderless design unveils maximum space for bigger, bolder gameplay. So don't miss a beat – or a enemy – with the Samsung Odyssey G3 32"" Ultrawide Gaming Monitor!"
LG 32MN600P-B 31.5'' Full HD 1920 x 1080 IPS Monitor with AMD FreeSync with Display Port and HDMI Inputs (2020 Model),"{'Brand': 'LG', 'Screen Size': '32 Inches', 'Total HDMI Ports': '1', 'Hardware Interface': 'HDMI', 'Connectivity Technology': 'DisplayPort, HDMI'}","LG32MN600P-B 31. 5'' Full HD IPS Monitor with AMD FreeSync | Full HD (1920 x 1080) IPS Display | AMD FreeSync | Reader Mode | Flicker Safe | OnScreen Control | Wall Mountable. IPS technology highlights the performance of liquid crystal displays.  Response times are shortened, color reproduction is improved, and users can view the screen at virtually any angle.  | AMD FreeSync technology puts an end to choppy playback and broken frames with fluid, artifact-free performance at virtually any framerate. Flicker Safe reduces invisible flickering on the screen and provides a more comfortable working environment for your eyes with Reader Mode, which creates a screen with a color temperature similar to that of paper. Minimize input lag with Dynamic Action Sync so gamers can catch every single moment in real-time.  | Gamers can avoid snipers hiding in the darkest places using Black Stabilizer and quickly escape situations when the flash explodes.  | Using Crosshair, the target point is fixed in the center to enhance shooting accuracy. OnScreen Control - Easier User Interface.  You can customize the workspace by splitting the display or adjusting basic monitor options with just a few mouse clicks.  | Wall Mountable - Convenient and Flexible.  Mount the monitor to suit your work, entertainment, or gaming set up.","Introducing the LG 32MN600P-B 31.5'' Full HD IPS Monitor with AMD FreeSync. This monitor features a Full HD (1920 x 1080) IPS display, AMD FreeSync technology, Reader Mode, Flicker Safe, OnScreen Control, and Wall Mountable design. With IPS technology, response times are shortened, color reproduction is improved, and users can view the screen at virtually any angle. AMD FreeSync technology puts an end to choppy playback and broken frames with fluid, artifact-free performance at virtually any framerate. Flicker Safe reduces invisible flickering on the screen and provides a more comfortable working environment for your eyes. Minimize input lag with Dynamic Action Sync so gamers can catch every single moment in real-time. Gamers can avoid snipers hiding in the darkest places using Black Stabilizer and quickly escape situations when the flash explodes. Using Crosshair, the target point is fixed in","Game on with the LG 32MN600P-B 31.5'' Full HD IPS Monitor with AMD FreeSync.  This monitor features a Full HD (1920 x 1080) IPS display, AMD FreeSync technology, Reader Mode, Flicker Safe, OnScreen Control, and Wall Mountable design. With IPS technology, response times are shortened, color reproduction is improved, and users can view the screen at virtually any angle. AMD FreeSync technology puts an end to choppy playback and broken frames with a fluid, artifact-free performance at virtually any framerate. Flicker Safe reduces invisible flickering on the screen and provides a more comfortable working environment for your eyes. Minimize input lag with Dynamic Action Sync so gamers can catch every single moment in real-time. Get yours now!"
"LG 32GK650F-B 32"" QHD Gaming Monitor with 144Hz Refresh Rate and Radeon FreeSync Technology (Renewed)","{'Specific Uses For Product': 'Gaming', 'Refresh Rate': '144 Hz', 'Brand': 'LG', 'Screen Size': '32 Inches', 'Screen Surface Description': '32"" Flat'}","QHD resolution - watch games come to life with vibrant QHD clarity and Detail.  The precise 2560 x 1440 resolution and impressive 31. 5"" screen size combine for a thrilling, immersive gaming experience. Radeon FreeSync Technology - reduces the tearing and stuttering that occur between a graphic card's frame rate and a monitor's refresh rate enabling smoother motion and less stuttering in games. 144Hz refresh rate - games played on this monitor are noticeably smoother and clearer when compared to game play on monitors with refresh rates of 60Hz or 75Hz. Advanced gaming Features - dynamic action sync assures smooth, action while Black stabilizer reveals enhanced Detail in dark scenes.  The crosshair feature enhances accuracy in FPS games. Virtually Borderless - The ultra-thin bezel on three sides of this streamlined display offers a virtually borderless visual experience.","Introducing the LG 32GK650F-B 32"" QHD Gaming Monitor with 144Hz Refresh Rate and Radeon FreeSync Technology (Renewed). This monitor is perfect for gamers who want to enjoy smooth, clear game play with no tearing or stuttering. With a 144Hz refresh rate, QHD resolution, and virtually borderless display, this monitor provides an immersive gaming experience. Plus, the advanced gaming features make it easy to hit your target, even in the darkest scenes. So don't miss a beat, and experience the action like never before with the LG 32GK650F-B 32"" QHD Gaming Monitor."," This LG 32GK650F-B 32"" QHD Gaming Monitor with 144Hz Refresh Rate and Radeon FreeSync Technology (Renewed) is a great way to up your game and even do some work. This monitor is perfect for gamers who want to enjoy smooth, clear game play with no tearing or stuttering. With a 144Hz refresh rate, QHD resolution, and virtually borderless display, this monitor provides an immersive gaming experience. Plus, the advanced gaming features make it easy to hit your target, even in the darkest scenes. So don't miss a beat, and experience the action like never before with the LG 32GK650F-B 32"" QHD Gaming Monitor."
"Furinno Turn-N-Tube No Tools 3-Tier Entertainment Center TV Stand for TV up to 32 Inch, Plastic Round Tubes, Espresso/black","{'Mounting Type': 'Floor Standing', 'Brand': 'Furinno', 'Material': 'Wood', 'TV Size': '32 Inches', 'Color': 'Espresso', 'Minimum Compatible Size': '32 Inches', 'Compatible Devices': 'Televisions'}","Simple stylish design yet Functional and suitable for any room. Material: Engineered wood and PVC tubes. Fits in your space, fits on your budget. Sturdy on flat surface 5-minutes no tools no hassle assembly. Holds up to 32 inch flat screen panel and up to 50 lbs.  ; Product Dimension: 31.  5(W)x15.  8(D)x23.","Looking for a stylish and functional TV stand for your 32"" flat screen TV? Look no further than the Furinno Turn-N-Tube 3-Tier Entertainment Center TV Stand! Made of engineered wood and PVC tubes, this TV stand is sturdy and easy to assemble, with no tools required. It's also a great value for your money. So don't wait any longer, order your Furinno Turn-N-Tube TV Stand today!","Are you having trouble finding a TV stand that's got a lot of style, yet won't take up too much space? Look no further than the Furinno Turn-n-Tube 3-tier entertainment center TV Stand! This stylish TV stand is the ultimate combination of form and function. It's made from engineered wood and PVC tubes, so it's got a lot of style. So don't wait any longer, order your Furinno Turn-N-Tube TV Stand today!"
"Camelbak Products 1513101001 Chute Mag BPA-Free Water Bottle - 32oz, Clear","{'Material': ' ', 'Brand': 'CamelBak', 'Capacity': '1 Liters', 'Color': 'Clear', 'Unit Count': '1 Count'}",Drink quickly: magnet keeps top out of the way while you're drinking. Leak proof: leak proof when closed. Easy to carry: two finger carry handle. Easy to clean: cap and Vessel dishwasher safe.," CamelBak water bottles are perfect for anyone who wants an easy way to drink water on the go. These bottles are made out of BPA-free materials and are dishwasher safe, making them a safe and easy option for anyone looking for a water bottle."," CamelBak water bottles are perfect for anyone who wants an easy way to drink water on the go. These bottles are made out of BPA-free materials and are dishwasher safe, making them a safe and easy option for anyone looking for a water bottle."
"Poster Palooza 27x39 Contemporary Black Wood Picture Frame - UV Acrylic, Foam Board Backing, & Hanging Hardware Included!","{'Color': 'Black', 'Frame Material': 'Wood, shatter-resistant glass, foam board backing', 'Brand': 'Poster Palooza', 'Finish Type': 'Wood_grain', 'Shape': 'Rectangle', 'Style': 'Contemporary', 'Item Dimensions LxWxH': '40.1 x 28.1 x 0.5 inches', 'Mounting Type': 'Wall Mount', 'Item Display Dimensions': '39 x 0.5 x 27 x 0.5 inches'}"," COMPLETE WOOD PICTURE FRAME: Black Finish - Made To Display Photos, Artwork, Canvases, Chalk Boards, Documents, Mirrors, Puzzles, Mementos, Kids Drawings, Bulletin Boards, Diplomas, Certificates, and All Other Media Measuring 27x39 or 39x27 inches (67. 5x97. 5 or 97. 5x67. 5 cm).  PERFECT FIT EVERY TIME: Overall Frame Dimensions Measure 28. 5x40. 5 Inches.  ADD TO YOUR HOMES DECOR: Frame Moulding Width: 0. 75 Inches.  || Frame Rabbet (usable) Depth: 3/8 Inches.  DISPLAY WITH CONFIDENCE: Complete frame with UV Resistant Acrylic Front, Acid Free Foam Board Backing, and Hardware.  WALL HANGERS INCLUDED: Frame can be displayed vertically or horizontally.","Looking for a complete wood picture frame that will fit your 27x39 or 39x27 inch artwork? Look no further than Poster Palooza! Our frame is made with a black finish and includes UV resistant acrylic front, acid free foam board backing, and hanging hardware. Plus, our frame can be displayed vertically or horizontally. Order your Poster Palooza frame today!","Artwork ruined by sticky tape? Poster Palooza offers a 27x39 and 39x27 wood picture frame that will make your artwork look terrific. Our frame is made with a black finish and includes UV resistant acrylic front, acid free foam board backing, and hanging hardware. Plus, our frame can be displayed vertically or horizontally. Order your Poster Palooza frame today!"
