Name,Specs,Features,GPT3-Outputs,Brians_custom_descriptions
"HP Pavilion 16.1 inch Gaming Laptop (1920x1080) FHD 144Hz , Intel Core i5-10300H, NVIDIA GeForce GTX 1660 Ti with Max-Q Design, 8GB RAM, 512GB SSD+32GB Optane, Windows 10 Home","{'Series': '16a0032dx', 'Brand': 'HP', 'Specific Uses For Product': 'Gaming', 'Screen Size': '16.1 Inches', 'Operating System': 'Windows 10', 'Human Interface Input': 'Keyboard', 'CPU Manufacturer': 'Intel', 'Card Description': 'Dedicated', 'Color': 'Shadow Black', 'Hard Disk Size': '512 GB'}","Windows 10 Home, 16. 1 inch FHD 144Hz refresh rate display. Intel Core i5-10300H 2. 5GHz , NVIDIA GeForce GTX 1660TI 6GB,. 8GB DDR4 (2*Slots), 512GB SSD+32 Optane. 2x USB 3. 0 Type A, 1x USB 3. 0 Type C , 1x HDMI Outputs, 1x Ethernet Ports and 1x Headphone/microphone combo jack. Backlit keyboard, Wireless-AC Bluetooth 5.","Looking for a powerful gaming laptop that won't break the bank? Check out the HP Pavilion 16.1 inch Gaming Laptop. With a 144Hz refresh rate display, Intel Core i5 processor and NVIDIA GeForce GTX 1660 Ti graphics card, this laptop can handle the most demanding games. Plus, with 8GB of RAM and a 512GB SSD, you'll have plenty of storage for all your games and other files. And with Windows 10 Home pre-installed, you'll be up and running right out of the box. So don't wait any longer, order your HP Pavilion 16.1 inch Gaming Laptop today!","You deserve a gaming laptop that won't break the bank, and the HP Pavilion 16.1 inch Gaming Laptop is just that. With a powerful processor and stunning graphics, this laptop is perfect for gaming on the go. It features a 144Hz refresh rate display, Intel Core i5 processor and NVIDIA GeForce GTX 1660 Ti graphics card, this laptop can handle the most demanding games. Plus, with 8GB of RAM and a 512GB SSD, you'll have plenty of storage for all your games and other files. And with Windows 10 Home pre-installed, you'll be up and running right out of the box. So don't wait any longer, order your HP Pavilion 16.1 inch Gaming Laptop today!"
Ross-Simons 14kt Yellow Gold Double Oval-Link Bracelet,"{'Material': 'Yellow Gold', 'Brand': 'Ross-Simons', 'Item Weight': '3.3 Grams', 'Metal Type': 'Yellow Gold'}","14KT YELLOW GOLD 14kt yellow gold double oval-link bracelet.  Polished finish.  8 in.  long.  1/4 in.  wide.  3. 3 grams.  Lobster clasp. IDEAL FOR EVERYDAY WEAR With its essential design, this classic bracelet wears well whether youre running errands, in the office or out with the girls. HANDCRAFTED Wear our timeless bracelet with pride, knowing that extra care and attention to detail was given in its creation.  The craftsmanship and unmatched quality of this piece is sure to make it a favorite for years to come. THE PERFECT GIFT FOR HER This is the ideal gift for your sister, daughter, mom, wife, niece, aunt, best friend, girlfriend or yourself! Whether she prefers modern or traditional jewelry, Ross-Simons has a wide selection of bracelets, earrings, necklaces and rings to choose from.","Looking for a classic and timeless bracelet that can be worn every day? Look no further than the Ross-Simons 14kt Yellow Gold Double Oval-Link Bracelet. Handcrafted with care and attention to detail, this bracelet is perfect for any occasion. Made from 14kt yellow gold, this bracelet is polished to a shine and features a lobster clasp. It's the perfect gift for her!","Is your style classic and timeless? Then the Ross-Simons 14kt Yellow Gold Double Oval-Link Bracelet is perfect for you! Wear it every day to add a touch of elegance to your look. Handcrafted with care and attention to detail, this bracelet is perfect for any occasion. Made from 14kt yellow gold, this bracelet is polished to a shine and features a lobster clasp. It's the perfect gift for her!"
Men's Flat Cuban Chain - Two Tone Diamond Cut - 14k Gold Over Solid 925 Sterling Silver - Made In Italy - 5mm 6mm 8mm 10mm,{},"Solid 925 Sterling Silver Chain - Two Tone Diamond Cut - Made In Italy Mens Or Ladies Necklace. 4-10mm 18-30"" So You Can Wear It As A Short Choker Or As A Longer Hip Hop Cuban Link Chain. Solid And Heavy.  Ranges From 12 Grams For A 5mm To Almost 90 Grams For A 10mm 30"". Wear It Alone Or With Your Favorite Jesus Piece Or Pendant Charm!. Wont Change Color.  Handmade In Italy With Solid 925 Sterling Silver.","Looking for a luxurious, solid gold chain? Look no further than the Men's Flat Cuban Chain from Italian jewelers. This two-tone diamond cut chain is made from the finest 925 sterling silver and plated with 14k gold. It's available in a range of sizes from 5mm to 10mm, and can be worn as a short choker or long hip hop Cuban link chain. With a weight of 12 grams for the 5mm size and up to 90 grams for the 10mm size, this chain is built to last. Whether you wear it alone or with your favorite pendant or charm, the Men's Flat Cuban Chain is a must-have for any jewelry collection.","Looking for an impressive, luxurious men's chain? The Men's Flat Cuban Chain from Italian jewelers is crafted from solid gold and is sure to turn heads. This two-tone diamond cut chain is made from the finest 925 sterling silver and plated with 14k gold. It's available in a range of sizes from 5mm to 10mm, and can be worn as a short choker or long hip hop Cuban link chain. With a weight of 12 grams for the 5mm size and up to 90 grams for the 10mm size, this chain is built to last. Whether you wear it alone or with your favorite pendant or charm, the Men's Flat Cuban Chain is a must-have for any jewelry collection."
"14k Yellow Gold Charm and Pendant, for Women",{},"PREMIUM QUALITY: Elegantly Crafted in Highest Quality 14k yellow-gold for Luxurious Shine and Feel. PRODUCT DETAILS: Material: Primary - Purity:14K|Length of Item:25 mm|Charm/Element Length:25 mm|Charm/Element Width:15 mm|Material: Primary:Gold|Width of Item:15 mm|Pendant/Charm Type:Themed|Profile Type:Flat Back|Material: Primary - Color:Yellow. FINE JEWELRY: Presenting our sophisticated Jewelry collection to complement every occasion and outfit.  All products are checked by in-house GIA Certified Gemmologist. BUY WITH CONFIDENCE: Based in the US, Diamond2Deal, born in New York City is a family-owned, privately held company.  Quality, Superior Craftsmanship and Eye for Detail is our Passion.  Our Products reflects our passion and dedication. READY FOR GIFTING: Ideal gift for your wife, girlfriend, mother, mother in law, son ,grandma, best friend, girls, anniversary, wedding, engagement, thanksgiving, Christmas and Graduation.  Comes with a Free Attractive Gift Box.","Introducing the 14k Yellow Gold Charm and Pendant, for Women. This elegant piece is crafted from the highest quality 14k yellow gold for a luxurious shine and feel. It features a flat back and a themed pendant/charm type. It's the perfect addition to any outfit and makes a great gift for any occasion.","Introducing the 14k Yellow Gold Charm and Pendant, for Women. This elegant piece is crafted from the highest quality 14k yellow gold for a luxurious shine and feel. It features a flat back and a themed pendant/charm type. It's the perfect addition to any outfit and makes a great gift for any occasion."
LIFETIME JEWELRY Cuban Link Chain Necklace 24k Gold Plated for Men and Women (6mm & 9.5mm),{}," This SOLID ( not hollow inside ) Diamond Cut Miami Link Chain is MADE TO LAST with up to 20X more 24 karat real gold plating than standard electroplated fashion jewelry; Choice of width 6mm ( ~ 1/4 inch ) or 9. 5mm ( ~ 3/8 inch ) ; Available in 18 20 22 24 26 30 and 36 inches; Choice of Gold or White Gold (Rhodium).  MADE IN USA since 1987 by a small family run business; Comes in a black velvet pouch for easy gift giving; While other plated gold necklaces for teen boys girls men & women would break, tarnish, look fake or turn your neck green, our jewelry is strong & durable.  Lifetime Jewelry is the NEXT BEST THING TO SOLID GOLD, one of our customers said recently; You can get ten of ours for every piece of 14k or 18k you buy.  Wear this gorgeous GOLD CURB CHAIN with confidence, as not even your jeweler will know this is not solid gold.","Looking for a high-quality gold chain necklace that won't break the bank? Look no further than Lifetime Jewelry's Cuban Link Chain Necklace! Made with up to 20X more 24 karat real gold plating than standard electroplated fashion jewelry, this necklace is built to last. It's available in 18"", 20"", 22"", 24"", 26"", 30"" and 36"" lengths and in either gold or white gold (rhodium) plating. Plus, it comes in a black velvet pouch for easy gift giving. Don't settle for less than the best - choose Lifetime Jewelry!","On a budget but still want a high-quality gold chain necklace? Look no further than Lifetime Jewelry's Cuban Link Chain Necklace! Made with up to 20X more 24 karat real gold plating than standard electroplated fashion jewelry, this necklace is built to last. It's available in 18"", 20"", 22"", 24"", 26"", 30"" and 36"" lengths and in either gold or white gold (rhodium) plating. Plus, it comes in a black velvet pouch for easy gift giving. Don't settle for less than the best - choose Lifetime Jewelry!"
"14K Gold 2MM Italian Figaro Link Chain Necklace- 14K Necklaces, 14K Figaro Chain Necklace,Women Girls Men Boys Necklace14K Gold 16"" 18"" 20"" 22"" 24 30""",{},"AN IMMEDIATE ENTRY TO CLASS and ELEGANCE : Authentic Italian Made 14K GOLD Figaro Link Chain with a remarkable Design.  An Instant entry to a Standard of Class and a Wealthy Look. A SENSATIONAL SHINE- A Certified 14K Classic Figaro Link Chain is a well built, carefully built , and a True Comfort Fit Chain! A Premiere way to Improve and protect excellence in your style.  An easy way to feel the wealth. JOIN THE WEALTH- A 14K Authentic Chain for those who set the bar high! Discover a new Unique chain that will guarantee to accentuate your look.  A feeling of wealth is a feeling of Happiness. 14K GOLD & NICKEL FREE - HYPOALLERGENIC - No more rashes.  Great for all skin types.  An Authentic 14K Gold Chain that will achieve the ultimate happiness.  Complete satisfaction guaranteed. HIGH SHINE GLAMOUR- Confidence is a virtue- Feel confident to be confident.  A real 14K Gold chain that will not break or bend.","Introducing the 14K Gold 2MM Italian Figaro Link Chain Necklace! This beautiful necklace is made from authentic Italian 14K gold, and is designed to add a touch of class and elegance to any outfit. The necklace is also hypoallergenic and nickel-free, making it perfect for those with sensitive skin. With its high shine and glamour, this necklace is sure to turn heads and make you feel confident and stylish. Order yours today and experience the ultimate in luxury and happiness!","Introducing the 14K Gold 2MM Italian Figaro Link Chain Necklace! This beautiful necklace is made from authentic Italian 14K gold, and is designed to add a touch of class and elegance to any outfit. The necklace is also hypoallergenic and nickel-free, making it perfect for those with sensitive skin. With its high shine and glamour, this necklace is sure to turn heads and make you feel confident and stylish. Order yours today and experience the ultimate in luxury and happiness!"
"14k White Gold Rope Chain Barely-There Necklace For Women (0.7 mm, 0.9 mm, 1 mm or 1.3 mm) - Thin And Lightweight",{},"MATERIAL - This chain is made with 100% real 14 karat white gold.  It is not gold plated, not gold filled, not gold over sterling silver.  This necklace is stamped 14k. DIMENSIONS - This rope chain is 0. 7 millimeters wide and 14 inches or 35. 5 centimeters long (very short like a choker).  This 14k white gold chain is thin and lightweight.  It secures with a spring ring clasp. TARNISH PROOF - This chain will not tarnish nor change color and will not turn the skin green.  It can be worn in the shower, while swimming, and at the gym.  This chain withstands water and sweat. GIFT READY - Our jewelry is shipped in an elegant gift box or pouch, perfect for any occasion such as anniversary, birthday, Christmas, Mother's Day, Valentine's Day, Wedding, Father's Day and others. WHY CHOOSE US - We are a 40 year old US based company from New York City and have been successfully selling on Amazon since 2004.  Shop with confidence and enjoy a 30-day, 100% money-back guarantee.","Looking for a beautiful, minimalist necklace that you can wear every day? Look no further than this 14k white gold rope chain necklace. This necklace is made with real 14k white gold, and is very lightweight and thin. It's the perfect length for wearing as a choker, and it comes in a beautiful gift box, making it perfect for any occasion. Plus, our 100% money-back guarantee means you can shop with confidence.","Introducing the new 14k white gold rope chain necklace! This minimalist necklace is perfect for everyday wear, and its simple design makes it a versatile piece that can be dressed up or down. This necklace is made with real 14k white gold, and is very lightweight and thin. It's the perfect length for wearing as a choker, and it comes in a beautiful gift box, making it perfect for any occasion. Plus, our 100% money-back guarantee means you can shop with confidence."
"Kiera Grace Matted Classic Langford Picture Frame, 14"" x 14"", Black","{'Color': 'Black', 'Frame Material': 'Engineered Wood, Glass, Wood', 'Brand': 'Kiera Grace', 'Finish Type': 'Espresso', 'Shape': 'Square', 'Style': 'Single Frame', 'Item Dimensions LxWxH': '14 x 0.5 x 14 inches', 'Mounting Type': 'Wall Mount', 'Item Display Dimensions': '0.5 x 16.25 inches', 'Item Weight': '3 Pounds'}","HOLDS 7 X 7 IN DISPLAY Opening measures 14"" x 14""; you can hold your 7 x 7 photos in the acid-free mat.  Hold all your memories in beautiful frames. MADE OF WOOD FIBER IN A VARIETY OF PAINTED FINISHES - This elegant, minimal frame will house your favourite memories beautifully.  The Langford is made of quality MDF and comes in a smooth finish. TIMELESS, MINIMAL STYLE - Youll love the compliments you get with Langford frames.  This frame has a timeless, neutral look that matches many decor styles; youll keep for years.  Display art and photo prints of friends, family, vacations, and more!. GLASS COVER - This frame has a glass front that will keep your memories looking beautiful for a long time.  The glass protects from wear and damage, keeping your display safe. HORIZONTAL AND VERTICAL TRIANGLE HANGERS - Dont know what picture you are going to use this frame for? No problem! Lightweight, easy to place triangle hangers make the frame versatile; use the Langford for horizontal or vertical images.","The Kiera Grace Matted Classic Langford Picture Frame is a beautiful way to display your favorite memories. The frame is made of quality wood fiber and comes in a smooth finish, with a glass front that protects your display from wear and damage. The frame also features horizontal and vertical triangle hangers, making it versatile for displaying either horizontal or vertical images.","The Kiera Grace Matted Classic Langford Picture Frame is a beautiful way to display your favorite memories. The frame is made of quality wood fiber and comes in a smooth finish, with a glass front that protects your display from wear and damage. The frame also features horizontal and vertical triangle hangers, making it versatile for displaying either horizontal or vertical images."
"Frame Amo Black 14x17 Picture or Poster Frame, 1 inch Wide Border, Smooth Finish, Acrylic Front","{'Color': 'Black', 'Brand': 'Frame Amo', 'Finish Type': 'Wood_grain', 'Shape': 'Rectangle', 'Style': 'Modern', 'Item Dimensions LxWxH': '15.5 x 18.5 x 0.6 inches', 'Mounting Type': 'Tabletop, Wall, or Freestanding', 'Item Weight': '1.9 Pounds'}","Black Color.  Fits 14x17 inch picture exactly, displays 13. 5 x 16. 5.  Please MEASURE YOUR PICTURE before buying.  Wood MDF (composite) material.  Acrylic front (NOT GLASS). BORDER and BACKING: Border width: 1 inch.  Thickness: 0. 6 inch.  Black backboards and back hooks for hanging frame (Landscape and Portrait). EXACT FIT: The size you choose equals the picture size which fits the frame entirely without matting.  e. g. , 16x24 frame fits 16x24 picture exactly, but the frame will hold 0. 5 inch of the picture and display 15. 5 x 23. 5 inch.  The outer dimensions are 1. 5 inch larger than the picture.  e. g. , 16x24 frame has 17. 5 x 25. 5 inch outer dimensions. FULLY ASSEMBLED: The frames will arrive fully assembled.  Please hang these frames using the already installed back hooks.  Do not hang by the frame border itself.  Display picture is included as shown.  These frames have no matting. QUALITY: Smooth surface finish and front face that will complement your displays.  Suitable for Photos, Posters, Documents, Certificates, and more.","Introducing the Frame Amo Black 14x17 Picture or Poster Frame! This stylish frame is perfect for displaying your favorite photos, posters, documents, and more. The black color and modern design will complement any home or office decor. The frame is made of durable wood MDF material and has an acrylic front (NOT GLASS). It also features a 1 inch wide border and comes with back hooks for hanging. The frame arrives fully assembled and makes a great gift for any occasion. Order yours today!","Introducing the Frame Amo Black 14x17 Picture or Poster Frame! This stylish frame is perfect for displaying your favorite photos, posters, documents, and more. The black color and modern design will complement any home or office decor. The frame is made of durable wood MDF material and has an acrylic front (NOT GLASS). It also features a 1 inch wide border and comes with back hooks for hanging. The frame arrives fully assembled and makes a great gift for any occasion. Order yours today!"
"Craig Frames 1WB3BK 14 by 18-Inch Picture Frame, Smooth Wrap Finish, 1-Inch Wide, Black","{'Color': 'Black', 'Frame Material': 'Engineered Wood', 'Frame Type': 'Single Picture Frame', 'Brand': 'Craig Frames', 'Finish Type': 'Matte', 'Shape': 'Rectangle', 'Style': 'Contemporary', 'Item Dimensions LxWxH': '15.5 x 0.75 x 19.5 inches', 'Mounting Type': 'Wall Mount', 'Item Display Dimensions': '13.5 x 17.5 inches'}","Contemporary style; black; smooth laminate wrap finish. Frame includes: clear acrylic facing, rigid cardboard backing and wire hanging hardware kit (some assembly required). Frame holds a 14 inch by 18 inch photo/print/poster (viewable area reduced by. 25"" on each side due to frame lip). Frame moulding is 1 inches wide; solid MDF construction.","Looking for a sleek and stylish frame to show off your favorite 14x18 print? Look no further than the Craig Frames 1WB3BK! This contemporary frame features a black finish and smooth laminate wrap, and comes complete with clear acrylic facing, rigid cardboard backing, and wire hanging hardware kit. Plus, the frame moulding is a full 1 inch wide for a truly dramatic look. Order your Craig Frames 1WB3BK today!","Sleek and stylish 14x18 frame perfect for your favorite print! Check out Craig Frames 1WB3BK! This contemporary frame features a black finish and smooth laminate wrap, and comes complete with clear acrylic facing, rigid cardboard backing, and wire hanging hardware kit. Plus, the frame moulding is a full 1 inch wide for a truly dramatic look. Order your Craig Frames 1WB3BK today!"
"Craig Frames 7171610BK 14 by 20-Inch Picture/Poster Frame, Wood Grain Finish, 0.825-Inch Wide, Solid Black","{'Color': 'Black', 'Frame Material': 'Plastic, Wood', 'Brand': 'Craig Frames', 'Finish Type': 'Wood_grain', 'Style': 'Traditional', 'Item Dimensions LxWxH': '15.5 x 0.75 x 21.5 inches', 'Mounting Type': 'Wall Mount', 'Item Weight': '3 Pounds'}","Traditional style; black; wood grain finish. Frame includes: clear acrylic facing, rigid cardboard backing and wire hanging hardware kit (some assembly required). Frame holds a 14 inch by 20 inch photo/print/poster (viewable area is slightly smaller). Frame moulding is. 825 inch wide; solid wood. Made in the U. S. A.","Looking for a classic, black frame to showcase your 14x20 photos or artwork? Check out the Craig Frames 7171610BK! This frame has a wood grain finish that will give your space a traditional touch. Plus, it comes with all the hardware you need for easy installation. Order your Craig Frames 7171610BK today!","Looking for a classic, black frame to showcase your 14x20 photos or artwork? Check out the Craig Frames 7171610BK! This frame has a wood grain finish that will give your space a traditional touch. Plus, it comes with all the hardware you need for easy installation. Order your Craig Frames 7171610BK today!"
"Inateck 15-15.6 Inch Shockproof Laptop Sleeve Case Briefcase Bag Water Resistant for Laptops, Notebooks, Ultrabooks, Netbooks - Black","{'Form Factor': 'Case', 'Brand': 'Inateck', 'Color': 'Black', 'Special Feature': 'Water Resistant', 'Material': 'Polyester'}","Compatible With: Internal dimensions: 15. 7"" X 11"" X 0. 8''; external dimensions: 16. 5"" X 12. 2"" X 1. 6''.  Compatible with 15-15. 6'' laptops/chromebooks/ultrabooks/netbooks. PLEASE NOTE: too large for MacBook Pro 15. Excellent Material: The woven exterior utilizes Liquid proof 600D wear-resistant polyester fabric to protect your Device against accidental spills. Safer Zipper Design: Special side-zipper design makes your laptop far from being dropped accidentally; big side pocket can store enough accessories such as your phone, iPad, mouse, Power charger, etc. Great Protection: Wearable woven of exterior, soft flannelette inner lining provide you laptop 360 degrees of protection. Shockproof: With five layers of premium materials, this case is durable against bumps or shocks.","Introducing the Inateck 15-15.6 Inch Shockproof Laptop Sleeve Case Briefcase Bag – the perfect way to protect your laptop from accidental spills and shocks. Made from durable 600D polyester fabric, this case is wear-resistant and features a side-zipper design that prevents your laptop from being dropped. The soft flannelette inner lining provides 360 degrees of protection, while the five layers of premium materials make this case durable and shockproof. Don't risk damaging your laptop – get the Inateck 15-15.6 Inch Shockproof Laptop Sleeve Case Briefcase Bag today!","Introducing the Inateck 15-15.6 Inch Shockproof Laptop Sleeve Case Briefcase Bag – the perfect way to protect your laptop from accidental spills and shocks. Made from durable 600D polyester fabric, this case is wear-resistant and features a side-zipper design that prevents your laptop from being dropped. The soft flannelette inner lining provides 360 degrees of protection, while the five layers of premium materials make this case durable and shockproof. Don't risk damaging your laptop – get the Inateck 15-15.6 Inch Shockproof Laptop Sleeve Case Briefcase Bag today!"
"12x18 Black Picture Frames Set of 6, Gallery Poster Frame Made to Display 12 by 18 Inch Photos for Wall Hanging","{'Color': 'Black 12x18', 'Frame Material': 'Engineered Wood', 'Brand': 'Lavezee', 'Finish Type': 'Wood_grain', 'Shape': 'Rectangle', 'Mounting Type': 'Wall Mount'}","FOR 12 by 18 INCH POSTER PICTURES: Each black frame holds a 12x18 image without mat.  The actual frame size (finished size) is 12. 9 x 18. 9 inches. SAFE MATERIALS: 12x18 black frame is crafted from synthetic wood, and each frame with a clear PS front that gives a good view of your poster and preserves your movie posters, photos or song lyrics, etc. About The Package (Set of 6) 12x18 picture frames came nicely packaged with lots of bubble wrap that ensure safe delivery of those picture frames. SIMPLE AND CONTEMPORARY STYLE: The 12X18 black frames with modern style would add much charm to your picture/photo/print/artwork.  The black color fits any design styles of your bedroom, gallery or office. WALL HANGING ONLY: Each 12x18 frame with adjustable tabs for your easy setting.  And it includes ready-to-hang durable hangers on the cardboard backing, ready for hanging vertically or horizontally on the wall. WIDE USAGE: Our 12x18 frames set includes 6 pack, they will not only give a distinct view of your poster pictures, keep your cherished memories and protect your photographs, but also serve as meaningful gift for friends or special person.","Looking for a way to display your 12x18 inch photos? Look no further than this black picture frame set from Lavezee! This set of 6 frames is crafted from synthetic wood, with a clear PS front that gives a good view of your poster and preserves your movie posters, photos or song lyrics. The simple, contemporary style of these black frames will add charm to any room, and they're ready to hang vertically or horizontally on the wall.","Searching for the perfect way to show off your 12x18 inch photos? Look no further than this black picture frame set from Lavezee! This set of 6 frames is crafted from synthetic wood, with a clear PS front that gives a good view of your poster and preserves your movie posters, photos or song lyrics. The simple, contemporary style of these black frames will add charm to any room, and they're ready to hang vertically or horizontally on the wall."
