Name,Specs,Features,GPT3-Outputs,Brians_custom_descriptions
You Are The Best Boyfriend Ever: Sentimental Gift For That Beloved Boyfriend Who Already Has Everything/ Journal Notebook / Anniversary /Birthday / Graduation /,{},,"You are the best boyfriend ever! No matter what the occasion, this sentimental gift will let your boyfriend know how much you care. The You Are the Best Boyfriend Ever journal notebook is the perfect way to say “I Love You” on any day.","You're the best boyfriend in the world! This heartfelt present will show your guy how much you care no matter what the occasion. On any given day, the You Are the Best Boyfriend Ever diary notebook is the ideal way to say ""I Love You."""
BaBylissPRO Nano Titanium Spring Curling Iron,"{'Hair Type': 'All', 'Size': '1.25 Inch (Pack of 1)', 'Color': 'Blue and Black', 'Brand': 'BaBylissPRO', 'Material': 'Titanium'}",,"Looking for a curling iron that can do it all? Look no further than the BaBylissPRO Nano Titanium Spring Curling Iron. This versatile tool can be used on all hair types, and the titanium construction ensures even heat distribution for consistent results. Plus, the 1.25-inch barrel is perfect for creating a variety of styles.","Do you need a curling iron that can do it all? The BaBylissPRO Nano Titanium Spring Curling Iron is the answer. This versatile tool can be used on all hair types, and the titanium construction ensures even heat distribution for consistent results. Plus, the 1.25-inch barrel is perfect for creating a variety of styles."
"MIXPOWER 50 Pieces 1/4"" Dr. Impact Socket Set, CR-V, 6 Point, SAE/Metric, 5/32 Inch - 9/16 Inch, 4mm - 15mm, Shallow/Deep","{'Brand': 'MIXPOWER', 'Item Dimensions LxWxH': '10.59 x 8.58 x 2.36 inches', 'Material': 'Chrome Vanadium Steel', 'Finish Type': 'Black phosphate finish', 'Number Of Pieces': '50'}","High-quality CR-V SteelMade from drop forged and heat treated chrome vanadium steel (50BV30) with black phosphate finish, providing the durability for a hard use. Set Includes1/4""Dr.  deep/shallow (SAE) : 5/32"",3/16"", 7/32"", 1/4"", 9/32"", 5/16"", 11/32"", 3/8"", 7/16"", 1/2"", 9/16"" and 1/4""Dr.  deep/shallow (Metric) : 4mm, 4. 5mm, 5mm, 5. 5mm, 6mm, 7mm, 8mm, 9mm, 10mm, 11mm, 12mm, 13mm, 14mm, 15mm. High-torqueRadius corner, 6-point drive design turns the flat sides of the fastener and provide maximum torque, while not peeling and damaging the corners. Dual Size MarkingsHigh-contrast laser etched with high-visibility markings and hard stamped with size labels, ensure permanent socket identification. Service GuaranteeAll MIXPOWER Tools meet or exceed ANSI performance standards.  It comes with 1 year quality guarantee.","Looking for a durable and reliable socket set? Look no further than the MIXPOWER 50 Pieces 1/4"" Dr. Impact Socket Set! Made of high-quality CR-V steel, this set is built to last. It includes shallow and deep sockets in both SAE and metric sizes, so you're sure to have the right tool for the job. The 6-point drive design provides maximum torque, while the black phosphate finish ensures lasting durability. Plus, the dual size markings make it easy to find the right socket every time. With a 1 year quality guarantee, you can be sure that the MIXPOWER 50 Pieces 1/4"" Dr. Impact Socket Set is a wise investment for any serious DIYer or professional.","Are you looking for a long-lasting and dependable socket set? The MIXPOWER 50 Piece 1/4"" Dr. Impact Socket Set is the answer! The MIXPOWER 50 Piece 1/4"" Dr. Impact Socket Set is the perfect solution! This set is made of durable CR-V steel. It includes shallow and deep sockets in both SAE and metric sizes, so you're sure to have the right tool for the job. The 6-point drive design provides maximum torque, while the black phosphate finish ensures lasting durability. Plus, the dual size markings make it easy to find the right socket every time. With a 1 year quality guarantee, you can be sure that the MIXPOWER 50 Pieces 1/4"" Dr. Impact Socket Set is a wise investment for any serious DIYer or professional."
Cable Matters 5-Pack 1/4 to 1/8 Headphone Adapter,"{'Connector Type': 'Auxiliary', 'Brand': 'Cable Matters', 'Warranty Type': 'Lifetime', 'Number of Ports': '2', 'Compatible Devices': 'Headphones, Amplifiers'}",Re-engineered 1/4 to 3. 5mm adapter made of solid copper for improved durability and longevity. 5-pack 3. 5mm to 1/4 adapter allows a 6. 35mm (1/4 inch) stereo port to accept a stereo cable with a standard 3. 5mm (1/8 inch) plug. The headphone jack adapter connects headphones to audio devices such as amplifiers or AV receivers with headphone jack. Convenient and cost-effective 5-pack 1/8 to 1/4 adapter provides spare or replacement adapters to use on different audio systems. Gold-plating 3. 5 mm to 1/4 adapter resists corrosion and ensures minimal signal loss.  The 6. 35 to 3.,"Looking for a way to connect your headphones to your amplifier or AV receiver? Look no further than the Cable Matters 5-Pack 1/4 to 1/8 Headphone Adapter. This adapter is made of solid copper for improved durability and longevity, and allows a 6.35mm (1/4 inch) stereo port to accept a stereo cable with a standard 3.5mm (1/8 inch) plug. The gold-plating resists corrosion and ensures minimal signal loss. With this 5-pack, you'll have plenty of adapters to use on different audio systems.","Need a way to connect your headphones to your amplifier or AV receiver? Cable Matters has the perfect solution with their 5-pack of 1/4 to 1/8 headphone adapters. Check out the Cable Matters 5-Pack 1/4 to 1/8 Headphone Adapter.This adapter is made of solid copper for improved durability and longevity, and allows a 6.35mm (1/4 inch) stereo port to accept a stereo cable with a standard 3.5mm (1/8 inch) plug. The gold-plating resists corrosion and ensures minimal signal loss. With this 5-pack, you'll have plenty of adapters to use on different audio systems."
"COSTWAY Compact Refrigerator, 3.2 cu ft. Unit 2-Door Freezer Cooler Fridge with Reversible Door, Removable Glass Shelves, Mechanical Control, Recessed Handle for Dorm, Office, Apartment (White)","{'Color': 'White', 'Finish Type': 'Matte', 'Brand': 'COSTWAY', ' Form Factor ': 'Compact', 'Pattern': 'Solid', 'Configuration': 'Compact Internal Freezer', 'Cooling Method': 'Compressor', 'Item Dimensions LxWxH': '19.5 x 19 x 34 inches', 'Inverter Type': 'Has Inverter', 'Lock Type': 'Electronic'}","Powerful Performance This refrigerator cools quickly and evenly, and refrigerator will keep ice frozen solid and foods perfectly chilled.  Our compact refrigerator is an excellent value that will bring years of quiet, reliable use. Crisper DrawerThis premium refrigerator comes with a crisper drawer, which is designed for your fruit and vegetables to keep them fresh.  It can also better plan food in the refrigerator. 2-Door Design Our refrigerator has large 2. 2 cu.  ft.  fresh food capacity gives you the space to keep foods organized and 1 cu.  ft.  freezer capacity give you room to store frozen foods.  And the two refrigerator exterior doors allows you to access the freezer or the refrigeration compartment. Removable Glass ShelfThe refrigerator glass shelf can be removed or adjusted if you want to organize taller things.  And this refrigerator also offers convenience for cleaning. Freezer CompartmentSeparate freezer compartment chills your ice cream all summer, and the included ice tray can make ice cubes to keep your drinks cool.","Looking for a powerful and compact fridge that will keep your food perfectly chilled? Look no further than the COSTWAY Compact Refrigerator! This fridge features a 2-door design, removable glass shelves, and a separate freezer compartment – perfect for storing all your favorite food and drinks. Plus, the sleek white finish will complement any kitchen décor.","If you're in the market for an energy-efficient and compact fridge that will keep your food perfectly chilled, the COSTWAY Compact Refrigerator is a great option. This fridge features a 2-door design, removable glass shelves, and a separate freezer compartment – perfect for storing all your favorite food and drinks. Plus, the sleek white finish will complement any kitchen décor."
Aqueon NeoGlow LED Aquarium Kit,"{'Brand': 'Aqueon', 'Color': 'Orange', 'Material': 'Glass', 'Item Dimensions LxWxH': '20.25 x 10.5 x 13.13 inches', 'Shape': 'Rectangular'}","Aquariums featuring bright colors that pop. Low profile hood with blue colored LED lights showcase the bright colors inside the aquarium. Includes 3 vibrant plants, multi-colored gravel, black background to highlight fish while hiding power cords, water conditioner, fish food, thermometer, fish net and setup guide. Also includes Aqueon 50W preset heater, calibrated to keep your fish tank at 78.","Looking for a stylish and modern aquarium that will brighten up any room? Check out the Aqueon NeoGlow LED Aquarium Kit! This eye-catching aquarium features bright colors that pop, thanks to the low profile hood with blue colored LED lights. It also includes 3 vibrant plants, multi-colored gravel, black background to highlight fish while hiding power cords, water conditioner, fish food, thermometer, fish net and setup guide. Plus, the Aqueon 50W preset heater ensures that your fish tank is always at the perfect temperature.","Looking for an aquarium that will add a touch of style and modernity to your home? Check out the Aqueon NeoGlow LED Aquarium Kit! This eye-catching aquarium features bright colors that pop, thanks to the low profile hood with blue colored LED lights. It also includes 3 vibrant plants, multi-colored gravel, black background to highlight fish while hiding power cords, water conditioner, fish food, thermometer, fish net and setup guide. Plus, the Aqueon 50W preset heater ensures that your fish tank is always at the perfect temperature."
"Rubbermaid Commercial Products Fg295700Gray Plastic Resin Deskside Wastebasket, 10 Gallon/41 Quart, Gray","{'Color': 'Gray', 'Brand': 'Rubbermaid Commercial Products', 'Capacity': '10.25 Gallons', 'Material': 'Plastic', 'Finish Type': 'Painted', 'Item Dimensions LxWxH': '15.75 x 22.83 x 22.44 inches', 'Shape': 'Rectangular', 'Opening Mechanism': 'Swing-Lid', 'Item Weight': '0.9 Pounds'}","Space-efficient, economical, and an easy and an effective way to recycle. All-plastic construction wont chip, rust or dent. Fits under standard height desk. Great for conference rooms, registers, admissions, display rooms, gift shops, housekeeping, offices, shops, and more. Rolled rims add strength, and are easy to clean. A solution for home, office, and more. Recycling and side bin options available. Made in the usa.","Looking for a reliable and easy-to-use wastebasket? Look no further than the Rubbermaid Commercial Products Fg295700Gray Plastic Resin Deskside Wastebasket! This wastebasket is space-efficient, economical, and an easy and effective way to recycle. Made in the USA from all-plastic construction that won't chip, rust or dent, this wastebasket is a great solution for your home, office, or more. It even fits under standard height desks!","The Rubbermaid Commercial Plastic Resin Deskside Wastebasket is a reliable and easy-to-use wastebasket that is perfect for your needs! This wastebasket is space-efficient, economical, and an easy and effective way to recycle. Made in the USA from all-plastic construction that won't chip, rust or dent, this wastebasket is a great solution for your home, office, or more. It even fits under standard height desks!"
25 Foot Lighted Outdoor Extension Cord - 10/3 SJTW Yellow 10 Gauge Cable with 3 Prong Grounded Plug for Safety - Great for Garden and Major Appliances,"{'Color': 'Yellow', 'Brand': 'Thonapa', 'Voltage': '125 Volts', 'Input Current': '15 Amps', 'Wattage': '1875 watts'}","ALL PURPOSE EXTENSION CORD - Indoor and Outdoor use.  Great for gardening, landscaping, or powering any household appliance. DURABLE DESIGN - Flexible vinyl covering protects cords against moisture, abrasion and sunlight.  Slip resistant. REINFORCED BLADES protect prongs from bending or breaking during heavy use. LED LIGHTED PLUGS - An internal LED lights up to indicates when the power is on.","Looking for a durable and reliable extension cord for all your indoor and outdoor needs? Look no further than the Thonapa 25 Foot Lighted Outdoor Extension Cord! Made with a flexible vinyl covering to protect against moisture, abrasion and sunlight, this extension cord is perfect for powering any household appliance. Plus, the LED lighted plugs make it easy to see when the power is on. Don't miss out on this must-have extension cord - order yours today!","The Thonapa 25 Foot Lighted Outdoor Extension Cord is perfect for all your indoor and outdoor needs! It is durable and reliable, and has a lighted end so you can easily see where you are plugging it in. Made with a flexible vinyl covering to protect against moisture, abrasion and sunlight, this extension cord is perfect for powering any household appliance. Plus, the LED lighted plugs make it easy to see when the power is on. Don't miss out on this must-have extension cord - order yours today!"
"50 Pcs Yellow Heat Shrink Butt Connectors, 12-10 AWG Waterproof Crimp Terminals Electrical Wire Connectors Splice for Marine, Cable, Wiring","{'Gauge': '10.0', 'Connector Type': 'Butt Splice', 'Insulation Material': 'Polyolefin', 'Terminal': 'Butt Terminal', 'Material': 'Copper'}","Tinned Copper Core: Butt connectors use a heavy-duty copper core, strong crimp, higher conductivity. Package Includes: 50 Yellow heat shrink butt connectors that can be used on wire AWG from 12 to 10. Solderless Crimping: Insert the wires to be connected, crimp both sides with crimping pliers, and then heat with a heat gun. 3:1 Shrink Ratio: Marine grade heat shrink tubing provides high tensile strength and enough hot melt adhesive inside the tubing to ensure waterproof performance, your wires will never slip out of the wire connectors. Wide Application: Wire connectors are durable, stable, waterproof, and corrosion resistant and are used in the automotive, marine, electrical, and electronic industries.","Looking for a reliable and durable way to connect your electrical wires? Look no further than these 50 Pcs Yellow Heat Shrink Butt Connectors! Made with a heavy-duty copper core and a strong crimp, these connectors are perfect for a variety of applications, including automotive, marine, and electrical. With a 3:1 shrink ratio, these connectors will provide a waterproof and corrosion-resistant connection that will last for years to come.","If you're looking for a dependable and long-lasting way to connect your electrical wires, these 50 Pcs Yellow Heat Shrink Butt Connectors are exactly what you need! Made with a heavy-duty copper core and a strong crimp, these connectors are perfect for a variety of applications, including automotive, marine, and electrical. With a 3:1 shrink ratio, these connectors will provide a waterproof and corrosion-resistant connection that will last for years to come."
"The HC Companies ECA10000A421020LRDEN planters, Warm Gray","{'Material': 'Plastic', 'Brand': 'The HC Companies', 'Color': 'Warm Gray', 'Style': 'Contemporary', 'Shape': 'Round'}","VERSATILE - Removable and attached saucer is ideal for indoor and outdoor spaces. BEAUTIFUL DESIGN - Contemporary design and fresh colors for modern styling. COORDINATES - Perfectly pairs with our full Eclipse line of lightweight and durable planters, window boxes and hanging baskets all sold separately. DURABLE & LIGHTWEIGHT - These containers are very durable & lightweight. DIMENSIONS - 10""x10""x8.","Looking for a versatile and stylish planter that can be used indoors or outdoors? Look no further than the HC Companies ECA10000A421020LRDEN planter in Warm Gray. This contemporary-style planter is made of durable and lightweight plastic and features a removable and attached saucer. It coordinates perfectly with our full Eclipse line of planters, window boxes and hanging baskets (sold separately). Dimensions: 10""x10""x8.","The HC Companies ECA10000A421020LRDEN planter is a versatile and stylish option that can be used indoors or outdoors. The Warm Gray color option is a great choice for any space. This contemporary-style planter is made of durable and lightweight plastic and features a removable and attached saucer. It coordinates perfectly with our full Eclipse line of planters, window boxes and hanging baskets (sold separately). "
"Tablet 10 inch Android Tablet, Android 10.0 Tablet Quad-Core Processor 32GB Storage Tablet Computer, 2GB RAM, 8MP Camera, Long Battery Life (Black)","{'Series': 'CP10', 'Brand': 'COOPERS', 'Generation': '1_st_generation', 'Screen Size': '10 Inches', 'Operating System': 'Android'}","Excellent Performance---This Google Tablet CP10 Featuring with Powerful Quad-core SC7731E, 1. 3 GHz CPU, 2GB RAM and Newest Android 10. 0 Operating System.  Ensure Faster and more Responsive Using Experience for Quick APP Launches, Smooth Light Games and Videos. Great View and More Responsive---This 10'' Tablet Pad Adopts a 1280 x 800 IPS HD Display, Presenting a Bright Display with Vivid Colors for a more True-to-life Viewing experience, Brings you a Crisper and Brighter image.  Featuring with 10. 0"" Capacitive touch, Five point cap-touch G+G, Ensure a more Fluently Action for Movie and Game. More Functional---Front 2. 0 Mega pixel, Back 8. 0 Mega pixel camera with Flash Light, Support Bluetooth, Built-in GPS, 32GB Storage, 1080P Videos.  Meets Reading, Photograph, videos, Music, etc.  Suitable for Most Life Scenarios. Long-Life Battery---Equipped with a 6000mAh Built-in Rechargeable Battery, Enables about 8 Hours Mixed-use when Travelling.  Read e-Books, Listen to Music, Watch a Movie, Play a Game, or Surf the Internet, This tablet will be a Perfect Choice. 2. 4G WIFI Connect---Kindly Note: this is a WIFI tablet, NOT Support the SIM Card.  2021 Newest Tablet Computer Stay Connected with Built-in Bluetooth 4. 0 and Wi-Fi 802. 11 ac/b/g/n.  Perfect for Fast Connecting Network.","Looking for a powerful and responsive tablet? Look no further than the COOPERS CP10! This tablet features a quad-core processor, 2GB of RAM, and the latest Android 10.0 operating system. The 10"" HD display is perfect for watching movies, playing games, and reading e-books. Plus, with Bluetooth 4.0 and Wi-Fi 802.11ac/b/g/n, you'll always stay connected.","If you're in the market for a powerful and responsive tablet, the COOPERS CP10 is a great option to consider. This tablet features a quad-core processor, 2GB of RAM, and the latest Android 10.0 operating system. The 10"" HD display is perfect for watching movies, playing games, and reading e-books. Plus, with Bluetooth 4.0 and Wi-Fi 802.11ac/b/g/n, you'll always stay connected."
"Super-Soft Kids Weighted Blanket 10 Pounds - Weighted Blanket for Kids with Easy to Clean, Washable Minky Cover - 41x60 Inches 10lbs Small Heavy Blanket for Girls and Boys","{'Blanket Form': 'Weighted Blanket', 'Product Dimensions': '60""L x 41""W', 'Brand': 'Hazli', 'Color': 'Weighted Blanket With Sky Blue Cover', 'Fabric Type': '100% Cotton Weighted Blanket With Minky Cover'}","GLASS BEADED WEIGHTED BLANKET - An ultra-cozy heavy weighted blanket for teens and adults.  The adult weighted blanket has durable and robust stitching to help evenly distribute the weight.  The pressure supplied perfectly mimics a warm hug to help you sleep soundly through the night. DURABLE NINE-LAYER DESIGN - Our weighted blankets are designed with 9 layers and 10 pockets for better weight distribution and maximum comfort.  The 9 layers design offers the highest comfort possible while you snuggle, sleep or do daily activities like reading or watching tv. 100% BREATHABLE COTTON CONSTRUCTION - Hazli's gravity weighted blanket is made of 100% breathable cotton.  The cotton is beautifully enclosed in a soft minky cover and filled with premium micro glass beads to ensure a firm and consistent pressure simulating the feeling of being hugged. REMOVABLE ULTRA-SOFT COVER - Our child weighted blanket come with a pre-attached cover.  The easy to wash removable cover is made with super soft minky fabric with dots.  The quality of the fabric helps preserve the soft touch sensation over time, making it perfect for cozying up for winter. GUARANTEED SATISFACTION - We take extra care when making weighted blankets for adults and teens to ensure each one is super soft the highest quality.  If you are not satisfied for any reason, we also offer a no-questions-asked money-back guarantee lasting 6 months from the date of purchase.","Looking for a cozy, weighted blanket that will help you sleep soundly through the night? Look no further than Hazli's Super-Soft Kids Weighted Blanket! Made with 100% breathable cotton and filled with premium micro glass beads, this blanket provides firm, consistent pressure that mimics the feeling of being hugged. The removable, ultra-soft minky cover is machine-washable for easy care. Plus, Hazli offers a money-back satisfaction guarantee, so you can sleep soundly knowing you're getting the best quality weighted blanket on the market.","Are you in need of a cozy, weighted blanket that will help you sleep soundly through the night? Hazli's Super-Soft Kids Weighted Blanket is the perfect solution! Made with soft, cozy fabric and fill, this blanket is sure to help. Made with 100% breathable cotton and filled with premium micro glass beads, this blanket provides firm, consistent pressure that mimics the feeling of being hugged. The removable, ultra-soft minky cover is machine-washable for easy care. Plus, Hazli offers a money-back satisfaction guarantee, so you can sleep soundly knowing you're getting the best quality weighted blanket on the market."
2022-2031 Monthly Planner: Kawaii Pink Cover 10 Years Monthly Planner 120 Months Calendar Agenda Schedule Organizer And Appointment Notebook With Federal Holidays And Inspirational Quotes,{},,"Looking for a reliable and stylish monthly planner? Look no further than the 2022-2031 Monthly Planner from Kawaii Pink Cover! This 10-year planner features 120 months of calendar appointments and notes, plus federal holidays and inspirational quotes. Keep track of your busy life with ease and style with this must-have planner!","If you're in the market for a stylish and reliable monthly planner, the 2022-2031 Monthly Planner from Kawaii Pink Cover is a great option to consider! This 10-year planner features 120 months of calendar appointments and notes, plus federal holidays and inspirational quotes. Keep track of your busy life with ease and style with this must-have planner!"
Siemens Q2100 2 pole 100a Plug-in 240v breaker Q2100,"{'Brand': 'SIEMENS', 'Current Rating': '100 Amps', 'Voltage': '240 Volts', 'Circuit Breaker Type': 'Standard', 'Mounting Type': 'Plug-In Mount'}",,Looking for a reliable and easy-to-use circuit breaker? Look no further than the Siemens Q2100 2-pole 100a Plug-in 240v breaker. This breaker is designed for use with 240v systems and has a current rating of 100 amps. It features a plug-in mount for easy installation and is backed by Siemens' quality and reliability.,Looking for a reliable and easy-to-use circuit breaker? The Siemens Q2100 2-pole 100a Plug-in 240v breaker is a reliable and easy-to-use circuit breaker. This breaker is designed for use with 240v systems and has a current rating of 100 amps. It features a plug-in mount for easy installation and is backed by Siemens' quality and reliability.
"Blue Diamond Almonds Oven Roasted Dark Chocolate Flavored Snack Nuts, 100 Calorie Packs, 32 Count","{'Flavor': 'Cocoa Dusted 32 Count (Cocoa Dusted)', 'Brand': 'Blue Diamond Almonds', 'Allergen Information': 'Tree Nuts', 'Weight': '1.25 Pounds', 'Item Form': 'Roasted'}","Contains 32 single serve 100-calorie travel packs of Blue Diamond oven roasted dark chocolate snack almonds. Covered with real cocoa power for a rich chocolate flavor - great for your next party!. Tasty and high in protein and fiber. Single serving packs makes this a perfect travel snack for adults and children on the way to the office, school, or just on the go.","Looking for a delicious snack that's perfect for on the go? Look no further than Blue Diamond Almonds Oven Roasted Dark Chocolate Flavored Snack Nuts! These tasty nuts are covered in real cocoa powder for a rich chocolate flavor, and each 100-calorie pack is the perfect size for a quick snack. Plus, they're high in protein and fiber, making them a nutritious choice. So next time you're headed out the door, grab a pack of Blue Diamond Almonds Oven Roasted Dark Chocolate Flavored Snack Nuts and enjoy!","Blue Diamond Almonds Oven Roasted Dark Chocolate Flavored Snack Nuts are a delicious and easy-to-eat snack! They're perfect for satisfying your hunger between meals or simply enjoying as a tasty treat. These tasty nuts are covered in real cocoa powder for a rich chocolate flavor, and each 100-calorie pack is the perfect size for a quick snack. Plus, they're high in protein and fiber, making them a nutritious choice. So next time you're headed out the door, grab a pack of Blue Diamond Almonds Oven Roasted Dark Chocolate Flavored Snack Nuts and enjoy!"
