Name,Specs,Features,GPT3-Outputs,Brians_custom_descriptions
"TreeDeal Create Personalized Wall Art with Your Photo on Canvas - Custom Canvas Prints for Family - Personalized Canvas Pictures for Wall to Print Framed (20"" X 30"")","{'Brand': 'TreeDeal', 'Material': 'Canvas', 'Theme': 'Personalized', 'Size': ""20'' x 30''"", 'Mounting Type': 'Wall Mount'}","SUPERIOR QUALITY MADE IN AND SHIPPED FROM USAWe provides high-quality custom canvas prints that are made to order especially for you.  Our canvas print wall arts are direct from the USA manufacturer and quality guaranteed.  Each canvas art is ready to hang with strong hooks fixed on the frame.  (hanging accessory kit included).  The canvas pictures are made from 1. 5 inch thick frame bar for gallery quality profile.  Eco-Ink print makes it safety for families and environmental for home environment. UNIQUE WALL DECOR FOR HOME: Need gift ideas for home DECOR? We offer the best gift- custom canvas print made from your photos.  Create a unique, one of a kind artwork that your friends and family will admire for years to come.  Print your own pictures to memory the precious moment in your kids/lover/pet/animal/view/wedding/family and so on.  We combine your best memories captured in photographs with our state of the art technologies and materials to create breathtaking and unique wall decoration. INDIVIDUAL WALL DECORATION, PERFECT GIFT FOR ANY OCCASION: Custom Canvas Print is perfect for Wedding Photos, Graduation Pictures, Vacation Mementos.  Customized canvas wall Art as decoration for living room, bedroom, bathroom, dining room, kitchen etc or a perfect Christmas and New Year gift for the person you cherish. IMPORTANT NOTE:1. After upload the photo, please make sure stretch the picture to cover the whole canvas area as followed, the stretched picture is the front of the canvas you will get, we will fulfill the border with mirror portrait. DO NOT LEAVE WHITE BORDER when you stretch the photo.  2.","Looking for a unique and personal gift? Look no further than TreeDeal! Our custom canvas prints are made in the USA and are of the highest quality. With our easy to use online ordering system, you can create a one-of-a-kind artwork that your friends and family will cherish for years to come.","Are you browsing for a one-of-a-kind, personalized gift? TreeDeal has the solution! Our custom canvas prints are made in the USA and are of the highest quality. With our easy to use online ordering system, you can create a one-of-a-kind artwork that your friends and family will cherish for years to come."
"Golden State Art, Simple Classic Poster Picture Frame - Wall Display, Set of 2, 18x24, White","{'Color': 'White', 'Brand': 'Golden State Art', 'Finish Type': 'Polished', 'Orientation': 'Vertical', 'Item Dimensions LxWxH': '19.3 x 25.3 x 1.5 inches', 'Theme': 'Art', 'Mounting Type': 'Wall Mount', 'Item Display Dimensions': '26.6 x 20.5 x 2.7 inches'}","Unique frames for displaying photographs, prints, original artwork, and more. Simple design that brings a clean, polished look to your display. Includes acrylic glass front lens, sturdy backing, and durable easy to use frame. Displays along your wall with included hardware.","Looking for a classic and simple way to display your artwork or photographs? Look no further than the Golden State Art Simple Classic Poster Picture Frame! This frame comes in a set of two, so you can create a cohesive display. The white finish and clean lines of the frame will add a polished look to your space. Plus, the included hardware makes it easy to hang on your wall.","Are you looking for a traditional and straightforward way to display your artwork or photographs? Look no further than the Golden State Art Simple Classic Poster Picture Frame! This frame comes in a set of two, so you can create a cohesive display. The white finish and clean lines of the frame will add a polished look to your space. Plus, the included hardware makes it easy to hang on your wall."
"MCS Trendsetter Poster Frame, Black, 20 x 30 in, Single","{'Color': 'Black', 'Frame Material': 'Plastic', 'Brand': 'MCS', 'Finish Type': 'Gloss', 'Shape': 'Rectangle', 'Style': 'Single', 'Item Dimensions LxWxH': '21.25 x 0.63 x 31.25 inches', 'Mounting Type': 'Wall Mount', 'Item Weight': '2.05 Pounds'}","MODERN AND FUNCTIONAL: Create a contemporary display for all your most esteemed art prints, photos, posters, puzzles, and more with the MCS Trendsetter Frame featuring a sleek black finish. DIMENSIONS: Wall picture frame measures 21 x 31 inches and holds one 20 x 30 inch poster, puzzle, or picture. QUALITY CONSTRUCTION: Our poster frames feature a back-loading design with a clear styrene front to protect artwork and puzzles from damage; Lightweight cardboard backing and a durable plastic profile makes adding or swapping posters a breeze. EASY TO USE: Trendsetter poster and puzzle frames feature attached hinged hangers for simple vertical or horizontal wall hanging.","Looking to add a touch of modernity to your home décor? Look no further than the MCS Trendsetter Poster Frame! This sleek black frame is perfect for displaying all your most prized art prints, photos, posters, puzzles, and more. The frame measures 21 x 31 inches and can accommodate a 20 x 30 inch poster, puzzle, or picture. The back-loading design with a clear styrene front protects artwork and puzzles from damage, while the lightweight cardboard backing and durable plastic profile make adding or swapping posters a breeze. Plus, the attached hinged hangers allow for simple vertical or horizontal wall hanging. Give your home the update it deserves with the MCS Trendsetter Poster Frame!","Add a touch of modernity to your home décor with the MCS Trendsetter Poster Frame! This sleek black frame is suitable for displaying all your most prized art prints, photos, posters, puzzles, and more. The frame measures 21 x 31 inches and can accommodate a 20 x 30 inch poster, puzzle, or picture. The back-loading design with a clear styrene front protects artwork and puzzles from damage, while the lightweight cardboard backing and durable plastic profile make adding or swapping posters a breeze. Plus, the attached hinged hangers allow for simple vertical or horizontal wall hanging. Give your home the update it deserves with the MCS Trendsetter Poster Frame!"
"Dell P2419H 24 Inch LED-Backlit, Anti-Glare, 3H Hard Coating IPS Monitor - (8 ms Response, FHD 1920 x 1080 at 60Hz, 1000:1 Contrast, with ComfortView DisplayPort, VGA, HDMI and USB), Black","{'Specific Uses For Product': 'Business, personal', 'Refresh Rate': '60 Hz', 'Brand': 'Dell', 'Screen Size': '24 Inches', 'Special Feature': 'Height Adjustment, Pivot Adjustment, Anti-Glare Coating, Swivel Adjustment, Tilt Adjustment'}","More room to work: Free up valuable desk space with a thin monitor profile and a small monitor base; Contrast ratio: 1000:1. Consistent and rich colors: A wide viewing angle enabled by in-plane switching technology lets you see vibrant colorsno matter where you sit. Expand your efficiency: The three-sided ultrathin bezel design lets you enjoy an uninterrupted view of your content across multiple monitors. This TUV certified monitor has a flicker-free screen with comfort view, a feature that reduces harmful blue light emissions.  It's designed to optimize eye comfort even over extended viewing.","If you want a monitor that will help you be more productive at work, check out the Dell P2419H 24 Inch LED-Backlit IPS Monitor. This monitor features a thin profile and small base, making it perfect for freeing up valuable desk space. The in-plane switching technology lets you see vibrant colors from any angle, and the three-sided ultrathin bezel design lets you enjoy an uninterrupted view of your content across multiple monitors. Plus, the TUV-certified flicker-free screen with comfort view is designed to reduce harmful blue light emissions and optimize eye comfort.","If you want a monitor that will help you be more productive at work, check out the Dell P2419H 24 Inch LED-Backlit IPS Monitor. This monitor features a thin profile and small base, making it perfect for freeing up valuable desk space. The in-plane switching technology lets you see vibrant colors from any angle, and the three-sided ultrathin bezel design lets you enjoy an uninterrupted view of your content across multiple monitors. Plus, the TUV-certified flicker-free screen with comfort view is designed to reduce harmful blue light emissions and optimize eye comfort."
OMB Warehouse Predator 212cc Mini Bike Kit - Stage 3 - Non-Hemi,{},,"Introducing the Predator 212cc Mini Bike Kit - Stage 3 - Non-Hemi! This mini bike kit is perfect for anyone looking to get into the world of off-road riding. Featuring a powerful 212cc engine, this mini bike is sure to provide plenty of thrills and spills. With a stage 3 kit, you'll be able to take on tougher terrain and get the most out of your mini bike experience. So whether you're a beginner or a seasoned pro, the Predator 212cc Mini Bike Kit - Stage 3 - Non-Hemi is the perfect choice for you.","The Predator 212cc Mini Bike Kit - Stage 3 - Non-Hemi is now available! This mini bike kit is perfect for anyone looking to get into the world of off-road riding. Featuring a powerful 212cc engine, this mini bike is sure to provide plenty of thrills and spills. With a stage 3 kit, you'll be able to take on tougher terrain and get the most out of your mini bike experience. So whether you're a beginner or a seasoned pro, the Predator 212cc Mini Bike Kit - Stage 3 - Non-Hemi is the perfect choice for you."
REVOLIA 24Pcs 18-22G 316L Stainless Steel Nose Rings Hoop Cartilage Ear Septum Piercings 6-12mm,{},"AFFORDABLE PIERCING SET-- 24 Pcs Nose Rings Set, Affordable Price, Give You Different Choices for Everyday Wear. SUITABLE SIZE--22G(0. 5MM) 6-12mm Inner Diameter, Different Size for Different Piercing. MULTIPLE WEARING CHOICES--24 Pcs Set, Great for Wearing as Cartilage, Helix, Nose and Ear Piercing. QUALITY MATERIAL--316L Stainless Steel, Safe and Comfortable to Wear, Longer Time to Use. 150 Day Money Back and Exchange Guarantee, If You are Not Satisfied with Our Products.","Looking for a way to add some personality to your look? Check out REVOLIA's nose rings! This affordable set of 24 316L stainless steel nose rings is perfect for everyday wear. With a variety of sizes to choose from, you can mix and match to create your own unique style.","These nose rings from REVOLIA are a terrific way to personalize your outfit! This affordable set of 24 316L stainless steel nose rings is perfect for everyday wear. With a variety of sizes to choose from, you can mix and match to create your own unique style."
"Blackstone 22"" Tabletop Griddle with Griddle Hood and Stand","{'Color': 'Black', 'Material': 'Stainless Steel', 'Brand': 'Blackstone', 'Item Weight': '64.5 Pounds'}","22"" griddle that includes hood, legs, and bulk adapter hose. READY FOR ADVENTURE - Perfect for life on the move, camping, tailgating, and more, your Blackstone Adventure Ready griddle is ready for your next adventure.  With a hood, legs, and a bulk adapter hose, this griddle is ready to be set up anywhere and everywhere. HEAVY DUTY GRIDDLE SURFACE - The 358-square-inch griddle top is made of cold rolled steel for an even and controlled heat.  Fill it up with all your favorite foods and get ready to enjoy cooking. LONG LIFE STAINLESS STEEL BURNERS - Two independently controlled stainless steel tube burners produce a combined 24,000 BTUs.  Compatibility with both a 1-pound propane tank or a 20-pound propane tank (with the included adapter hose) means you can choose to stay or go with your Blackstone Griddle. PERFECT PORTABILITY - This griddle is easy to transfer from griddle stand to tabletop, depending on where you are.  The griddle stand folds up for easy portability and storage when not in use.","Looking for a griddle that's ready for adventure? Look no further than the Blackstone 22"" Tabletop Griddle with Griddle Hood and Stand. This griddle is perfect for camping, tailgating, and more, with a hood, legs, and bulk adapter hose that make it easy to set up anywhere. The cold rolled steel griddle surface is ideal for cooking up all your favorite foods, while the two independently controlled stainless steel tube burners produce a combined 24,000 BTUs. Choose to use a 1-pound propane tank or 20-pound propane tank with the included adapter hose, and enjoy the perfect portability of this griddle, which easily transfers from griddle stand to tabletop.","Look no further than the Blackstone 22"" Tabletop Griddle with Griddle Hood and Stand if you're looking for a griddle that's ready for adventure. This griddle is perfect for camping, tailgating, and more, with a hood, legs, and bulk adapter hose that make it easy to set up anywhere. The cold rolled steel griddle surface is ideal for cooking up all your favorite foods, while the two independently controlled stainless steel tube burners produce a combined 24,000 BTUs. Choose to use a 1-pound propane tank or 20-pound propane tank with the included adapter hose, and enjoy the perfect portability of this griddle, which easily transfers from griddle stand to tabletop."
"Sceptre 22"" 75hz 1080p LED Monitor HDMI VGA Wall Mount Ready, Machine Black 2021 (E22 Series)","{'Refresh Rate': '60 Hz', 'Brand': 'Sceptre', 'Screen Size': '21.5 Inches', 'Total HDMI Ports': '2', 'Hardware Interface': 'VGA, HDMI'}",Up to 75Hz refresh rate. VESA Wall Mount Ready. Build in Speakers.,"Looking for a reliable and affordable monitor? Check out the Sceptre 22"" 75hz 1080p LED Monitor. With a refresh rate of up to 75hz, it's perfect for both home and office use. Plus, it's VESA wall mount ready, so you can easily mount it on the wall.","If you're on the hunt for an affordable and reliable monitor, the Sceptre 22"" 75hz 1080p LED Monitor is a great option to consider. With a refresh rate of up to 75hz, it's perfect for both home and office use. Plus, it's VESA wall mount ready, so you can easily mount it on the wall."
"MCS Museum Poster Frame, Onyx Woodgrain, 14 x 22 in, Single","{'Color': 'Onyx Woodgrain', 'Frame Material': 'Plastic, Engineered Wood, Glass', 'Brand': 'MCS', 'Style': 'Single', 'Item Dimensions LxWxH': '16.5 x 0.75 x 24.5 inches', 'Mounting Type': 'Wall Mount', 'Unit Count': '1.0 Count'}","MODERN DESIGN: The Museum Poster Frame features a 1. 5"" wide profile and an onyx woodgrain finish for a sleek and contemporary display for your poster frames or art prints. DIMENSIONS: This frame measures 16. 5x. 75x24. 5 inches and holds one 14x22 inch photograph, poster, or art print. QUALITY CONSTRUCTION: Each frame is constructed of durable extruded plastic material and features a clear plexi front that provides protection from dust and dirt. EASY TO USE: Each frame includes an MDF back with pre-attached sawtooth hangers for easy vertical or horizontal hanging; Just add your artwork and hang."," Display your favorite art prints and posters with the MCS Museum Poster Frame. This frame is made of durable extruded plastic material with a clear plexi front and an onyx woodgrain finish. It includes an MDF back with pre-attached sawtooth hangers for easy vertical or horizontal hanging. The frame measures 16.5x.75x24.5 inches and holds one 14x22 inch photograph, poster, or art print."," Display your favorite art prints and posters with the MCS Museum Poster Frame. This frame is made of durable extruded plastic material with a clear plexi front and an onyx woodgrain finish. It includes an MDF back with pre-attached sawtooth hangers for easy vertical or horizontal hanging. The frame measures 16.5x.75x24.5 inches and holds one 14x22 inch photograph, poster, or art print."
"Craig Frames 7171610BK1722 0.825-Inch Wide Picture/Poster Frame in Wood Grain Finish, 17 by 22-Inch, Solid Black","{'Color': 'Black', 'Frame Material': 'Plastic, Wood', 'Brand': 'Craig Frames', 'Finish Type': 'Wood_grain', 'Style': 'Casual', 'Item Dimensions LxWxH': '18.5 x 0.75 x 23.5 inches', 'Mounting Type': 'Wall Mount'}","Traditional style, black with wood grain finish. Frame includes: clear styrene facing, rigid cardboard backing and wire hanging hardware kit (some assembly required). Fits a 17x22 Photo/Print/Poster (Viewable area is slightly smaller). Frame molding is. 825 Inch wide, Real poplar, Solid wood.","Looking to add a touch of class to your home décor? Look no further than the Craig Frames 7171610BK1722 0.825-Inch Wide Picture/Poster Frame. This beautiful frame comes in a rich black finish with a wood grain detail that is sure to impress. The frame includes clear styrene facing, rigid cardboard backing, and wire hanging hardware kit. It also comes with a limited lifetime warranty, so you can rest assured that your purchase is of the highest quality.","Want to add a touch of class to your home décor? Check out the Craig Frames 7171610BK1722 0.825-Inch Wide Picture/Poster Frame. This beautiful frame comes in a rich black finish with a wood grain detail that is sure to impress. The frame includes clear styrene facing, rigid cardboard backing, and wire hanging hardware kit. It also comes with a limited lifetime warranty, so you can rest assured that your purchase is of the highest quality."
"US Art Frames 18x22 Traditional Style Cherry Thin .75 Inch Wide, Solid Popler Wood, Wall Decor Picture Poster Photo Frame","{'Color': 'Cherry', 'Frame Material': 'Wood', 'Brand': 'US Art', 'Finish Type': 'Cherry', 'Shape': 'Rectangle', 'Style': 'Contemporary', 'Mounting Type': 'Wall Mount'}","Picture frames comes with all hanging hardware (vertical and horizontal ) Completely Installed. Comes with everything needed to complete your DIY Framing Project !! All Hardware included.  No TOOLS REQUIRED AND NO NEED TO HANDLE TANGLED WIRES. This 18x22 Will fit a Picture/Photo of 18x22 , this is also called the glass size, a negligible portion is not visible, and is covered by the frame Lip. Frame includes: 0. 040 Acrylic, Cardboard Backer and Hanger installed on both sides.  It can hang either way.  On return 20% restocking charges will be applied. Smooth Wrap Finish,. 75-Inch Wide, Traditional Cherry, Solid Popler Wood Picture Frame. These Frames 8x10 & smaller come with Glass.  Frames Larger than 8x10 come with UV Filtering. 040 US Made Plexiglass.","Looking for a beautiful and stylish way to display your favorite photos? Look no further than the US Art Frames 18x22 Traditional Style Cherry Thin .75 Inch Wide, Solid Popler Wood, Wall Decor Picture Poster Photo Frame! This frame is made of high-quality wood and comes in a rich cherry finish that will complement any décor. It includes all the hardware you need for easy installation, and can be hung either vertically or horizontally. Plus, it comes with a UV-filtering Plexiglass, making it perfect for protecting your precious photos from fading. Order your US Art Frame today!","Do you have a bunch of favorite photos that you want to display in a stylish way? Check out the US Art Frames 18x22 Traditional Style Cherry Thin .75 Inch Wide, Solid Popler Wood, Wall Decor Picture Poster Photo Frame!  This frame is made of high-quality wood and comes in a rich cherry finish that will complement any décor. It includes all the hardware you need for easy installation, and can be hung either vertically or horizontally. Plus, it comes with a UV-filtering Plexiglass, making it perfect for protecting your precious photos from fading. Order your US Art Frame today!"
Americanflat 22x28 Poster Frame in Black with Polished Plexiglass - Horizontal and Vertical Formats with Included Hanging Hardware,"{'Color': 'Black', 'Frame Material': 'Engineered Wood', 'Brand': 'Americanflat', 'Finish Type': 'Polished', 'Shape': 'Rectangle', 'Style': 'Frame', 'Orientation': 'Vertical', 'Item Dimensions LxWxH': '23.9 x 29.9 x 0.59 inches', 'Mounting Type': 'Wall Mount', 'Special Feature': 'Poster Frame'}","Design: Black 22x28 inch poster frame, perfect for your favorite movie, band, or travel poster; comes with hanging hardware for hassle-free display in both horizontal and vertical formats to hang flat against the wall. Material: MDF composite frame with a polished plexiglass front that gives a clear view of your poster and preserves your posters, photos and memories. Quality: Durable, gallery-style frame; the frame's front has clear plexiglass and a sturdy backboard to keep the poster in place. Use and Display: Perfect for 22x28 inch posters; load your posters, photos, and memories easily, quickly and securely.","Looking for a stylish and durable way to display your 22x28 inch posters? Check out the Americanflat 22x28 Poster Frame in Black with Polished Plexiglass. This frame comes with hanging hardware for hassle-free display in both horizontal and vertical formats, and its MDF composite construction with a polished plexiglass front gives you a clear view of your poster while preserving your posters, photos and memories.","Looking for a stylish and durable way to display your 22x28 inch posters? Check out the Americanflat 22x28 Poster Frame in Black with Polished Plexiglass. This frame comes with hanging hardware for hassle-free display in both horizontal and vertical formats, and its MDF composite construction with a polished plexiglass front gives you a clear view of your poster while preserving your posters, photos and memories."
"Craig Frames 7171610BKC2230AAC 0.825-Inch Wide Picture/Poster Frame in Wood Grain Finish, 22 by 30-Inch, Solid Black","{'Color': 'Black', 'Frame Material': 'Plastic, Wood', 'Brand': 'Craig Frames', 'Finish Type': 'Wood_grain', 'Style': 'Casual', 'Item Dimensions LxWxH': '23.5 x 0.75 x 31.5 inches', 'Mounting Type': 'Wall Mount'}","Traditional style, black with wood grain finish. Frame includes: clear styrene facing, rigid cardboard backing and wire hanging hardware kit (some assembly required). Fits a 22x30 Photo/Print/Poster (Viewable area is slightly smaller). Frame molding is. 825 Inch wide, Real poplar, Solid wood.","Introducing the Craig Frames 7171610BKC2230AAC Picture/Poster Frame! This traditional-style frame comes in black with a wood grain finish, adding a touch of elegance to any setting. The frame includes clear styrene facing, rigid cardboard backing, and wire hanging hardware kit (some assembly required). It fits a 22x30 Photo/Print/Poster (Viewable area is slightly smaller). With frame molding that is. 825 Inch wide, made of real poplar, and solid wood, this frame is sure to make your photos and prints look their best!","Whether you're looking to show off your favorite picture of the kids, a prized vacation photo, or just want to add a touch of class to your living room, the Craig Frames 7171610BKC2230AAC Picture/Poster Frame is the perfect frame for you. This traditional-style frame comes in black with a wood grain finish, adding a touch of elegance to any setting. The frame includes clear styrene facing, rigid cardboard backing, and wire hanging hardware kit (some assembly required). It fits a 22x30 Photo/Print/Poster (Viewable area is slightly smaller). With frame molding that is. 825 Inch wide, made of real poplar, and solid wood, this frame is sure to make your photos and prints look their best!"
"Craig Frames Contemporary Picture Frame, 22 x 34 Inch, White","{'Color': 'White', 'Frame Material': 'Engineered Wood', 'Brand': 'Craig Frames', 'Finish Type': 'Satin', 'Shape': 'Rectangle', 'Style': 'Contemporary', 'Mounting Type': 'Wall Mount', 'Item Weight': '4 Pounds'}","Contemporary style; white; smooth wrap finish. Frame includes: clear acrylic facing, rigid cardboard backing and wire hanging hardware kit (some assembly required). Frame holds a 22 x 34 inch photo/print/poster (viewable area reduced by. 25"" on each side due to frame lip). Frame moulding is 1 inch wide; solid MDF construction.","Looking for a sleek and modern frame for your 22 x 34 inch photo or print? Check out the Craig Frames Contemporary Picture Frame in white! This frame has a smooth wrap finish and includes clear acrylic facing, rigid cardboard backing, and wire hanging hardware kit. Some assembly is required, but it's easy to do and well worth it for the stylish look it gives your photo or print!","This simple but chic frame is perfect for any contemporary space. This frame has a smooth wrap finish and includes clear acrylic facing, rigid cardboard backing, and wire hanging hardware kit. Some assembly is required, but it's easy to do and well worth it for the stylish look it gives your photo or print!"
