,url,breadcrumbs,headings,text,word_count
46,https://www.thesprucepets.com/cat-age-to-human-age-chart-554306,Cats > Getting Started,<h1>How Old Is Your Cat in Human Years?</h1>,"<h1>How Old Is Your Cat in Human Years?</h1><p>Historically, people often think every year of a cat's life is equivalent to seven years of a human's life, but cats actually age must faster than that. And with age, we know that diseases often follow, but cats also act differently at certain life stages. Because of these things, it's not only helpful but also important to be able to understand what your cat is going through at each stage of its life.</p><h2>Kittens From Birth to Six Months</h2><p>The first six months of a kitten's life are filled with eye-opening experiences-literally. A kitten's eyes and ears open shortly after birth at around one to two weeks of age, and from there, its physical and mental development takes off. A kitten is exposed to sights, sounds, and smells just like that of a human infant. Each new animal, person, and object it comes in contact with helps to form its personality. Over the course of the next few weeks, the socialization skills of a kitten are greatly affected depending on all of these interactions and exposures.</p><p>After a kitten leaves its mother at about two to three months of age, it will start to become more independent and curious. It will explore its surroundings, get into a little trouble, and potentially chew on things it shouldn't chew while its adult teeth are starting to erupt. Growth happens fast during these months and by the time a kitten is six months old, they are comparable to a 10-year-old child in age.</p><p>A series of vaccinations will need to be performed and kittens are typically spayed or neutered around six months of age. Most hereditary or congenital issues are usually discovered by your veterinarian during this time if there are any at all.</p><h2>Kittens Become Adults - From Six Months to Three Years Old</h2><p>Since a six-month-old kitten is already comparable to a double-digit human child, older kittens and younger adult cats will continue to test their boundaries as they grow into adults. By the time your cat is one year old, it will have reached its adult size and its preferences, habits, etc. are typically established.</p><p>A one-year-old cat is physiologically similar to a 15-year-old human, and a two-year-old cat is like a 24-year-old person. Adult cats don't need as many vaccinations as a kitten needs and are usually healthy, but this age period is a good time to get some baseline blood work performed to know what your cat's normal values look like. You'll thank yourself when your cat is older and you have something to compare its blood work to. Occasional grooming, dental cleanings, and annual check-ups with a veterinarian are typically all that is necessary to keep a young adult cat healthy.</p><h2>Prime Cats - From Three to Six Years Old</h2><p>A three to six-year-old cat is still an adult but not a senior cat yet. These years are usually trouble-free in regards to health concerns, but some cats do have chronic health issues or congenital concerns that need to be addressed.</p><p>A prime cat may benefit from early joint support supplements to keep its hips and knees working as they should, will need annual vet check-ups with regular vaccinations, and may experience an occasional health concern, but overall this age period is usually a healthy one.</p><h2>Mature Cats - From Seven to Ten Years Old</h2><p>Once your cat reaches about seven or eight years of age, some veterinarians may start referring to it as a senior, but we know that since cats typically live into their late teens, they're not yet senior citizens. While cats who are nine or ten years of age might have been eligible for an AARP card if they were humans, they haven't quite reached retirement age yet.</p><p>This is an important age period to ensure your aging cat is getting proper nutrition because obesity is common in middle age. Also check that your cat hasn't developed dental disease, kidney issues, or a heart murmur, and is still able to jump on and off things easily. Blood work should be compared to that which was done during the younger years to ensure there are no trending changes in organ function and more frequent check-ups with your veterinarian are recommended.</p><h2>Senior Cats - From Eleven to Fourteen Years Old</h2><p>Your cat is finally a true senior when it reaches eleven years of age. Joint issues are a commonly hidden concern that owners of aging cats should be addressing and organ functionality may start to decrease. Blood work should be monitored at the recommendation of your veterinarian to ensure common problems seen in senior cats are caught early. Dietary changes may also be recommended at this age since older cats typically need different nutrition as their bodies change.</p><p>Some older cats seem to get crabby as they age, but this is often simply because a senior cat may be experiencing pain or joint discomfort or even brain changes and confusion. Be sure to discuss any observed changes with your veterinarian, as they may be an indicator of something else going on with your cat.</p><h2>Geriatric Cats - From Fifteen to Twenty and Older</h2><p>Cats live a long time. A 15-year-old cat is comparable in age to a human in their mid-70s, and by the time they are 20, they'd almost be 100 years old if they were a person. Any cat that is 15 or older is considered geriatric and should be visiting the veterinarian at least once every six months. These cats may be on medications or special foods and supplements to support various bodily systems. Geriatric cats often have decreased hearing and vision abilities and sleep for the majority of the day.</p><p>Cognitive decline is not uncommon in cats of this age, just like a human in their 90s might experience. Signs of cognitive dysfunction in cats include crying at night and urinating or defecating near, but not in, the litter box, among others.</p><p>While it's more common for a cat to live into its 20s than it is for a dog, a cat this old is still an accomplishment and special attention should definitely be paid to these geriatric felines.</p>",1015
47,https://www.thesprucepets.com/things-to-know-before-getting-a-cat-555305,Cats > Getting Started,<h1>Everything You Need to Know About Raising Your First Cat</h1>,"<h1>Everything You Need to Know About Raising Your First Cat</h1><p>The decision to adopt your first cat is a monumental one, both for you and for your new cat. Whether you are thinking about getting a cat, or have just adopted your first one, this tutorial has been designed to make your relationship with this special cat a lasting one so the cat has found its ""forever home.""</p><h2>Create a Shopping List for Your New Cat</h2><p>Bringing home a new cat is much like adopting a human baby. However, in the case of a cat, you'll be shopping for a litter box instead of a changing table.</p><p>Before you bring your new cat or kitten home, there are a number of things to collect or buy, so your cat will feel like a family member rather than a visitor. Do this a few days in advance to minimize stress for you and your cat on ""homecoming day."" In the excitement of bringing your cat home, you don't want to suddenly discover at 8 p.m. that you forgot to buy cat food.</p><h2>Prepare a Safe Room for Your Cat</h2><p>A ""Safe Room"" doesn't need to be a separate room but could be an empty closet, a corner of your bedroom with a protective screen, or a seldom-used bathroom. The important thing is that your new cat has a place it can call ""home,"" where it can retreat and rest. It may voluntarily choose to socialize with you and other family members, but for now, let it decide whether to hide or mingle. It may take several days to a week or more, depending on its history, but your patience at this point will yield exponential results in a happier relationship with your cat in later days.</p><h2>Cat-Proof Your Home</h2><p>Photo Credit: &copy; Franny Syufy</p><p>You've decided where you're going to go to adopt your new kitty; possibly you've already narrowed your selection down to one cat you simply must bring home. You've stocked up on essentials from the shopping list, and you've prepared kitty's ""safe room."" There's only one step left before Homecoming Day-cat-proofing your home to save wear and tear on the household as well as the new arrival.</p><p>Although it will take a bit of time, cat-proofing your home isn't rocket science. It only requires your willingness to get down to a cat's level to spy out hazardous temptations, along with the ability to think like a cat.</p><h2>Bring Your New Cat Home</h2><p>Oh, happy day! You've completed all your preparations and the big day has finally arrived for bringing your new kitty home. Although everyone is excited, it's probably better not to make this a big family event. Your new baby will probably be stressed enough without a bunch of people competing for its attention, especially if you have young children in the home.</p><h2>Take Your Cat for Its First Veterinary Visit</h2><p>Photo Credit: &copy; iStock Photo/Willie B. Thomas</p><p>Your new cat's first veterinarian visit is of supreme importance. You'll want to assure yourself of its good health, and get its vaccinations and testing for Feline Immunodeficiency Virus (FIV) and the Feline Leukemia Virus (FeLV), if not already done by the adopting agency. Also, unless this has already been performed, you need to set up an appointment for a spay or neuter of your new cat.</p><p>Prepare in advance for the possible question, ""Do you want a declaw with that neuter?"" The correct answer, of course, is ""No, thank you. My cat needs its claws.""</p><h2>Know Your Cat's Diet</h2><p>The diet a cat gets early in life will set the pace for its lifelong health and well-being. Your knowledge of cat food ingredients will help ensure not only longevity but the quality of life you want for your new family member.</p><p>Although cats descend from desert creatures, fresh water is also essential to them, especially if they eat a dry food diet.</p><p>Make sure you read cat food labels to know what you're feeding your new family member. You should review for weeks and months ahead until you feel secure in your knowledge. Once you learn to read cat food labels it will become a habit for life.</p><p>A source of clean, fresh water is also vital to your cat's well-being. Although cats have descended from desert animals, they still need to be well-hydrated.</p><h2>Get a Litter Box and Take Care of Sleeping Arrangements</h2><p>Next, to food and water, a litter box is critical for your new cat's comfort and health. With scrupulous maintenance of your cat's litter box, you'll never have to worry about odor or ""out-of-box accidents.""</p><p>""But the cat goes outdoors,"" you say? You'll want to rethink that decision in one of the later steps.</p><p>Another big consideration with your first cat is ""where will it sleep?"" Will you share your own bed with it, get it his own cozy bed, or a combination of both? Don't forget, you are establishing habits that will most likely last a lifetime.</p><h2>Take Care of Your Cat's Scratching Needs</h2><p>Photo Credit: &copy; iStock Photos - Melinda Fawver</p><p>Next to litter box avoidance, undesirable scratching behavior is the top reason for shelter surrenders. Actually, scratching is as necessary to cats as eating and breathing. Cats' claws are their most essential tools for many reasons.</p><p>When you complete this lesson, you'll have all the tools you'll need to ensure your cat the scratching, stretching exercise it needs, without sacrificing your hard-earned carpet and furniture.</p><h2>Play With Your Cat</h2><p>Playing with your cat is a wonderful bonding experience. Cats love to play and are experts in inventing their own games. Before you invest in expensive cat toys, experiment with things found around the house. Paper bags are great fun, as are cardboard boxes.</p><h2>Determine If Your Cat Spends Time Indoors or Outdoors</h2><p>If you feel that cats really need fresh air and the sunshine, there are safe alternatives for the outdoor experience. If you have an enclosed deck, that's an option. You can also try leash-training your cat so you don't have to worry about the cat encountering other animals outside.</p><h2>Make Your Cat a Family Member for Life</h2><p>As time passes, your bonding with your new cat will become stronger than ever, and you and your family will consider your cat a valued family member rather than a pet.</p><p>Congratulations for caring enough about your cat. Today is graduation day and you can officially call yourself an ailurophile, or even a crazy cat lover. You are joining a group of the most wonderful, caring people in the world: those who adore their cat children.</p>",1068
48,https://www.thesprucepets.com/amazing-cat-trees-4688661,Cats > Getting Started,<h1>10 Amazing Cat Trees You Have to See</h1>,"<h1>10 Amazing Cat Trees You Have to See</h1><p>If you're a kitty parent, you know how important your furry friend's cat tree (also known as a cat condo or cat mansion) is to them-and if you're a soon-to-be kitty parent, you should add one to your shopping list ASAP.</p><p>There are tons of cat trees on the market these days-ranging from modern and minimal to totally tricked out-but we say, if you're adding another piece of furniture to your house, why not go big? We've rounded up some of the most amazing cat trees out there, so you can give your kitty the cat tree of her dreams.</p><h2>Multiple Perch Post Cat Tree</h2><p>If you 've ever wondered what kitty heaven looked like, this cat tree is it. Featuring multiple, cloud-like perch posts, hammocks, and scratching posts, this cat tree can accommodate multiple cats at the same time-and keep them occupied, so they don 't get into fights. Keeping it fight-free is cat heaven for the owners, too, right?</p><h2>Cat Tree Utopia</h2><p>Who needs a single cat condo or mansion when you can have an entire kitty city for your cat to reign over? Accommodating multiple cats-or keeping a single cat really, really busy-is easy with this custom set-up has to offer. They can snooze, scratch, and pose for adorable Instagrams all over this miniature metropolis.</p><p>You can create your own miniature kitty city by combining multiple store-bought cat trees or towers, or by making your own with a few common household items. Start with a few pieces of upholstered plywood, cardboard boxes, and rope (for scratching!), and watch the urban kitty life ensue.</p><h2>Sleek and Tall Cat Tree Castle</h2><p>Your cat already acts like her royal highness, so why not embrace it? This castle-like cat tree offers her plenty of vantage points to look down upon her kingdom, a fortress to protect her from her enemies (also known as the family dog), and a hammock to lounge in, while her subjects (also known as you) feed her kibble. The royal life, huh?</p><h2>Jungle Cat Tree</h2><p>If you're looking for a wallet-friendly cat tree or just want to help your cat embrace his inner-jungle cat, you're going to want to check out this do-it-yourself creation. Handmade with branches, rope, covered plywood, and faux greenery, this cat tree is tricked out with all of the features your cat loves-including perches and scratching spots-but is easy on your wallet. In fact, you probably already have most of the supplies in your garage!</p><h2>Mid-Century Modern Cat Tree</h2><p>If your home is decked out in mid-century modern decor, it only makes sense to buy a mid-century modern cat tree, right? Characterized by clean lines and organic shapes, mid-century modern home decor has dominated the industry since the 1950s-and these days, it 's totally accessible to kitties, too. This cat tree, with its sleek lines and neutral color, would make Frank Lloyd Wright (the father of mid-century modern design!) proud.</p><h2>Multi-Platform Cat Tree</h2><p>Your cat 's 3 a.m. hijinks make it sound like there 's a circus going on in your living room, so you might as well give your kitty a solid place to perform. Featuring plenty of platforms, a hammock, scratching posts, and ladder, your kitty can get his acrobatics on at all hours of the night-and then snooze the day away on one of the upholstered platforms.</p><h2>The Lion King Cat Tree</h2><p>Remember the iconic Pride Rock scene from the Disney classic ? Your cat can recreate it every single day with this massive (and super creative!) cat tree. Made from solid wood, it offers kitties plenty of places to romp, scratch, and belt out-err, meow out-The Circle of Life.Because this cat tree is so huge, we 'd recommend mounting it to both the floor and ceiling. You never know when your cat might have to have a showdown with Scar and his hyenas, after all.</p><h2>Minimalist Cat Tree</h2><p>If your cat loves simplistic design, white walls, and IKEA, she just might be a decor minimalist-and this minimalist cat tree can fulfill all of her Scandinavian cat tree dreams. It checks all the boxes for minimalistic design-including a simple, organic color palette and shape-while satisfying her need to scratch and snooze. Add a really expensive kitty drink from a hip coffee shop, and she 'll be set.</p><h2>A Wall-Mounted Jungle Gym for Cats</h2><p>If you 're lacking some floor space-and your cat is lacking in energy-a wall-mounted cat tree might be the perfect solution. With platforms, bridges, ladders, and hammocks, your cat can channel his inner Indiana Jones and leap from mount to mount. You can create your own wall-mounted cat tree with a few common household items or purchase one from your favorite pet retailer. Just be sure to mount each component to a stud in your wall, so they don 't collapse under your cat 's weight. And, of course, watch out for flying kitties when you walk across the room.</p><h2>Where to Find the Perfect Cat Tree</h2><p>There are literally thousands of cat trees on the market, so it 's important to identify your cat 's needs, as well as the type of cat tree your space can accommodate. If your cat loves to scratch, choose a cat tree that features multiple scratching posts. Your cat 's nails and your furniture will thank you! And if you don 't have a ton of square footage for a cat tree, consider a wall-mounted system that will save you precious floor space. Fortunately, pre-made and assembled cat trees are easy to find online and at your favorite pet supply retailers.</p><p>If you want to save a few dollars (and flex your do-it-yourself muscles!) creating your own cat tree is much easier than you might think.</p><p>If possible, use a staple gun to assemble your DIY cat tree-it 'll increase the durability and stability of your cat tree while protecting your cat 's paws from sharp nails and screws. You can also try super strong wood glue, but be sure to let it dry fully before letting your cat play.</p>",994
49,https://www.thesprucepets.com/shopping-list-for-your-new-cat-552019,Cats > Getting Started,<p>The Ultimate Guide</p><h1>Shopping List for Your New Cat</h1>,"<h1>Shopping List for Your New Cat</h1><p>Before you bring your new cat or kitten home, there are a number of things to collect or buy, so your cat will feel like a family member rather than a visitor. Do this a few days in advance to save stress on the ""big day."" In the excitement of bringing your cat home, you don't want to suddenly discover at 8 p.m. that you forgot to buy cat food.</p><h2>Food</h2><p>If you can talk to the caregiver in the cat's last home, it's probably best to give your new pet whatever food she's accustomed to. If you acquire a cat from a breeder, more often than not, their contract will either strongly suggest or require you to feed a certain kind of food.</p><h3>What to Buy for Kittens</h3><p>These babies need more fats and proteins than grown cats, so look for foods with ""Complete and Balanced Nutrition"" on the label as well as the AAFCO animal feeding tested statement ""for all life stages."" There are also foods specifically formulated for kittens. These can be identified by the words ""highly digestible, nutrient-dense and uniquely designed to meet kittens' nutritional requirements."" Kittens from eight weeks upward can handle dry food quite well, although canned food is really better for them.</p><h3>What to Buy for Adult Cats</h3><p>Canned foods are better for cats, but your cat may be used to dry food only. Grown cats thrive on dry food, and any of the premium brands are acceptable. You should also supplement with canned food because eventually, you should try to move your cat over to canned only.</p><h2>Food and Water Bowls</h2><p>Although your new cat can be fed on any ceramic (non-lead-glazed) or stainless steel bowls you have in your kitchen, you may feel better with providing her with her very own dishes. It is not recommended to use plastic dishes for cats, as some cats develop a chin rash from plastic; also, softer plastic scratches, which provides a harbor from bacteria (possibly a case of cause-and-effect here.)There are a number of non-tip stainless steel bowls available for pets. If you prefer decorated ceramic dishes, make sure the glaze is lead-free. To be safe, purchase only products made in the U.S.</p><p>Automatic food and water servers are especially nice if the humans will be gone for long periods during the day, e.g., to a job or school. Most cats love the pure, fresh taste of running water, and automatic water dispensers ensure a constant supply of clean water.</p><h2>Toys</h2><p>All cats love to play, and your bonding time will begin by playing with Kitty and her toys. The ""fishing pole, dangling lure"" kind of toy is a big favorite for interactive play. Just make sure it is sturdy enough that small kittens won't tear off feathers, etc. from the dangling part. Catnip mice are a perennial favorite. Kitty houses and climbing posts can run the gamut from simple cardboard creations to custom built ""cat furniture"" combinations running several hundred dollars.</p><h2>Grooming Tools</h2><p>Grooming time is a fine time for bonding with your cat or new kitten. Look for a fine-toothed comb and a rubber-backed pin brush. A nail clipper designed for cats is a plus. If you start clipping your kitten's nails early, it will make the task much easier when she is grown.</p><h2>Cat Carrier</h2><p>This is a must. Don't ever try to transport a cat without one. A simple cardboard carrier (available from your vet) is fine for bringing a new cat or kitten home, but you'll need to replace this eventually with a solid-bottomed fiberglass or tough plastic carrier with secure latch and a screened opening the cat can look through. A heavy-duty cloth airline-approved carrier is a good alternative if travel is in your future.</p><h2>Scratching Post</h2><p>Your cat is going to scratch, whether you approve or not. Start your relationship off right by investing in a scratching post. It can be as simple or fancy as you like; you can even assemble one yourself if you're handy with tools. Some commercially-made scratching posts have catnip scent applied to attract your kitty. If your budget is limited, start with a cardboard scratcher, such as the Cosmic Alpine Scratcher.</p><h2>Litter Box and Litter</h2><p>Choosing the best litter box for your pet is an absolute must for both indoor and indoor-outdoor cats. Look for a sizable box with high sides for grown cats, as they tend to throw the litter around quite a bit. These can also be as simple or as extravagant as your pocketbook allows but start with a basic plastic litter box for now placed correctly for your feline.</p><p>Kittens will need a box that's low enough for them to enter easily. There are various kinds of litter, and the plant-based kind seems to be the safest. Clumping clay litter contains an ingredient that can harm cats if ingested, and all clay litters tend to stir up dust, which is not healthy to breathe, either for you or your cat.</p><p>Consider a mat under the box to catch the stray litter. You can buy mats for that purpose at a pet store, or buy a few inexpensive carpet or linoleum samples that can just be tossed and replaced when they get too grungy.</p><h2>A Bed (Optional, but Recommended)</h2><p>Since this is your first cat, he or she may likely sleep on your own bed, however, it's still a good idea to provide kitty with her own special, cozy place for napping. The bed should be comfortable, easily washable and spacious enough for an adult cat to curl up comfortably, but not so vast that she'll feel exposed and vulnerable.</p><h2>Make a Vet Appointment</h2><p>This is not exactly an item for a shopping list, but unless your cat comes with papers showing a recent veterinary visit, proof of vaccinations, and negative test results for various diseases and medical conditions, your first stop before even bringing her home, should be at your local veterinary clinic. So make the appointment now, while you're thinking about it.</p><h3>Watch Now: 14 Ways Cats Show Their Love</h3>",986
