,url,breadcrumbs,headings,text,word_count
0,https://www.thesprucepets.com/how-to-lunge-a-horse-1887003,Horses > Horse Behavior & Training,<h1>How to Lunge Train Your Horse</h1>,"<h1>How to Lunge Train Your Horse</h1><p>When you lunge a horse, it moves around you in a circle on the end of a lunge line. Lunging is a useful exercise for both horse and handler. It is a way to let your horse safely burn off extra energy without you riding it and can help when teaching horse obedience.</p><p>When done correctly, lunging can help a horse learn to be more flexible and balanced, as well as increase fitness if the horse has not been working. You can also use it to observe a horse's gaits to see if it is lame. And, lunging can be done to help a rider learn skills without having to worry about controlling the horse.</p><h2>Get Prepared </h2><p>Before you try to lunge your horse, make sure you have everything you need. A lunge line is essential and should be about 30 to 35 feet long. Flat webbing is preferable to rope because it's lighter and easier to handle. You will also need a lunge whip and lunging cavesson or sturdy halter (some people find the cavessons too cumbersome).Exercise boots or wraps help protect your horse's legs.</p><p>Additionally, you will want to lunge your horse in a ring, arena, or round pen. It's important to prevent as many distractions as possible, especially when just starting.</p><p>Gear for yourself will also help out considerably. Sturdy boots or shoes are essential so you don't trip or slide. Gloves can help prevent rope burn if your horse pulls, and it's not a bad idea to wear your helmet just in case. Finally, get your voice ready because it will be the primary aid you will use to cue your horse.</p><h2>Halter the Horse </h2><p>To lunge your horse, it should be outfitted with a lunging cavesson or a sturdy halter. A cavesson is not a necessity and many horses are trained to lunge without one. Do not lunge with the lunge line attached to a bit or hackamore.</p><h2>Enter the Ring </h2><p>Lead your horse to the ring or arena. Place your horse where you want it to travel, and walk to the center of the circle you want your horse to work on.</p><h2>Hold the Lunge Line and Whip </h2><p>If your horse will be working to the left, hold the lunge line in your left hand and your lunge whip in your right. When your horse is traveling in a circle to the right, the lunge line will be held in the right hand and the whip in your left.</p><p>Hold the line and the whip so that they are the sides of a triangle and you are the apex of the triangle. Your horse will be the base of the triangle. Both of your arms should be bent at the elbow and you should be standing relaxed.</p><h2>Walk the Horse </h2><p>Ask your horse to ""walk."" It's important to help your horse understand your voice aids by using the same tone and inflection each time for each cue. Most people use a low drawn-out """"for halt and sharp energetic words for walk, trot, and canter.</p><h2>Maintain the Circle </h2><p>As your horse moves off on the circle, you will be holding the lunge line up not dragging on the ground. Keep elbows bent and the whip pointed at the horse's hocks. Remember to maintain the triangle.</p><p>If you move at all, keep your circle very small. You may find yourself getting dizzy, so don't just spin in one spot.</p><h2>Upward and Downward Transitions </h2><p>Your voice aid for upward transitionswalk to trot or canter, or trot to cantercan be reinforced by the whip. For some horses it will only take a wave of the whip, others may need the lash to be popped. This is done by flicking the whip sharplyyou may need to practice perfecting this before you try lunging.</p><p>For downward transitionstrot to walk, walk to halt, canter to walk, or trot to haltmany people lower the tip of the whip to the ground. At no time does the whip ever touch the horse.</p><h2>Halt the Horse </h2><p>When you ask your horse to halt, it should stay out on the circle and wait for you to approach. Some people like the horse to come to them when called. If you do this, gather the lunge line up so it doesn't drag on the ground as the horse approaches.</p><h2>Halt and Change Direction </h2><p>Ask your horse to change direction: ask it to halt, step backward, and turn. Then change your whip and line hands and send the horse off in the opposite direction. This will take some practice for you to become coordinated in the movement and your horse to understand what you are asking. Very soon, you will not have to ask the horse to halt but be able to change direction in one fluid motion at a walk or trot.</p><h2>Problems and Proofing Behaviors </h2><p>Many people lunge their horses to burn off energy and provide exercise. Be careful that you don't make your horse fitter than you are. That will lead to it taking longer for your horse to level out.</p><p>Lunging isn't just about firing around in a circle or simply letting a horse run in circles around you. Doing either of these can lead to poor obedience and injury. The horse should be as obedient on the lunge line as it is when being led. Not only should lunging be physical exercise but mental exercise as well.</p><p>Most importantly, lunging is not a form of punishment.Punishing a horse is never a good idea and will only lead to a horse that acts out. Instead, you want to develop a bond with your horse and get them to trust people. Lunging is a fantastic way to do that.</p><p>The faster your horse is going, the larger the circle needs to be. You can do this by letting out more line. Lunging on a small circle can be very hard on a horse's legs, so increase the work gradually for the horse to become supple, fit, and balanced without strain.</p>",992
1,https://www.thesprucepets.com/why-do-horses-kick-1887278,Horses > Horse Behavior & Training,<h1>Why Horses Kick and What to Do About It</h1>,"<h1>Why Horses Kick and What to Do About It</h1><p>A horse that kicks can be dangerous. Even if your horse is merely kicking at a biting fly, and you happen to get in the way, you can be hurt. Some horses develop a bad habit of kicking and can be a menace on the ground, or while being ridden or driven.</p><h2>Why Horses Kick </h2><p>Horses kick for a number of reasons. As mentioned above, a horse may kick at biting flies around its legs and belly. A horse will kick at its belly if it has colic. They may kick or stamp if something like a prickly weed tickles their legs or belly. Usually, these aren't really powerful kicksafter all, if the intent was to get rid of the discomfort, they could further hurt themselves.</p><p>Horses are often seen kicking at each other in the pasture.When playing, these won't be powerful kicks, and they'll rarely connect with another horse. This can simply be a display of high spirits, often seen as the horse gallops and bucks to burn off energy.</p><h2>Defense </h2><p>Horses also kick to defend themselves, and these kicks are often powerful and well aimed. Horses may defend themselves by kicking when they feel another horse is getting too close to its food, its foal, a special herd mate, or if another horse is acting aggressively towards it. In the wild, horses use powerful kicks, often with both back legs at the same time, to ward off predators. A mare may kick at a stallionifit is not receptive to being bred.</p><p>This defensive instinct may explain why some horses kick when they become alarmedsuch as when a person, dog, or another animal 'pops into view' behind the horse. Or if a piece of equipment comes loose and drags behind or alongside the horse, it may react by kicking at it. A horse being trained to pull, may kick at the equipage, unless it is introduced to it slowly, and allowed to get used to the sight and noise of a horse-drawn vehicle.</p><h2>When Kicking Becomes a Problem </h2><p>Kicking while being handled, ridden, or driven can become a dangerous habit or vice. Somewhere along the line, the horse has learned that kicking is the best strategy to rid itself of something it dislikes. It then becomes a habit that the rider, handler, or driver must always keep in mind. Some horses get antsy when another horse is ridden too close behind and may kick to warn the other horse away. This causes a problem when the horse is being ridden in a group, or in a crowded area like a horse show. Both the horse and the rider (and spectators) are then in danger of being injured. I do know of incidents in which a horse has kicked at another, and the rider has taken the brunt of the blow.</p><p>Some horses dislike dogs, cats, or ponies and will offer to kick them anytime they get too close. Horses that have been hurt while being saddled up or having the girth/cinch done up quickly, will often 'cow-kick' in anticipation of being pinched. My daughter's nose was broken in one such incident. As she bent to reach under the horse to do the girth up, the young horse reacted by cow kicking, catching her in the face.</p><p>Some horses will kick out in defiance. This is a show of disrespect. These kicks are aimed towards you, but the horse knows it isn't within range to connect. This often happens while lunging or working in a round pen. Some horses kick the walls of their stalls when they are bored or impatient.</p><h2>How to Deal with a Problem Kicker </h2><p>If your horse seems to be a habitual kicker, there are a few things you can do. If you're out, tie a red ribbon on its tail to warn other people that the horse is known to kick. If you're riding in a group, ride at the back of the pack, and make sure others know of its habit. Teach your horse to respond to leg aids. A horse that is moving forward is less likely to kick. In a situation where another horse comes too close behind, you will be able to swing your horse's hindquarters to one side or another so your horse, even if it does kick out, can't hit its target.</p><p>Handling a horse that kicks takes extra caution. Any time your horse is in public, it should be wearing a red ribbon. Anyone who must work around the horse should be aware of the horse's habit. You and anyone else that must come near your horse must stay out of range of those hind legs. If you're in a public place like a horse show or fair, you need to position your horse away from foot traffic and other horses.</p><h2>Learn to Watch Body Language </h2><p>Most horses will warn you with their body language before lashing out. So, in addition to knowing what situations may trigger a kick, you need to understand its ear, head, and body posturing that may occur before a kick. Whether the horse is aiming its blow carefully or being defiant, you need to recognize the signs of an impending kick and give the horse something else to think about.</p><p>You may be able to lessen the vice by desensitizing the horse. If it seems to be scared and kicks out at a specific thing, you'll need to work gradually to get the horse accustomed to that thing. If it cow-kicks while being saddled, you need to be consistently gentle and slow about the process. If the horse habitually kicks at others in the pasture, it may need to be separated if it's causing the others injury.</p>",953
2,https://www.thesprucepets.com/why-horses-chew-wood-1887279,Horses > Horse Behavior & Training,<h1>How to Stop Wood Chewing in Horses</h1>,"<h1>How to Stop Wood Chewing in Horses</h1><h2>It's not good for the horse or the wood</h2><p>Horses are highly intelligent animals naturally inclined to be outside in large areas, and as such, when confined too long may develop bad habits out of boredom or frustration. A common habit that horses develop to ease their boredom and frustration is chewing on their wood stalls or other wood in their enclosures.</p><p>Not only does chewing damage the wood, but it can also create problems for the horse such as causing undue wear on the incisors and the chance of splinters being lodged in the mouth or swallowed.</p><p>There are some medical issues, such as vitamin deficiencies, that may compel a horse to chew wood. But most of the time a horse that's chewing on wood is a bored horse.</p><h2>Why Do Horses Chew Wood? </h2><p>There are a few reasons why horses chew wood. It's worth noting that wood chewing is not typically observed among wild horses, so this is a behavior that typically results from keeping a horse in an unnatural environment.</p><h2>Boredom </h2><p>Horses kept in stalls or paddocks, secluded from other horses, or fed mostly concentrates without enough fodder to keep them chewing over a long period of time may become bored and chew fences for something to do.</p><h2>Nutritional Deficiencies </h2><p>Occasionally, vitamin deficiencies may cause a horse to develop a taste for eating non-edible substances in an effort to alleviate the deficiency. This is not as common, but pica may indicate a serious underlying nutritional or hormonal problem.</p><h2>Habit </h2><p>Some horses may have learned to gnaw wood from stable or pasture mates. Like mischievous kids, they try what the other kids are trying, even if they would never have thought of it on their ownand the habit sticks. This is a bit of a trickier situation when it comes time to train the horse out of the wood-chewing behavior, because you may need to involve more than one horse in your efforts.</p><h2>Cribbing </h2><p>Horses that crib can be hard on wood (and other surfaces) too. However, this isn't truly wood chewing.</p><p>Cribbing formally referred to as , is an obsessive-compulsive disorder (again, found only in domesticated horses), where the horse sinks its incisors into an upright object like a fence post, then pulls against the object while inhaling and arching its neck. The horse isn't really chewing on the wood since it doesn't break off or swallow any pieces; it's more like leaning on the surface in order to forcibly gulp air.</p><h2>How to Stop Wood Chewing </h2><p>Once your veterinarian has ruled out any medical or nutritional issues, you can start addressing the behavior that's causing your horse to chew wood.</p><h2>Keep Your Horse Outdoors </h2><p>Horses that are kept indoors are more likely to develop habits to try to alleviate their boredom and frustration. Outdoors, some horses may get bored because there may be little to do once they eat all their hay. Horses in the wild spend the majority of their time grazing.</p><p>Allowing horses to live as naturally with other horses as possible, outdoors with plenty of grass or hay to nibble on, can help prevent wood chewing. But there are times when outdoor turnout isn't possible, such as when a horse has an injury requiring stall rest, if there isn't space or resources for all-day turnout, or conditions such as icy pastures make it dangerous for horses to be out.</p><h2>Treat or Protect Wood Surfaces </h2><p>Applying sprays, pastes, or washes that have a bitter taste painted onto the wood surfaces may be an option. The downside of such products is that they get washed off in the rain, and some horses don't seem to notice the taste. Additionally, make sure what you are applying to the wood is non-toxic.</p><p>You can nail metal caps over fence rails and posts, protectively wrap trees, and use plastic mesh as well. A string of electric fencing along the top rail of a fence usually keeps determined chewers back, and you can try setting up little pens around trees to prevent your horse from getting close enough to chew.</p><h2>Socialize Your Horse </h2><p>Along with more outdoor activity, socializing your horse with other horses may help alleviate some of its boredom. But don't pair up two horses that both chew on wood, and take care that the wood chewer doesn't end up being a bad influence on its nonchewing stablemate.</p><h2>Give Your Horse a Toy </h2><p>You may also want to provide your horse with a toy to play with to direct its attention away from wood surfaces, such as a large rubber ball.</p><h2>Check Your Horse's Diet </h2><p>Discuss this with your veterinarian first, but there's some evidence that when the amount of grain in a horse's diet is reduced, the horse is less likely to chew wood or engage in cribbing. Also be sure to offer your horse as much roughage as possible, to satiate your horse's natural grazing instinct.</p><p>Finding the right solution to wood chewing can save you money as well as ensure your horse's good health.</p>",853
3,https://www.thesprucepets.com/how-you-can-be-hurt-by-a-horse-1887397,Horses > Horse Behavior & Training,<h1>The 8 Most Common Ways You Can Be Hurt By a Horse</h1>,"<h1>The 8 Most Common Ways You Can Be Hurt By a Horse</h1><p>Many horse owners have never been seriously hurt by their horse. There's certainly no reason to be afraid of horses. However, when you are working with an animal that is large and reactive, you need to understand the common behaviors of this animal and learn how to safely work with and around it. If you take care and learn to understand horses, you can reduce the risk of injury greatly. The Canadian Hospitals Injuries Reporting and Prevention Program (CHIRPP) states that 49.6% of horse-related injuries required either 'advice or minor treatment'. Here's a list of common injuries that could occur as you work with or ride your horse.</p><h2>Being Stepped On </h2><p>Getting your toes crunched because you didn't move out of the way quickly enough is common. Even experienced horse owners occasionally don't move their feet as fast as their horses move theirs. This can lead to bruising, abrasions, and even fractured bones. It is possible to have your fingers stepped on, say when cleaning hooves, but far less likely. After a fall, it's possible that the horse might step on you, but often your horse will do what it can to avoid you.</p><h2>Kicks and Strikes</h2><p>Horses can strike out with their front or rear hooves, and they can strike out backwardand forwards with both. Sometimes, kicks are accidental, such as when a horse kicks at a fly and the handler gets in the way. Some kicks are intentional. Getting kicked by another horse while riding is also a risk, so be sure to keep a safe distance between horses when riding in a group.</p><h2>Falls</h2><p>According to the CHIRPP, 62% of reported horse-related injuries occurred due to falls. When you fall, almost any part of your body can be injured. Breaks or strains to arms, wrists and collar bones are common when riders try to break their fall by putting their arms out, as the rider in this photo is doing. The horse can also end up getting hurt.</p><p>Riders have been badly injured when a horse steps onor falls on them. And of course, the leading cause of death in riders is head injury. You can learn how to fall.But thatdoesn't mean you'll be able to avoidall harm.While a helmet won't guarantee 100% protection, statistics show that they do decrease the risk of traumatic brain injuries greatly.</p><h2>Bites</h2><p>Horses bite to defend themselves or to express irritation and impatience. Some are sneakyand disrespectful. Horses that get pushy about being fed treats can become demanding and bite fingers and arms. Horses can bite hard enough to break fingers and can cause severe bruising and cuts.</p><h2>Getting Knocked Over </h2><p>Getting knocked over by a horse is possible while it is loose, tied or being led. The more you work around a horse, the less likely this becomes, as you learn to anticipate what your horse is thinking and will do next. Getting knocked over can lead to sprains, bruises, and broken bones and teeth. </p><h2>Strains and Sprains </h2><p>When you first learn to ride you will be waking up a few sore muscles, some of which aren't really used in other sports or activities. Many people will feel soreness in the muscles along the inside of their upper thigh. Others may feel their calf muscles, either along the outside or at the back, tired after a ride. Backaches are common and can indicate a poorly fitting saddle, or poor riding position. Shoulders can also become tight. The good news is, as you strengthen and stretch these muscles, and learn to ride better, most of these pains will go away.</p><p>However, there are other strains that can happen by accident. A lot of things can happen as you fall including, straining or spraining joints and muscles either on the way down or as you land. If your horse suddenly spooks as you are leading it, your arm or shoulder muscles may get pulled. Sudden overexertionsuch as lifting your saddle, a bale of hay or carting a load of manure incorrectly, can also cause muscle strain.</p><h2>Being Dragged </h2><p>Being dragged from the ground, or getting dragged after a fall can result in injury. Even a relatively small pony can drag an adult around, causing muscle strain and abrasions if you lose your footing. Of course, whether you're dragged while handling or hung up in the tack, there is a danger of being kicked while you're down there. Getting caught in the stirrups can lead to very severe injuries if the horse spooks, runs and kicks. Thankfully, being dragged can be largely avoided by learning to lead a horse properly and using safety stirrups and proper footwear.</p><h2>Riding Into Obstacles </h2><p>Trail riding often means you encounter low branches that can scratch, stab you and even sweep you off the saddle. In an arena, it's possible to be taken through low doors, or bump into walls or obstacles like jumps or barrels.</p>",817
