,url,breadcrumbs,headings,text,word_count
88,https://www.thesprucepets.com/getting-rid-of-ticks-puppies-dogs-2804944,Dogs > Getting Started > Puppies,<h1>Tick Bites in Puppies</h1>,"<h1>Tick Bites in Puppies</h1><h2>Causes, Treatment, and Prevention</h2><p>If your puppy spends time in wooded, grassy areas where ticks are prevalent, it is at risk of receiving a tick bite. In most cases, tick bites are harmless, but some ticks carry serious diseases transmittable to your puppy. If a tick bites your puppy, but your puppy exhibits no symptoms, you don't necessarily need to visit your vet. But, if your puppy begins to show symptoms like fever, swollen lymph nodes, or limping after being exposed to a tick-ridden area, visit your vet for a diagnosis. If detected and treated early, you can quickly resolve illness from a tick bite. If left untreated, the results may be fatal. The best way to keep your puppy safe from tick bites is with preventative, anti-tick medication.</p><h2> What Are Tick Bites? </h2><p>Tick bites occur when a tick crawls onto an animal or human and sucks its blood. After being latched for several days, the tick's body will swell with blood and fall off. Typically, tick bites are not painful and can go unnoticed until symptoms appear. Most tick bites are benign and will only irritate the skin, but others cause diseases that, if untreated, can result in serious harm to your puppy. These diseases include Lyme disease, Rocky Mountain Spotted Fever, and tick paralysis.</p><p>There are more than 800 tick species worldwide, but only a few North American ticks will bite your pet. The American dog tick, the brown dog tick, the black-legged tick (deer tick), and the lone star tick are the most likely to harm your puppy.</p><h2> Symptoms of Tick Bites in Puppies </h2><p>If you can see an engorged tick on your puppy, it's safe to assume your puppy has been bitten. If the tick has fallen off before you notice it, you will have to wait on the development of symptoms to signal a tick bite has occurred. The symptoms of a tick bite in a puppy are shared with many other conditions, so be mindful of the context in which they occur. If your puppy has been in an area where ticks are prevalent, it's possible it has been bitten by a diseased tick. Symptoms typically don't appear until weeks or months after a bite.</p><h3>Symptoms</h3><h3> Fever </h3><p>A diseased tick bite can cause a fever up to 105 F. Any diseased tick can transfer an infection that leads to fever. If you notice your puppy panting, shivering, experiencing lethargy, or other signs of discomfort, it might have a fever. Pay a visit to your vet to see if a tick bite is to blame.</p><h3> Swollen Lymph Nodes </h3><p>Swollen lymph nodes are symptomatic of many serious conditions in dogs, including a bite from a diseased tick. Look for swelling around your puppy's face and neck.</p><h3> Vomiting </h3><p>If your puppy begins to vomit following exposure to a tick-ridden area, it may have been bitten by a diseased tick. Vomiting, often accompanied by diarrhea, can be caused by a variety of illnesses, so take your puppy to the vet to receive a proper diagnosis.</p><h3> Limping and Lameness </h3><p>A bite from a diseased tick can cause limping or lameness in your puppy. Lyme disease, for example, often leads to joint inflammation, which affects your puppy's ability to walk comfortably. You may notice that your puppy's limp shifts between legs.</p><h3> Skin Irritation </h3><p>If a tick has bitten your puppy, it may scratch or itch at the bite site. Typically, tick bites are not itchy, so irritation around the bite site may be attributed to infection. Additionally, some redness may be caused by scratching or the bite itself.</p><h3> Enlarged Tick </h3><p>The most reliable sign of a tick bite is an enlarged tick attached to your puppy's skin. After a tick has bitten your puppy, it becomes engorged with the drawn blood. If the tick isn't engorged or is still crawling on your puppy, it likely hasn't bitten.</p><h2> Causes of Tick Bites </h2><p>Your puppy is at risk of being bitten by a tick if it has been exposed to a tick-ridden area.</p><h2> Diagnosing Tick Bites in Puppies </h2><p>If your puppy is not exhibiting symptoms of a diseased tick bite, it is usually not necessary to visit your vet for a diagnosis. However, if your puppy begins exhibiting symptoms following exposure to a tick-ridden area, see your vet. Your vet may run blood tests to check for antibodies caused by tick-borne illness. Lyme disease, caused by diseased tick bites, affects the kidneys, so your vet may run a urinalysis to determine the health of your puppy's organs.</p><h2> Treatment </h2><p>The improper removal of a tick can cause the spread of disease. If you see a tick on your puppy, use gloves to avoid exposure to diseased tick saliva. Blunt-nosed tweezers are best for removing embedded ticks from your puppy's skin. First, grasp the tick close to the puppy's skin and pull straight upward, gently and slowly. The goal is to remove the tick head along with the tick. If you pull off the tick but its head remains burrowed in your puppy's skin, you will have to monitor the area closely for any signs of infection. Be sure to place the tick in a substance like rubbing alcohol to kill it. Do not throw the tick into the trash or return it outdoors, as it can crawl and bite again.</p><p>Puppies that have been bitten by a tick won't always need treatment, but your vet may want to run additional diagnostics to determine if treatment is necessary. If your vet suspects disease, your puppy will likely be prescribed a month-long antibiotic. Some severe cases of tick-borne diseases can warrant hospitalization, but if detected and treated early, you can usually avoid this. If your puppy has been bitten, treat the bite site with an antiseptic to prevent skin infection after removing the tick.</p><h2> Prognosis for Puppies With Tick Bites </h2><p>Puppies tested and treated early after being bitten by a diseased tick will typically recover completely. The use of antibiotics is effective in resolving disease. If your puppy's diseased tick bite goes untreated, the effects can be lifelong or fatal.</p><h2> How to Prevent Tick Bites </h2><p>Using a vet-recommended flea and tick prevention on your dog year-round is essential in protecting your puppy from tick bites. These medications can kill ticks before they can transmit diseases. Ask your vet how best to protect your puppy, as age and preexisting health conditions influence the type of product you should choose.</p><p>It's also helpful to keep the grass in your yard short and keep your puppy away from tall grassed areas where ticks are prevalent. Clearing away vegetation in your yard that might contain tick-bearing rodents may also be helpful. In areas with high tick volume, treating the tick's habitat with pet-safe chemicals also helps reduce the pest population. Inside your home, vacuum and wash your puppy's bedding regularly.</p><p>It will probably take weeks or months before your puppy develops symptoms from a diseased tick bite. Once the symptoms appear, take your puppy to the vet right away.</p><p>Not all tick bites are harmful, but if you find a tick on your puppy, monitor it closely for symptoms. If your puppy doesn't exhibit any signs of illness, the tick bite was likely from a tick without disease, and further treatment isn't required.</p><p>If you suspect that your puppy is sick from a tick bite, your vet can perform a series of diagnostic tests. Usually, these tests will include blood analysis and a urinalysis to determine the presence of disease antibodies and the health of your puppy's kidneys.</p>",1249
89,https://www.thesprucepets.com/walking-puppy-when-its-too-hot-4082759,Dogs > Getting Started > Puppies,<h1>Walking Your Puppy When It's Too Hot Outside</h1>,"<h1>Walking Your Puppy When It's Too Hot Outside</h1><h2>How to Make Sure Your Pup Gets Enough Exercise When The Weather is Hot</h2><p> Dr.</p><p>When summertime is in full swing, temperatures may consistently be over 90 degrees Fahrenheit with humidity in the 70s or 80s. This makes going outside a very arduous chore. But when you have a puppy, there are times when you are just going to have to go outside, most notably for bathroom times for your puppy and to get them some exercise.</p><p>When you and your puppy have to go outside for any time, make sure you go prepared. Here are some tips on how to get your puppy the exercise he needs when it is too hot to go outside.</p><h2> Choose the coolest parts of the day to take your puppy outside. </h2><p>When you need to take your puppy for bathroom time, the early morning, late afternoon, and evening are best for being able to spend more time out and about. Choosing these times will give your puppy the ability to stretch his legs a little more, and you won't have to worry about the sweltering heat quite as much. Of course, it can still be hot, so being prepared is still key.</p><h2> Offer your puppy water before going outside. </h2><p>As the saying goes, you can lead a horse to water, but you can't make him drink. And that is a pretty apt saying for this situation. If your puppy doesn't drink, then so be it. But always make sure to offer water. You can try teaching your puppy a cue word or phrase to drink water.</p><h2> Pack water if you are going to be outside for more than a few minutes. </h2><p>Sometimes you and your pup get distracted by the world around you, so it's good to come prepared. Try to grab a small bottle of water when you and your puppy go outside for a quick bathroom walk. If the quick bathroom break turns in to stroll around the block, you'll be ready to go. Bare minimum, you can make a bowl with one of you hands for your pup to drink from.</p><h2> If the sun is harsh, consider an umbrella. </h2><p>Perhaps it sounds a little ""Downton Abbey"" to carry a parasol for the sun, but you aren't wearing a fur coat. And the sun can actually be even worse if you have a hairless dog or one with extremely short hair! Carrying an umbrella offers a bit of shade that can really help keep your puppy cool in the midday sun. </p><h2> Sunscreen is best for some dogs. </h2><p>It may sound weird, but there are hairless dogs that will burn just as bad as any human if they don't have sun protection. Be aware of light colored and hairless places on your dog so they don't get sunburned. Just be sure to use a dog-safe sunscreen (avoiding ingredients like zinc oxide) and avoid getting sunscreen in their eyes. </p><h2> Keep in mind that asphalt is HOT in the summer. </h2><p>During summer, it can be dangerous to walking your dog across the blacktop of a parking lot or street. While dogs paw pads are stronger than the bottoms of our feet, they can still blister and burn, especially for inside dogs who spends most of their time on carpet and rugs. So, if you wouldn't want to walk across it, don't make your puppy do it. </p><p>When you need to take your puppy for bathroom time, early morning, late afternoon, and evening are best for being able to spend more time out and about. Try to stick to grassy or shaded areas.</p><h2> Try exercising your puppy indoors. </h2><p>Here are some good games to play with your puppy to help get their energy out while still enjoying the miracle of air-conditioning.</p><h2> Recall Games </h2><p>The simplest recall game to play is just a simple back and forth across a living room, hallway, or kitchen. This game require two people, and each person should have a handful of treats. One person gently restrains the puppy by the collar while the other person starts to call them. Don't immediately let go, but wait a half second to get the puppy a little more excited about going. Then, direct the puppy towards the other person. Once the puppy gets there, give him a treat, praise him, and prepare to send him back by repeating the process. Keep doing this for a few minutes at a time.</p><p>You can really up the ante on this game by using stairs, going around corners, and covering longer distances. If your puppy becomes disinterested in the game, go ahead and wrap up. This is supposed to be fun for everyone involved, so NEVER correct them when they come, even if they get distracted part way. Just be more interesting!</p><h2> Hide and Seek </h2><p>This is a recall game variation, but it is different enough to give it its own space. The great thing about this one is that you can play it with only one person. Simply wait until your puppy is distracted and sneak away (make sure you have a snack in your pocket). Make it easy the first few times until your puppy gets the idea. Hide just one room over and call your puppy. Stand behind a door. Hide behind the curtains or behind a couch or chair. Just be aware, if you hide in something like a cabinet or closet, your puppy may learn how to open these things! So be conscious of what unintentional training you may be doing while playing this game.</p><p>If you have more than one person, each person should hide and take turns calling the puppy once he has found one of you. If he is really good at this game, both people can call him and see who he finds first! Rewards and lots of praise make this a fun game to keep attention. </p><h2> Visit Pet-Friendly Stores </h2><p>Granted, this one requires going outside some to get there, but think about all the great things you can do once you are in the store! You can work on training that you've begun at home. Do ""sit-stays"" in front of the bone displays. Work on sitting and greeting people nicely when the store staff offers a treat. Practice ""come when called"" when your pup is distracted by that crafty low bucket of treats stores always have. Use ""leave it"" when they think that the ferret cage is the greatest invention you r dog has ever seen.</p><p>Make sure that your puppy is fully vaccinated, healthy, and ready to be in public spaces. Just be aware of safety, especially the heat of the parking lot when walking in. </p><h2> Have lots of fun and interactive toys for your puppy. </h2><p>Toys help make an enriching environment for your puppy and are great for days when playing outside is not very easy due to the heat. Provide a variety of fun and interactive toys for your puppy, and play together with your pup.</p><p>Keeping a puppy happy and exercised during the peak of summer can be challenging. But with a little time and creativity, you and your puppy will be worn out and satisfied in no time if you follow these easy tips!</p>",1203
90,https://www.thesprucepets.com/why-dogs-jump-4063491,Dogs > Getting Started > Puppies,<h1>Why Dogs Jump up and Down and How to Stop It</h1>,"<h1>Why Dogs Jump up and Down and How to Stop It</h1><p>Not only are dogs jumping on you generally annoying, but it can also be dangerous for people who aren't as steady on their feet. It can make people very mad at your dog. </p><p>Since dogs don't use the same language we do, they cannot communicate with us in the same way. So we have to look at their actions and behaviors as their method of communication. </p><h2> Dogs Jump to Say Hello </h2><p>If you have ever seen two dogs when they meet, they greet each other face to face, unless there is a massive size disparity. So, why are we surprised when that is how a dog wants to greet us? You come home from work and let your dog out, and they are excited to see you and excited to show you how much they have missed you. So they jump up on you to get closer and give you some love. </p><h2> How to Stop Dogs From Jumping to Say Hello </h2><p>To stop this type of jumping, you need to be consistent in your training approach and try to encourage all family members and visitors to follow your lead. Your dog will take its cues from your body language and how you start the interaction.  Consistency is key so making sure each greeting follows the same rules will help your dog to learn what is expected of it.</p><p>The most common way to train your dog not to jump when greeting you is to use a combination of positive reinforcement for the behavior you want, and to ignore the behavior you don't want, which is the jumping. When you come through the door, try to greet your dog calmly so as not to overexcite it. If your dog jumps on you, turn your back to it and ignore your dog until it sits or waits calmly. Some trainers even recommend exiting the room. When your dog stops jumping and is calm, then you reward your dog with praise, treats, and attention.</p><p>While your dog is learning this new routine, it can be helpful to keep your dog's leash on so you can quickly get control if your dog is too excited. Some trainers also recommend using a head harness type of leash which allows gentle control of the head without hurting the dog. This can be especially useful if you need to prevent your dog from jumping on particular people.</p><p>At first, you may need to practice this under the most relaxed circumstances. For example, this could be when you have just left the room momentarily, as opposed to after you have been gone for long periods of time or when there are a lot of people around. As your dog gets used to what is expected, you can start to increase the distractions and the level of excitement by practicing these techniques after longer separations and when more people are present. It will also help if your visitors and family members follow the same pattern so as not to create confusion for your pup.</p><p>You can teach your dog other specific cues to help your dog understand what you do and do not want it to do. Helpful cues may include ""sit"" ""snuggle,"" and even the ""go to your bed"" on command. The more cues your dog knows, the more you can communicate with your dog and help it understand what is expected and how to react under different circumstances.</p><p>If you want to teach your dog another way to show affection without jumping, a command such as ""snuggle"" or ""hug"" (or whatever term you choose) can be helpful. You can teach your dog that when you say that command and hold your hands down at its level, it can lean into your hands for pets and hugs. This way, your dog has another way to seek affection without jumping. In many cases, the praise and petting may be enough positive reinforcement for your dog to learn this cue and to start to do it on command. For some dogs, adding a treat to reward this behavior can provide even more motivation for it to follow the cue.</p><h2> Dogs Jump out of Fear </h2><p>If a dog is stressed or afraid, their demeanor and typical behaviors will change. If your dog starts jumping on you or certain people all of a sudden, it is worth taking note. Did something in their routine change? Can you identify certain triggers that happen right before your dog jumps? Does your dog show other signs of fear or anxiety such as separation anxiety when you leave, or fear of thunderstorms? Often anxious dogs will exhibit more than one behavior that is a sign of their anxieties but it can take time and patience to figure out what is setting your dog off.</p><h2> How to Stop Dogs From Fearful Jumping </h2><p>You may have a general idea that your dog is anxious based on other behaviors it shows, but if you need help figuring it all out, it can be very useful to work with an experienced dog trainer and/or veterinary behaviorist. They can help identify the triggers as well as to work with your dog on becoming desensitized to those fears.</p><p>Some techniques that they may suggest include giving your dog a safe space in your home, such as a crate or pen where your dog knows it can go when scared. Setting up a crate or pen as a safe space means it should be all positive associations; treats, toys, and other things your dog loves. Your dog should not be sent there as punishment or locked in, especially while you are establishing this. It can be a great tool to have when you know something fearful is going to happen and you need your dog to have a quiet place to retreat to.</p><p>If you can identify specific triggers, you can reduce your dog's fear in two main ways. The first way is to avoid those scary situations as much as possible to limit your dog's exposure to them. The second approach is to gradually try to desensitize your dog to its fear. This usually involves working in baby steps to get your dog comfortable with a fearful situation. A fearful dog should never be forced or intimidated into doing something scary. This can backfire by making your dog even more fearful, deteriorating the trust between you and your dog, and it can even lead to aggression if your dog feels desperate.</p><h2> Dogs Jump Due to Poor Social Skills </h2><p>Caring for a dog that was poorly socialized is a balancing act. It's about working with them slowly and patiently so they can experience new things, get used to living in your world, and minimize their fear and anxiety.</p><p>Dogs with poor social skills oftentimes just don't know better. They lack the communication tools most dogs have so they are unable to read body language and respond the way other dogs would. These dogs can come from any background, whether a rescue or a puppy from a great breeder; if they didn't spend their formative puppy time surrounded by other dogs and lots of different experiences, they may not know how to react to these situations.</p><h2> How to Stop Dogs With Poor Social Skills From Jumping </h2>",1213
