,url,breadcrumbs,headings,text,word_count
0,https://www.thesprucepets.com/nine-tips-safe-camping-with-dogs-3385630,Dogs > Getting Started,<h1>10 Tips for Safe Camping with Dogs</h1>,"<h1>10 Tips for Safe Camping with Dogs</h1><p>For those who spend a lot of time in the Great Outdoors, you may be wondering if it's a good idea to bring your dog on a camping trip. The good news is that most dogs would be more than happy to enjoy an adventure in the wilderness with you.</p><p>But, of course, there are some things to consider before you pack up the car and head to your campsite if you plan to bring your four-legged friend. Here are some ideas to make your camping trip safe (and fun!) with Fido in tow.</p><h2>1. Plan Ahead</h2><p>When planning a camping trip for you and your four-legged buddy, you'll want to be sure to check off a few important boxes on the to-do list before you hit the road. For starters, you'll want to reserve your campsite early (particularly during peak travel or vacation times) and double check the pet policies and any rules that apply to canine visitors. You should also plan a travel route that incorporates opportunities to pull over and allow your dog to use relieve himself and get a little exercise.</p><h2>2. Invest in the Right Gear</h2><p>Most avid campers will tell you that the right gear can make all the difference, and the same rule applies to your canine companion. If you haven't already, you may want to invest in high-quality gear for your dog that can help ensure a successful camping trip, whether it's a sturdy and properly-fitted harness or a set of durable food and water bowls.</p><h2>3. Make Sure Your Dog Has ID</h2><p>Much like any other time you leave your home&mdash;especially for an extended period of time like a trip or vacation&mdash;you should always be sure your dog's collar tag and microchip registration are up-to-date. While most dogs love the outdoors, it can be all too easy for them to get overwhelmed with all the sights and smells of the woods and wander off to explore or take chase after a squirrel or rabbit.</p><h2>4. Visit the Vet</h2><p>Speaking of your veterinarian, it's always a good idea to schedule an appointment before you embark on any sort of trip with your dog. You'll want to be sure your dog is up-to-date on vaccinations (especially if the campground is requiring them for entry) as well as ensure that your pup isn't dealing with any potential health issues that could make it unsafe for them to go camping. Your vet can also trim your dog's nails to help prevent them from getting caught on anything outdoors.</p><h2>5. Don't Forget the Food</h2><p>It can be tempting to share that yummy campfire food with your pup (especially as he or she stares at you with longing eyes), but you'll want to try to keep your dog's diet as normal as possible during your trip in order to prevent stomach upset like diarrhea or vomiting&mdash;not to mention more dangerous conditions like pancreatitis. A plain piece of cooked chicken or fish with no added salt or other spices is probably fine, but fatty trimmings and any other oily food can be harmful to your dog.</p><p>It's also extremely important to be sure your dog has access to fresh, clean water at all times and a shaded area to rest&mdash;particularly if you're camping in the summer months&mdash;to prevent heat stroke. And if you think you can just rely on a pond or stream to give your dog a refreshing drink, think again. The water may contain algae and/or parasites that can be harmful to dogs.</p><h3>Warning</h3><p>Be extra careful with corn cobs and other camping favorites like s'mores, as consuming these can actually be fatal for dogs&mdash;corn cobs can cause life-threatening intestinal blockages, while the chocolate in everyone's favorite campfire dessert is toxic to canines.</p><h2>6. Bring Emergency Supplies</h2><p>If you're an avid camper, your backpack probably already contains some basic first aid supplies, from bandages for cuts and scrapes to moleskin for blistered feet. But when bringing your pooch camping, you'll also want to prepare for any emergencies that may be specific to canines.</p><p>For example, if your dog is already on medication, you'll want to be sure you bring that with you. And if you have a breed that's a particularly active and high-energy, you may also want to consider supplies such as gauze, rubbing alcohol or hydrogen peroxide, or surgical tape in case of any physical injuries. Other potential emergency items might include antibiotic ointment, vet wrap, or foot balm to help protect their paws.</p><h2>7. Know How to Remain Calm</h2><p>You can pack all of the first aid supplies you could ever possibly need, but if you don't know how to remain calm and react in an emergency situation&mdash;and actually use those supplies appropriately&mdash;then they aren't going to be particularly useful. If your dog has been injured, it's going to be crucial to remain as level-headed as possible and address the situation immediately, whether it's an animal bite or your pup is exhibiting symptoms of heat stroke. Dogs are very intuitive and will be able to sense if you're panicking, which will make them more likely to act out.</p><p>If you feel your emergency response skills could use some improvement, be sure to check local outdoor supply stores to see if they're offering wilderness first aid classes. Organizations like the Red Cross&mdash;and even some community colleges&mdash;also offer courses that are specific to teaching first aid for your dog.</p><h2>8. Watch Out for Wildlife</h2><p>When you go on a camping trip, encountering various critters in the woods is par for the course. But you don't necessarily want your pup coming nose-to-nose with a porcupine or skunk, and you definitely want to avoid a run-in with a larger, more dangerous animal like a bear, wolf, or poisonous snake. Even if your dog has free rein on your own property, you should pack that long leash and keep them close to prevent any tangles with wild animals.</p><h2>9. Stay Close</h2><p>In addition to a long leash, keep in mind that your pet should really never be out of your sight while camping (or during travel in general). Your dog may be the life of the party at home but could experience a complete behavior change and become skittish, withdrawn, or even aggressive when exposed to a new environment, so never make assumptions as to how your dog will behave around other people or animals. For their safety, it's best to keep your dog close at all times, including at the campsite as well as in the car and during any outdoor activities.</p><h2>10. Pack the Extra Blankets</h2><p>While it's easy for humans to quickly dry off after a dip in the lake, if your four-legged friend is a swimming enthusiast, you'll want to be sure to have plenty of extra towels and blankets on hand to dry them off (and keep them warm as the temperature drops in the evening hours). Towels and rags can also be used in emergency situations, and they can certainly come in handy in case of an unexpected downpour.</p><p>It's also a good idea to take a dog life jacket, especially if you plan on taking your dog canoeing or kayaking out onto a body of water. Your dog may be good to swim in a pool, but with a large body of water, new experiences in that environment, and the possibility to no nearby shore, they would be safer wearing a flotation device.</p>",1221
1,https://www.thesprucepets.com/the-cost-of-dog-ownership-1117321,Dogs > Getting Started,<p>The Ultimate Guide</p><h1>Costs of Owning a Dog</h1>,"<h1>Costs of Owning a Dog</h1><p>How much does it cost to own a dog and care for it properly? You may have heard that dogs are expensive. While it's true that there is an investment involved with dog care, it's best to understand the details of dog care expenses. The are one-time expenses, monthly expenses, and annual expenses to consider. With something like the cost of dog care, it's all relative.</p><p>The cost of owning a dog is about more than just the expense of food. Unfortunately, many people do not take the time to budget for a dog before getting one, leading to trouble down the road. Can you afford a dog? Learn your limits before you get a dog to help you make the right decisions. Financially providing for your dogs is a big part of being a responsible dog owner.</p><p>The cost of owning a dog can be estimated at about $1,500 to $9,900 per year. There are ways to save money depending on the choices you make. Contributing factors include your dog's size and age, the region in which you live, your own lifestyle, and your dog's individual needs.</p><h2> Basic Costs of Owning a Dog </h2><h2> Initial Investment </h2><p>Consider costs when choosing a dog. Any new dog or puppy will come with substantial expenses. If you decide to purchase a purebred dog from a breeder, you can expect to spend $500-2000, give or take. Spend the extra money on a quality dog from a reputable and professional breeder, not a ""backyard breeder."" It will cost you less in the long run because the dog will be healthier (and it's the right thing to do).</p><p>If you like mixed-breed dogs and you want to do your part to help dogs in need, then get your dog from a reputable shelter or rescue group. If you still want a purebred, there are plenty of breed-specific rescue groups. Adopting from a shelter or rescue can cost as little as $50 to $200. You are most likely to get a healthy dog when adopting from a reputable shelter or rescue group. Be aware that dogs with unknown histories might come with illnesses, so you may spend a bit extra on veterinary care.</p><p>Regardless of where you get your new dog, the very first thing you should do is get that dog to a good veterinarian. Depending on the need for vaccines, preventive medications, and special treatments, that first visit will likely cost you anywhere from $50 to $300, so be prepared. Vet bills for a young puppy will likely range from $100 to $300 depending on the puppy's health and the region in which you live. Puppies need to visit the vet every few weeks until about 16 weeks of age, and each visit can run you $100 to $300 depending on your pup's needs.</p><p>Your next major expense will be dog supplies. These include dog food, leashes, collars, beds, toys and so on. You also need to think about obedience classes and/or training resources. When the time comes to have your puppy spayed or neutered, expect to spend anywhere from $150 to $700. Bottom line, the first year with your new dog can cost twice the typical annual cost of subsequent years, so be prepared.</p><h2> Food and Treats </h2><p>It is important to feed your dog a high-quality dog food and healthy dog treats. This typically costs somewhere from $20 to $60 per month ($250 to $700 per year). Food expenses vary based on the size and energy level of your dog as well as the quality of the food. Be aware that special foods, like veterinary therapeutic diets or freshly-made special-order food, may cost $100 or more a month. </p><h2> Toys </h2><p>Dog toys are an important part of your dog's mental stimulation and exercise. Though some of us may indulge, you can probably plan on spending $25 to $150 per year. If you are like those of us who cannot resist a cute toy, this figure can become several hundred dollars higher. Another reason you may spend more on toys: a very destructive dog may go through toys faster, so if you have one of these dogs, invest in the toys designed for ""tough chewers"".</p><h2> Beds </h2><p>Every dog deserves a cozy bed and keeping one or two around the house will cost you $50 to $200 a year. Prices go up in relation to size and quality. Getting durable, high-quality and easy-to-clean dog beds can extend the life of the beds and keep costs down in the long run.</p><h2> Leashes and Collars </h2><p>Your dog must have one leash and one collar (with ID tags). Depending on the size and quality, most dog owners spend $20 to $50 per year on leashes and collars. However, you may be able to make one leash and collar set last for several years.</p><h2> Grooming </h2><p>Your dog's grooming needs are largely based on the type of hair coat he has. Smooth coated, short-haired dogs require little more than basic grooming while dogs with constantly growing hair will need to visit the groomer on a routine basis. Between the cost of grooming tools and visits to the groomer, you can plan on spending anywhere from $30 to $500 a year.</p><h2> Routine Veterinary Care </h2><p>Routine veterinary care is a huge part of keeping your dog healthy. Plan on going to the vet for wellness checkups once or twice a year at a cost of about $200 to $300 yearly. Annual lab work can add about $100 to $300 and should not be skipped as it's an important part of preventive health care. Dental cleanings may be recommended as often as once a year and generally range from about $300 to $800 if straightforward cleanings. If your dog has painful diseased teeth, their teeth will need high level treatment and extraction which can be about $800-$3000 or more depending on extent of dental disease and bone loss in your pets mouth. Of course, vet costs will be higher if your dog develops a health problem. This is more likely to happen as your dog grows older.</p><h2> Preventive Medications and Supplements </h2><p>All dogs need medications to prevent heartworms, fleas, ticks, and other parasites. Your veterinarian will guide you towards the best products based on your climate and your dog's needs. Vitamins are not normally needed for dogs on completely balanced diets however sometimes your vet may recommend a supplement like glucosamine or omega 3s. In general, you will probably spend $100 to $500 per year for these items depending on the size of your dog and his specific needs.</p><h2> Obedience Classes or Training Resources </h2><p>Though most dogs will only go to obedience school in their first year or two, training is something that should be ongoing throughout your dog's life. Whether you are buying books and watching videos for at-home training or you enroll your dog in obedience classes, budget at least $25 to $300 per year for training needs.</p><h2> Dog Walking </h2><p>Depending on your lifestyle, you may need to factor in the expense of a dog walker. If you or someone else can stay home and consistently walk your dog, you'll spend $0 or close to it throughout the year. If you aren't home during the day, work irregular hours, or have a dog that requires frequent outdoor trips that you can't always be there for, you'll need a dog walker, the costs of which can average $20 per walk. For one $20 walk once a day for every weekday of the month, you can expect to pay about $400 per month or more on dog walking.</p><h2> Pet Sitters or Boarding </h2><p>Most people will need to leave their dogs behind once or twice a year. Typically, this will cost about $100 to $300 a year. However, if you travel frequently, expect to spend much more. Boarding tends to cost less than hiring a pet sitter, but many dog owners prefer the individual attention a pet sitter can offer and think it is worth the extra expense. Alternatively, if you decide to travel with your dog, you can expect your travel fees to increase.</p><h2> Emergencies and Other Unexpected Expenses </h2><p>No one can predict the future; the unexpected occurs in life all the time. As a good dog owner, you should do your best to be ready for life's little surprises. Emergencies, chronic illnesses, disasters, and other unplanned expenses can amount to hundreds or even thousands of dollars per year. The cost of an emergency vet hospital visit can start around $500 to $1000 and go well beyond $2000 to $5000. Advanced surgery is anywhere from $2000 to $5000 or more. If your sick pet needs to stay in the ICU, you could be looking at $200 to $500 per day and up. </p><p>The best way to stay prepared is to set aside extra money in savings, if possible. In addition to savings, some people keep a credit card or line of credit set aside specifically for emergencies. Some veterinary practices offer third-party healthcare financing or health care credit cards, such as CareCredit. You may even qualify for an introductory zero interest plan. </p><p>In a perfect world, dog owners would never have to make choices for their dogs based on money alone, Instead, it should be about what is best for their dogs. With proper planning (and a little luck) you can provide for your own dog and live a long and happy life together.</p>",1556
2,https://www.thesprucepets.com/dog-sitting-101-for-non-dog-owners-4098077,Dogs > Getting Started,<h1>Dog Sitting for Non-Pet Owners</h1>,"<h1>Dog Sitting for Non-Pet Owners</h1><p>Ever have a friend adopt a new puppy? Ever find a reason to hang out at said friend's house every day for the next year? It never fails that every time you visit the home of a cute little puppy, you mention to them that you would love to house sit or take care of their puppy! Who wouldn't want the joy of getting to love, play with, snuggle and wrestle with a new dog and then get to send them home for all the expensive parts like vet care and boarding and daycare? Well, finally your friend has an out of town wedding to attend and you have been chosen the lucky one to keep an eye on the puppy while they are gone! Happy days! But wait, now what do you do to do your best while taking care of someone else's pet? Luckily, we have some tips and tricks.</p><p>The first thing to mention, no matter how much experience you have taking care of dogs, is that each dog is unique and each dog owner has their way of dealing with their puppy. And as caretaker, it is your responsibility to respect that and follow their instructions as closely as possible even if it is not what you would do or how you do things for your dog. When taking care of a dog, it is best to do your best to keep them on the same structure and schedule that they live on at home. It isn't always possible to adhere perfectly to things, but always have the intention of doing your best at following it.</p><p>Let's talk first about if you are taking care of another person's dog and you do not have pets of your own. This situation presents a few challenges for you that need to be figured out before the dog comes over.</p><h2> How Puppy-Proof Is Your House?  </h2><p>When you don't have a dog of your own, it's easy to forget about the requirements a dog has to have a safe living environment.</p><p>As a non-puppy owner, it is your job to manage the environment for the dog you are taking care of so that they cannot get into anything and hurt themselves. </p><h2> Setting up Structure and Schedules </h2><p>it is up to you to work these things out. It's good to spend a minute looking at your life and how these things will fit in. It is always important to remember that dogs don't understand getting stuck in traffic, or having a last-minute date call, or not being able to get home for whatever reason. You are their primary caregiver, and you need to stick to it while they are with you. </p><h2> Where Do They Live? </h2><p>When a dog is staying with you, and you don't have dogs of your own to dictate where they live and what is their area, you need to decide on how much household freedom they have and what areas they are allowed in and where they are not allowed for their safety and protection. </p><p>This is often dictated by age and maturity levels of the dog, as well as what their family does at home, but it is important for you to do what is best for your house as well. In Creative Dog Training's 3 Rules of Housetraining, rule number 3 is ""When they cannot be with you, then they go into confinement."" And confinement for us is defined as the largest space a puppy will keep clean and not mess up. Whether this is a crate, a bathroom, the bedroom, or the whole house it depends on the dog you're taking care of and what they can handle. </p><p>Personally, my 12-year-old golden retrievers still got put in the living room or bedroom with a baby gate when the house was particularly disheveled because the boy one was always happy to go searching and see what he could get into when given a chance. But conversely, Margaret's golden retrievers have gotten free run of the house most of their lives because they don't get into things. It's just all about the dog, and how they respond. </p><h2> Where Will the Bathroom Walks Happen? </h2><p>It is inevitable that at some point the puppy you're taking care of will need to go outside to relieve themselves. If you find an urban location to move to with dogs, it can be hard to find a suitable place to walk them. So it is good to think about this before the puppy gets to your place and needs to be walked. If you have a yard, that's awesome! But, it is also important to make sure the yard itself is puppy proof if you are putting them out there by themselves. If you don't have a yard, you have to scope out the nearest grass area and make sure you have a ready supply of poop pickup bags when you go! </p><p>Finding a good place for the dog to go can depend a lot on the dog, some are used to having a large area to walk around and investigate. Others like their privacy and places to get away from prying eyes, or if they are all business when it's time to do their business and are happy to use a postage stamp sized chunk of grass. Knowing the area around your house is key, and knowing safe places where you can take the dog you are taking care of. </p><h2> How Much Exercise and When Do They Need It? </h2><p>Each dog's activity level is different, and it is important to talk to their puppy parents about what they do for exercise and how often they do it so you can keep it up. This is not only good for the puppy, but it is also good for you and your stuff! A tired puppy is less likely to chew things up and make messes of your things. It is always good to talk to the puppy's owner about if they take them a local dog daycare, so if you are not able to keep up with the level of exercise the puppy needs, then you can take them to daycare so that they can take care of their energy usage needs. </p><p>It is also good to check out our articles on good games to play with your pet, to give you some new ideas for creative ways to help them expend some energy. </p><h2> Emergency Situations </h2><p>Even in the best circumstances, emergencies happen. Happy, healthy puppies can suddenly start showing signs of illness, on a walk a paw pad might get a cut, or jumping off a bed or couch they may start limping afterward. You never know. So as caretaker it is key that you know 2 things in case of emergency: their primary veterinary clinic they go to, and the closest emergency or after hours animal clinic. </p><p>With this information in hand, you are ready in case of anything that comes up. It is also good to talk to the puppy's owner about what they want to be done in the case of emergencies, but at the end of the day, it is your responsibility to do what is best for the dog you are taking care of.</p>",1205
