,url,breadcrumbs,headings,text,word_count
78,https://www.thesprucepets.com/protective-leg-boots-for-horses-1886294,Horses > Horse Stables & Equipment,<h1>Protective Leg Boots for Horses</h1>,"<h1>Protective Leg Boots for Horses</h1><p>You may see a horse on a televised competition wearing leg protection and wonder precisely what it is for, or if your own horse needs this type of protection. Although they are called 'boots,' they don't serve the same purpose as 'hoof boots.' Leg boots help protect the delicate structures of the leg from bumps against obstacles, or the horse's own hooves. They also help support the tendons and ligaments in the legs, as performance horses can be prone to straining these tissues. Horses have no padding from muscle tissue in the lower leg, so boots can help prevent potentially debilitating injuries.</p><p>Unless there is a pre-existing condition that needs protection, most backyard pleasure horses do not need any leg protection. However, some horses, no matter how light their workload is, are prone to over-reaching, forging, or interfering and injuring themselves. Often poor conformation causes them to hit themselves, especially after they get tired  like how a person might trip over their own feet when fatigued. Young horses that are being started may hit themselves because they are unbalanced. And of course, performance horses  hunters, jumping, endurance horses, barrel race, reiners, and many others  may benefit from the support and protection of a leg boot.</p><p>Depending on what your horse's specific problem is, or what sport you're competing in, there are many boots to choose from. Manufacturers don't always use the same name to describe all boots. Some boots combine functions, such as a boot that is both a sports medicine boot and skid boot.</p><p>It's vital that leg protection fits well, is kept clean, and frequently checked in case the boots are chaffing. Built-up sweat, grit, and dust can make boots uncomfortable, so cleaning them regularly is essential. Here are the most commonly used leg protection or leg boots.</p><h2>Bell Boots </h2><p>These boots encircle the pastern, and the bell shape covers the entire hoof. They can be made of rubber, heavy synthetic material or leather lined with fleece. Bell boots are worn in the stall or paddock, or while ridden. In either case, they prevent the horse from hitting itself, especially where the terrain may be rough or muddy, and where a horse is negotiating obstacles like jumps, provide some protection from hitting a hard surface. Bell boots can be worn on the front or back.</p><h2>Fetlock Ring </h2><p>Amazon</p><p>A simple rubber donut, called a fetlock ring, can be used for turnout or riding to prevent the horse from injuring its hind fetlocks. This ring stretches over the hoof and sits on the lower fetlock, although you may need strong hands to do this.</p><h2>Leg Wraps </h2><p>Before there were all kinds of specialized leg boots, leg wraps were used. Polo wraps are the most common type used for riding, and standing bandages are used in the stable.</p><h2>Brush, Brushing, Splint Boots </h2><p>Amazon</p><h2>Shin Boots </h2><p>Shin boots are most commonly used by jumpers to prevent injury to the front of the leg when hitting a jump rail.</p><h2>Ankle and Fetlock Boots </h2><p>Amazon</p><p>Fetlock boots are for protection when a horse hits itself. They cover the pastern joint and fetlock areas of the lower legs. They are not meant to provide support. They are usually made of leather or synthetic materials and lined with sheepskin or other soft material.</p><h2>Open Front Boots </h2><p>Amazon</p><p>Many of the boots come in open front styles; this is because sometimes, the rider may want a horse to feel when it is hitting a jump. Some horses become complacent and scrub over the rails of jumps. The open front boot may encourage the horse to be a little more 'honest' about tucking up its knees and clearing the obstacle, while still providing some protection. They also allow more airflow around the lower leg.</p><h2>Knee Boots </h2><p>It's a bit tricky to keep boots or bandages around a horse's knees, but sometimes knee protection is needed. Barrel racers and reiners are sometimes seen with knee boots. These boots aren't really supportive, but provide extra padding to horses if they may bump their knees against something, such as hitting a barrel in a barrel race.</p><h2>Skid Boots </h2><p>Amazon</p><p>Skid boots protect the hind fetlocks and pasterns, providing support along with protection from contact with the riding surface during fast stops and turns. You'll see these boots most commonly on reiners who do sliding stops and cutting horses. Although, English riders such as jumpers might find they need them. They will be made of leather and fleece or synthetic material that provides cushioning. Closures are most often buckles or hook and loop fastener.</p><h2>Sports Medicine Boots </h2><p>Amazon</p><p>Sports boots provide both protection and support. They cover the lower leg, front or back from the pastern to below the knee. They are not as padded as splint boots but provide more support to the tendons and ligaments. You'll most often see them on endurance horses, jumpers and other horses that must negotiate tough terrain. They can be made from synthetic materials or leather. Some materials are designed to retain heat, which is felt to increase blood flow to the leg. Others are made to be cool.</p>",844
79,https://www.thesprucepets.com/choosing-an-english-girth-for-your-horse-1886288,Horses > Horse Stables & Equipment,<h1>How to Choose the Right English Girth for Your Horse</h1>,"<h1>How to Choose the Right English Girth for Your Horse</h1><p>An English girth comes in many different shapes, materials, and lengths. If you're standing in front of a large display, you can easily be left scratching your head trying to pick the one that is right for you and your horse. Here are some tips to help you make the best choice.</p><p>There are two fundamental styles of English girths to choose from, and these are designed to accommodate the length of the billet straps on your saddle. If you have a dressage saddle, you'll likely have very long billet straps that extend beyond the bottom of the flaps. This is, so the girth buckles don't end up under your leg and interfere with your leg aids. The girth you'll need for this type of saddle is very short.</p><p>If you have a forward seat, all purpose, close contact or almost any other variation of an English saddle, the billet straps are much shorter and likely don't extend beyond the bottom of the flaps. For these types of saddles, you'll probably need a much longer girth. This will allow the girth to reach the short billet straps on these types of saddles.</p><p>Both types of girths will have rings or D-rings positioned on them, and whether you need these or not will depend on the other tack you put on your horsesuch as martingales or over-girths.</p><p>Whether you need a dressage or regular length girth for your saddle, you'll find they come in a variety of materials as well. Deciding on the material your girth is made from is a matter of preference. Functional quality leather girths are the most expensive, and with proper care can last a very long time. You'll also find girths made of cotton or synthetic string, neoprene, webbing and felt, and other high tech materials. These have their pros and cons.</p><p>English girths may also have strong elastic that attaches the buckles to the girth on oneor both ends. This elastic tends to wear out over time (it is replaceable on good quality girths), but can be more comfortable for the horse.</p><p>Unfortunately, there's no way to find out if you have the right girth for your horse until you try it out. You might find synthetic girths cause galls.Some may hold heat or irritate some horse's skin, but most are comfortable and easy to clean.Or you might find leather girths not quite right, and a string girth works the best. Or, you might discover quite the opposite. It takes a bit of trial and error to find the right one.</p><h2>Synthetic Girths </h2><p>Synthetic girths can come in materials that are constructed similarly to leather girths but tend to be less expensive and easily cared for. They may not last as long as a good quality leather girth, but if you need several different girths to accommodate different horses, a selection of synthetic girths in your tack room may be the way to go. You may also find synthetic girths lined with synthetic fleece, gel, or with sheepskin.</p><h2>Atherstone Girths </h2><p>Also called 'chaffless,' these girths are shaped so that the width behind the horse's elbow is narrower. The Balding is one piece of leather that has been cut into three strands, with the two outer strands crisscrossed almost like a braid. The Atherstone is a leather girth that is shaped similarly, but is all one piece, or may have a single strap to which a thicker, shaped and padded length of leather is sewn. Shaped girths may have elastic ends.</p><h2>Leather Girths </h2><p>Arnuchulo/Pixabay</p><p>Leather girths are often one width of leather folded over three times so that the cut edge of the leather isn't against the horse's skin. The exposed cut edge is the outside of the girth. There may be an elastic or webbing insert inside the girth, or the girth may be entirely of heavy leather. Shown is a leather dressage girth.</p><h2>Jumping Girths </h2><p>Jumping girths have large oval panels in the center that prevent the horse from hitting its belly with its forefeet when jumping. They are also called belly guard girths. There are trail riders who use these girths because they feel it distributes the pressure over a wider area than a regular girth. Some consider them overkill and think that they might hold heat as well. They're also the priciest girths, simply because of the materials and construction.</p><h2>String Girths </h2><p>String girths are made of lengths of multiple strings and maybe cotton, mohair, wool or nylon. They are cool because they dry quickly and allow air flow. While they maybe comfortable for some horses, others may be pinched and chaffed by the stringsleaving painful girth galls. However, these girths don't slip as easily as other types of girths, and for some horses, they may be just the thing. All can be washed easily, although only synthetic string girths can be washed in a washing machine. Just don't bleach a nylon girthit will be permanently yellowed. Nylon string girths tend to get quite 'brittle' feeling with use. The girth pictured here is a brown mohair girth.</p>",842
80,https://www.thesprucepets.com/choose-the-right-floor-for-your-horse-stable-1886938,Horses > Horse Stables & Equipment,<h1>Choose the Right Floor for Your Horse Stable</h1>,"<h1>Choose the Right Floor for Your Horse Stable</h1><p>When building or renovating a barn for horses, what they will be standing on is a veryimportant consideration. Horses that are kept inside need to stand still on whatever is on their stall floor for long periods of time, which can be hard on their legs. For this reason, from a leg health perspective, flooring needs to be chosen carefully.</p><p>Maintenance is another factor. The upkeep of some types of flooring is easier than others. You may wish to have one type of flooring for aisles, and another in thestalls. The type of floor you will choose for a new barn will depend on the existing natural soil, what materials are available to you, and your budget. Here's a look at the types of flooring found in the horse's stables.</p><h2>Soil, Sand, or Clay </h2><p>0</p><p>Leaving the existing soil in place is inexpensive and a healthy option for your horse, but your floors may require daily upkeep to keep them level and the soil may have to be replaced in time.</p><p>Clay-based soils will also need a lot of maintenance inhorse stalls. Damp clay can be slippery or sticky and horses can dig holes and hollows depending on where they most often stand, paw, or walk around. It's possible to install clay floors, and it's recommended that these be laid over a thick layer of crushed gravel and kept clean and dry.</p><p>Sand is frequently used for stall floors. It is easy on the horse's legs, non-slip, and requires minimal bedding material over top. It drains well and is replaceable once it becomes very soiled. Sand-bedded stalls may need ""topping up"" as sand is taken away each time the stall is mucked out. Sand colic is a concern if horses eat off of the floor. Sand floors also become uneven easily if the horse paces or paws in its stall. It may also be drying to hooves.</p><h2>Wood </h2><p>Wood was once the standard flooring material in horse stables. Wood floors are easier on a horse's legs than many other choices. It's warm, non-slip when dry, and has relatively low upkeep. Treated wood is required to prevent rot from urine and water spills, and to dissuade rodents and bugs from chewing through it. The wood planks should be at least two inches thick and sit atop a base of sand or gravel for drainage.</p><p>Any spaces between planks need to be filled with sand so that feed and bedding don't spill through. The downside of wood floors is that they can be slippery when wet, they can hold odor, can be damaged by pawing horses, and can be hard to disinfect. The cost of plank flooring is one factor that makes this a less popular option than it once was.</p><h2>Concrete </h2><p>Concrete flooring is very common in stables. It is very durable and easy to clean and is hard to damage. It can be slippery, so while very smooth finished concrete may be attractive and easy to sweep in feed and tack rooms, textured concrete is better for stalls and aisles.</p><p>If horses are kept in for long periods of time, it will be healthier for their legs if rubber stall mats are laid over the concrete, or at very least, the stall is bedded deeply. It also tends to be cold and damp, so some horses may be reluctant to lie down in their stalls.</p><h2>Crushed Limestone </h2><p>Sometimes called limestone dust, this material, if installed properly, can be a comfortable, safe stall flooring. It must be well packed and level when it is put in. The benefit of crushed limestone is that it provides good drainage if properly installed with several inches over a bed of sand. It's also a non-slip surface. However, limestone can pack to an almost concrete-like hardness, which means stall mats and/or deep bedding will be needed to provide comfortable footing for your horse.</p><h2>Interlocking Brick </h2><p>Interlocking brick or pavers are attractive but present the same problems as concrete floors. Because of the grooves between the pavers, they can be a bit harder to clean. Rubber and synthetic bricks are other options, and these are easy on a horse's legs, provide good drainage, and are non-slip. This is probably the most expensive option for stall and aisle flooring.</p><h2>Grid Floors </h2><p>Several types of grid floors are available for stalls. These honeycomb-patterned grids are laid over a few inches of sand or crushed gravel and then filled with crushed gravel or stone dust to make a floor that drains well.</p><h2>Asphalt </h2><p>Asphalt is a bit easier on a horse's legs than concrete and can be made so it drains relatively well. When first laid, asphalt is non-slip but may become slicker over time. It needs to be laid thick enough that it does not crack. It's easy to clean, although disinfecting the porous surface may be difficult. Asphalt may be one of the less-expensive options for stall floors and aisles.</p>",824
81,https://www.thesprucepets.com/how-to-clean-a-horse-stall-1886001,Horses > Horse Stables & Equipment,<h1>How to Clean a Horse Stall</h1>,"<h1>How to Clean a Horse Stall</h1><p>If your horse lives in a stall for any part of his day, you'll have to keep it clean. This is more than just keeping things pleasant for you and your horse. Unclean stalls attract insects and can encourage hoof problems such as thrush. Breathing ammonia from urine-saturated bedding can be harmful to your horse's or pony's sensitive lungs. And a dirty stall is unpleasant to work in and smelly for you, too.</p><p>Stall cleaning should be a daily task. It usually takes no more than 20 minutes to give a stalla quick cleaning, but will take longer if you have neglected the duty for more than one day.</p><h2>Tools and Materials You Will Need: </h2><h2>How to Clean a Horse Stall </h2><p>Follow this process to effectively clean your horse's stall. Once you're in the routine, it can be done easily in 15 to 20 minutes as part of your daily routine.</p><h3>Dress for the Job </h3><p>Dress in appropriate clothing for this admittedly messy job. Gloves can prevent blisters. Urine can erode the stitching on the soles of leather riding boots, so save yourself boot-cleaning time by changing into work boots or rubber boots.</p><h3>Prepare the Stall </h3><p>Take your horse out of the stall during cleaning. A good time to muck out is when your horse is in the pasture grazing or exercising. If you can't put him out, put your horse in an empty stall. Next, remove all the feed tubs, water buckets, and toys from thestall before beginning your cleaning routine.</p><p>Assemble your cleaning tools and park your wheelbarrow or cart close to the stall door, facing in the direction you will wheel it toward the manure pile. It's easier to maneuver an empty wheelbarrow than a full one.</p><h3>Dig in With Fork and Shovel </h3><p>If the stall is bedded with straw, use a pitchfork to remove manure and wet or soiled bedding. If shavings or sawdust have been used, use the shavings fork to remove manure and wet bedding. Fork the manure and soiled bedding into the wheelbarrow or cart. Sometimes it's easier to pick up wet bedding with a shovel.</p><p>As you fill the wheelbarrow, wheel it out and dump out the contents in the assigned area (the manure pile). It's tempting to fill the wheelbarrow really high, but this can make it hard to push and easy to tip. It's frustrating having to clean up manure a second time because you've tipped over the wheelbarrow, so making two or three light trips is the better strategy.</p><p>As you continue cleaning out the dirty bedding, scrape the unsoiled bedding to one side and check to make sure there is no wet or manure-soiled bedding hiding underneath.</p><h3>Occasional Deep Cleaning </h3><p>You may want to completely strip a stall occasionally. In this case, keep filling your wheelbarrow until the stall floor is completely bare. Use the shovel to scrape up remnants of bedding and the broom to sweep it clean. You may want to put down odor-control solution or stable disinfectant. Let the floor dry before re-bedding.</p><h3>Spread Out Clean Bedding </h3><p>Once you've removed all the manure and soiled, wet bedding, spread whatever clean bedding that remains back over the stall floor. Check around the edges of the stall, as clean bedding sometimes gets tossed against the walls as the horse moves around. This leaves a thinner area in the middle, or wherever the horse usually stands. Distribute the bedding evenly.</p><p>Add fresh new bedding to replace any you have removed. If using straw, either add a whole bale of straw or portions of one. Fluff the bedding with a pitchfork. If your stable uses shavings or sawdust, use a wheelbarrow to transport fresh shavings to the stall, or open a bag and fluff the compacted shavings with the shavings fork. Some stables have truckloads of loose shavings piled, or you can buy bags of compacted shavings.</p><p>The thickness of your bedding will depend on what type ofstall flooring is under the bedding and what season it is. If there is thick rubber matting on the stall floors, bedding can be thinner. On bare concrete, add more bedding to provide padding and urine absorption; this is especially important during cold weather. Sand floors are easier on your horse's legs but may get saturated with urine quickly if you don't put enough bedding down.</p><h3>Clean the Alleys and Doorways </h3><p>After you've finished cleaning and bedding the stall, use a broom to sweep up any spilled manure, straw, or shavings in the alleys and doorways to the stable. Scoop up the sweepings into the shovel and toss them into the manure pile. Left unattended, manure, chaff, and bedding in doorways will turn into a muddy mess in wet weather.</p><h3>Finishing Up </h3><p>Put all the tools away where they won't cause a tripping hazard. Return the feed tubs, buckets, and toys so the stall will be ready for your horse.</p>",811
82,https://www.thesprucepets.com/choosing-an-english-saddle-pad-1887240,Horses > Horse Stables & Equipment,<h1>Choosing an English Saddle Pad or Numnah</h1>,"<h1>Choosing an English Saddle Pad or Numnah</h1><h2>Types of English Saddle Pad</h2><p>English saddle pads come in many different materials, shapes, and design. Some are traditional white, while others come in wild colors and patterns. Here's how to choose the right pad for you and your horse.</p><p>There are a few basic shapes of pads to choose from. A full pad is almost square. A shaped pad is roughly the same shape as the saddle. A half pad fits only under the upper part of the saddle, where the saddle contacts the horse's back. There are also pads that help solve minor saddle fit problems. Saddle pads are not intended to correct major saddle fit problems.</p><p>Traditionally, English saddles were used without a pad or 'numnah '. Early saddle pads or blankets were only used to keep the saddle clean, protecting it from sweat and dirt. Now saddle pads are designed to reduce shock, prevent heat build-up, and in the show ring, are an important part of correct turn-out.</p><h2>Another Name for a Saddle Pad is ""Numnah"" </h2><p>The word numnah isn't commonly used in North America, although it is a word somePony Clubmembers may see on their tests. A numnah is a pad of sheepskin or wool that goes under the saddle to keep thesaddle cleanand to cushion the horse's or pony's back. In NorthAmerica,we call a numnah a saddle pad or blanket. The word numnah is more familiar to horse riders in the U.K. is a word likegymkhanathat was brought back to the U.K. from India.</p><h2>Full, Square or Dressage Pads</h2><p>Full pads come in a variety of designs. They can be a simple square of quilted fabric or may have rounded or 'swallow tailed' corners for a tailored look. Better quality pads may be thickly quilted or may have a gel or foam center. Full pads are made of a wide variety of materials, from quilted faux suede or cotton to neoprene and other synthetics. Full pads may be contoured to accommodate horses with dropped backs or high withers.</p><p>Most will have leather or synthetic loops to put the girth straps through to prevent slipping. Some may have neoprene or other 'sticky' textile that helps hold the pad in place. Sometimes called dressage pads, white is the correct color to use in dressage shows. Schooling pads come in many fun colors and patterns. The space behind the rider's leg can be embroidered with a logo.</p><p>Because full pads cover a bit more of the horse than other pads, they're not a great choice where the prime consideration is coolness. If you're planning on showing dressage, you'll definitely need a schooling pad in addition to the one you take to shows, because a white pad becomes soiled very quickly.</p><h2>Shaped Pad</h2><p>Shaped pads are perhaps the most traditional English saddle pads. The shape of the pad roughly follows the shape of the saddle. Like full pads, they can be made of a wide variety of materials. When you're shopping for a pad, you'll need to keep the type of saddle you have in mind.</p><p>For example, a shaped pad made for an all-purpose saddle will not fit well under a dressage saddle. In just about every English riding discipline, except dressage, it is acceptable to use a shaped pad. For a show, you'll probably need white, or a color that matches your clothing. This will depend upon the show rules. You'll want about one to two inches to show around the outside of your saddle.</p><p>Shaped pads are prone to slipping and bunching, and most will come with loops to attach to either the D-ring on the front of the saddle or to the billet straps. Neoprene or other high-tack material can help prevent slipping. Sometimes, it's almost impossible to prevent a pad from slipping and if that's the case, you'll need to try another pad or consider there may be more serious saddle fit problems.</p><h2>Half Pads</h2><p>Half pads have become popular over the last few years. These pads only cover a small portion of the horse's back under the saddle tree. They can be made of either synthetic or natural fleece, which is visible at the front and back, or they may be made of a quilted or thick synthetic material, with rolls of fleece at the front or back. They may have gel or foam centers for shock absorbency. Half pads can be used alone, or put on top of a thin shaped pad. Half pads are most often seen in the hunter-jumper show ring. Half pads can be prone to slipping. Some may be too thick and bouncy.</p><h2>Riser Pads </h2><p>Riser pads are usually made of synthetic foam-like material and are intended to balance the saddle, reduce shock and even out the pressure. There are front risers and risers that lift the back of the saddle.</p><p>While riser pads and other pads that reduce pressure on the horse's back can help solve minor saddle fitting problems, they cannot make up for a saddle that does not fit the horse.</p>",827
