,url,breadcrumbs,headings,text,word_count
24,https://www.thesprucepets.com/equine-protozoal-myeloencephalitis-1886437,Horses > Horse Health & Wellness > Horse Diseases & Conditions,<h1>Equine Protozoal Myeloencephalitis (EPM) in Horses</h1>,"<h1>Equine Protozoal Myeloencephalitis (EPM) in Horses</h1><h2>Causes, Treatment, and Prevention</h2><p>Equine protozoal myeloencephalitis (EPM) is a devastating neurological disease that can leave horsesseverely disabled and may result in death. It is caused by infection of the horse's central nervous system with a protozoan, which is a single-celled organism. The most common protozoan to cause EPM is Less commonly, it can be caused by infection with</p><p>Because EPM can affect any part of the horse's central nervous system, which includes the brain and the spinal cord, symptoms can vary, but common signs of this disorder include gait abnormalities, involuntary muscle movements, lethargy, muscle atrophy, and difficulty swallowing.</p><p>Any horse of any age can develop EPM, but it is more common in young horses that race or participate in other athletic activities.</p><h2>What Is Equine Protozoal Myeloencephalitis? </h2><p>Equine protozoal myeloencephalitis (EPM) is a neurological disease that affects the central nervous system of horses. The term ""myeloencephalitis"" means inflammation of the spinal cord and brain. The disease is caused by a protozoan, usually . This protozoan's primary host is the opossum. The feces of an infected opossum can contain sporocysts, which are the immature, egg-like form of the protozoan. If a horse ingests grass, water, or other substances containing the sporocysts, the horse may develop EPM.</p><p>For reasons that are not well understood, however, only a very tiny percentage of horses exposed to sporocysts from actually develop EPM. In fact, although as many as 90 percent of the horses in some areas of North America test positive for exposure to the sporocysts, less than 1 percent actually develop the disease.<br/></p><h2>Symptoms of EPM in Horses </h2><p>One of the difficulties with diagnosing EPM is that it can look like many other neurological diseases, particularly in the beginning. It is a progressive disease, meaning it tends to worsen over time. However, some horses progress through the illness faster than others, and it is not uncommon for a horse to develop worsening symptoms, then level off for awhile, sometimes even for months, before once again beginning to deteriorate.</p><p>Symptoms can vary depending on whether the horse's brain or spinal cord is more heavily affected. But the following are common symptoms to watch for.<br/></p><h3>Symptoms</h3><p>The symptoms of EPM can begin quite suddenly or slowly progress over time. As a general rule, the symptoms are asymmetrical, meaning they affect one side of the horse's body more than the other. So you might notice that your horse moves the legs on its left side in an uncoordinated fashion, but still moves them normally on the right. Commonly, the horse will seem to have poor balance and may stumble or move in an abnormal way. Its muscles might atrophy, leading to weakness and further inability to walk normally.</p><p>If the horse's spinal cord is most affected, which is the commonest presentation of EPM, you'll notice more difficulties with movement, balance, and coordination. If the horse's brain is more affected, symptoms can include paralysis in the facial muscles, making it difficult for the horse to swallow or move its tongue, as well as lethargy, behavioral changes, and drooping eyelid.</p><h2>Causes of Equine Protozoal Myeloencephalitis </h2><p>Some protozoa, including are capable of causing disease in animals. Typically, these types of protozoa require a host animal in which to carry out the reproductive part of their lifecycle. For , that host is the opossum. An opossum ingests the protozoans, which reproduce in the animal's digestive system. The opossum doesn't become ill itself, but does, however, pass infectious sporocysts, or eggs, in its feces.</p><p>When a horse ingests the sporocysts from the grass, water, or ground, they enter its digestive system. For reasons that are not well understood, in a very small percentage of horses the sporocysts mature into a form called merozoites, which then migrate through the horse's bloodstream into its central nervous system. There, they infect the brain and/or spinal cord, causing the disease called equine protozoal myeloencephalitis.</p><p>It is important to note that EPM is not contagious from horse to horse, nor is the horse contagious to other animals.<br/></p><h2>Diagnosing EPM in Horses </h2><p>Diagnosing EPM can be tricky, as it can come on slowly and resemble other neurological diseases initially, such as viral encephalitis, West Nile disease, meningitis, or even rabies. A definitive diagnosis can only be obtained by examining the brain tissue of an infected horse after its death. However, equine veterinarians diagnose their EPM patients indirectly by observing the characteristic signs and symptoms, ruling out other causes of similar symptoms, such as trauma or other infectious diseases, and performing blood tests or tests on the horse's spinal fluid to look for antibodies to , which indicate that the horse has been exposed to the organism.</p><h2>Treatment </h2><p>Once the diagnosis has been confirmed, the most effective course of treatment can begin. There are currently three different FDA-approved treatments for EPM.</p><p>Along with one of the above treatments, many equine vets also prescribe anti-inflammatories such as steroids, vitamin E supplementation, or immune-system-modifying drugs.<br/></p><h2>Prognosis for Horses With EPM </h2><p>With treatment, up to 60 percent of horses with EPM will improve, but less than 25 percent recover completely. Relapses are also common for as long as two years after the initial treatment with anti-protozoal medications. Still, your horse has a good chance of regaining at least some of its former health with prompt intervention. If left untreated, the prognosis for horses with EPM is very poor, as the condition can deteriorate to seizures and death.</p><h2>How to Prevent Equine Protozoal Myeloencephalitis </h2><p>There is no vaccine for EPM. Prevention consists of minimizing the presence of opossums on your property as much as possible. Wire-mesh fencing can help keep these marsupials out of your stable area, although because opossums are good climbers, you may have to resort to electrified fencing if they are especially persistent.</p><p>Opossums are generally looking for food and are not picky eaters. They will raid trashcans, eat dog food that's left outside, consume your horse's grains, and even eat carcasses of dead animals that they find on the road or within your property. It's essential that all food stores be secure and any animal carcasses buried promptly. Clean up any spilled feed right away, and make sure trashcans have tightly fitted lids.</p><p>If opossums make their home on your property, they should be humanely trapped and removed. Other options are motion-activated lights or sprinklers, which can frighten the animals away.<br/></p>",1061
25,https://www.thesprucepets.com/equine-arthritis-1886858,Horses > Horse Health & Wellness > Horse Diseases & Conditions,<h1>Arthritis in Horses</h1>,"<h1>Arthritis in Horses</h1><h2>Causes, Treatment, and Prevention</h2><p>Arthritis is a degenerative joint disease that causes symptoms like stiffness, inflammation, and pain. Just like humans, horses can develop and suffer from arthritis. Arthritis is almost unavoidable as horses age, but early diagnosis and conscientious care can slow its advance and minimize pain. A vet can run many tests and a thorough body examination to determine whether or not your horse has arthritis.</p><h2>What Is Arthritis? </h2><p>Osteoarthritis is a degenerative joint disease (DJD) involving the breakdown and loss of the cushioning cartilage that lines the end of bones within a joint.With this breakdown, there is also a loss of lubricating joint fluid, and the joint as a whole loses its ability to cushion impact and provide a gliding surface during motion. This then results in joint pain and leads to lameness in horses. Arthritis in specific locations in horses goes by common colloquial names such as ringbone and bone spavin.</p><h2>Symptoms of Arthritis in Horses </h2><p>The symptoms of arthritis in horses are painful and largely inhibiting motion. If your horse is experiencing any discomfort or you suspect that your horse has arthritis, pay a visit to the vet right away.</p><h3>Symptoms</h3><p><br/></p><p>In its early stages, arthritis may appear as a slight stiffness that the horse overcomes once they are warmed up. In the joint, the cartilage material is breaking down but not repairing itself efficiently. Eventually, as the cartilage becomes more damaged, the bone beneath the cartilage pad becomes damaged too. The horse will experience more discomfort and even heat in the joint as inflammation occurs. As the disease progresses, the horse may experience more pain and lameness. In more advanced cases, small bony growths called osteophytes may be seen under X-ray and may be felt around the affected joint.</p><h2>Causes of Arthritis </h2><p>Arthritis is caused by the wear and tear of cartilagethe tough, flexible tissue that is the sliding, shock-absorbing surface between the bones that meet at a joint. Over time, compression and stress wear away the protective cartilage. Arthritis most commonly occurs in the weight-bearing joints of the legs. Extra stress or injury to any joint can lead to arthritis.</p><p>Specific sports can make a horse more susceptible to arthritis in certain joints due to repetitive concussive force. Certain types of conformation in a horse can also make it more prone to the development of arthritis. However, as all horses age, as with humans and other animals, repetitive wear and tear cause damage of varying degrees to high motion and weight-bearing joints.</p><p>Equine arthritis can affect any mobile joint in the body, including the knees, shoulder joints, spine, fetlocks, hocks, andstifles. These are all weight-bearing joints. The fetlocks, knees, coffin bone (within the hoof), and hocks are most commonly affected.</p><h2>Diagnosing Horses With Arthritis </h2><p>To diagnose your horse with arthritis, you will need to visit a veterinarian. The vet will perform a full body examination, review medical history, andconduct a series of X-rays. Your vet might also request a sample of joint fluid to check for infection. Other diagnostic procedures may include MRIs, a nuclear bone scan, nerve block examinations, endoscopy, and blood and urine tests.</p><h2>Treatment </h2><p>The goal of arthritis management is to reduce the inflammation in the affected joint, relieve pain, and slow further damage to the joint.</p><p>If you notice that your horse is having any discomfort (even discomfort that wears off quickly), it's a good idea to consult your vet. Your vet may be able to identify arthritis early and slow its progress with drugs that reduce inflammation.</p><p>Once the cartilage in a joint is damaged or gone, it is difficult to repair it. Discomfort can be managed by joint injections of joint fluid supplements like hyaluronic acid and polysulfated glycosaminoglycans and corticosteroids. You can also use oral non-steroidal anti-inflammatory (NSAID) drugs such as phenylbutazone for pain management. However, long-term use can have negative side effects such as gastric ulcers and the potential for kidney damage.</p><p>For longer-term treatment, medications include firocoxib (an NSAID that works differently than phenylbutazone) and diclofenac sodium, available in a topical cream. Some clinicians are exploring various stem cell therapies. In some cases, depending on the horse and what joints are involved, this modality may also be an option. Shockwave and laser therapies may also be considered.</p><p>In addition to veterinary treatment, a reduction in workload may be necessary, mainly if the work includes jumping, traveling over rough terrain, or other activity that potentially over-stresses the joints. Although light exercise is essential to maintain joint flexibility, this may mean the end of a horse's competitive career. When the horse may be lame, it should not be ridden. Keep the horse on soft footing, with extra but not excessive bedding that may be hard to walk through. Proper trims and shoeing by a knowledgeable farrier may also be helpful.</p><h2>Prognosis for Horses With Arthritis </h2><p>When diagnosed early and managed adequately, you can completely resolve arthritis in horses. Chronic arthritis may persist if the horse doesn't respond to anti-inflammatory treatments or if infection occurs during the healing process.</p><h2>How to Prevent Arthritis in Horses </h2><p>Arthritis, to some degree, is almost unavoidable in older horses. Horses with conformation faults may put extra stress on joints, yet another reason why breeders strive for foals with good conformation. Proper hoof trims and shoeing, good conformation, sturdy footing, andgood basic maintenancecan also help delay the onset of arthritis.</p><p>Arthritis in horses can affect any mobile, weight-bearing joint in the body. These joints include the knees, shoulder joints, spine, fetlocks, hocks, andstifles.</p><p>If you notice that your horse is having any discomfort at all, you should consult your vet. Your vet may be able to identify arthritis early, making the treatment process run more smoothly.</p><p>In addition to treatment by a veterinarian, you may need to reduce your horse's physical workload or sport activity. This is especially true if the work includes jumping, or traveling over rough terrain. Light exercise can be beneficial to maintain joint flexibility, but it may be the end of your horse's competitive career.</p>",1013
26,https://www.thesprucepets.com/horses-and-sunburn-or-photosensitivity-1887272,Horses > Horse Health & Wellness > Horse Diseases & Conditions,<h1>Sunburn or Photosensitivity in Horses</h1>,"<h1>Sunburn or Photosensitivity in Horses</h1><h2>Causes, Treatment, and Prevention</h2><p>Especially in the summer season, humans and animals alike can experience sunburn. Despite our best efforts to apply plenty of sunscreen and stay in the shade, this condition affects many of us from time to time. Horses are no different, but when it comes to the equine world, sunburn is usually most severe on the nose. Your horse may also experience burns on its back, face, ear tips, and white areas on the legs. Horses with white coats (whether entirely white or in patches on the body) are more susceptible to burns. Some may experience a condition with similar symptoms called photosensitivity caused by the ingestion of certain plants. Sunburn usually resolves on its own, but a variety of treatment options can help ease your horse's symptoms.</p><h2>What Is Sunburn? </h2><p>Sunburn occurs because of overexposure to ultraviolet (UV) light, which typically causes symptoms like redness, inflammation, and pain. Horses with unpigmented patches on their bodies are more likely to experience sunburn than those with darker coats, noses, and legs. Lesions from burns typically affect parts of the body that come into consistent contact with direct sunlight like the nose and face.</p><h2>Symptoms of Sunburn in Horses </h2><p>Horses experience similar symptoms of sunburn to those seen in humans.</p><h3>Symptoms</h3><p>Red skin and inflammation are both common signs of sunburn, although horses may also experience blisters, peeling, scabs, and cracked skin in more severe cases. This is usually limited to the face and nose, but horses that are thin-coated or have pink skin may also become sunburned on their backs. Most commonly, horses with white or pink noses (like grays or pintos) experience sunburn. In some cases, burns can also occur along the protruding areas of the face, ear tips, and white leg markings just as human noses, ears, shoulders, and collarbones get burned from direct exposure to the sun.</p><h2>Causes of Sunburn </h2><p>While exposure to the sun during the hottest parts of the day may be enough to cause a sunburn on your horse, photosensitization can also lead to burns when your horse ingests certain plants.</p><h2>Diagnosing Sunburn in Horses </h2><p>If your horse experiences a normal sunburn that is not linked to photosensitization, your veterinarian can diagnose the condition during a standard physical exam. However, the signs of photosensitization are similar to those of standard sunburns, and a veterinarian should be consulted to determine the underlying cause of your horse's symptoms. Photosensitization may indicate the presence of liver diseases that require further diagnosis. Your equine veterinarian may perform liver biopsies and an evaluation of the liver enzymes along with screening your horse's blood, feces, and urine.</p><h2>Treatment </h2><p>When it comes to sunburn, treatment options are somewhat limited but typically involve management of symptoms until your horse comfortably recovers. If sunburn affects the back, riders should avoid riding until the burn heals to avoid putting a saddle on top of a painful burn. Any areas of your horse's skin that become cracked or scabbed should be removed safely to prevent infection. Equine owners can apply topical antibiotic creams like Flamazine to soothe uncomfortable areas on their horses before treating minor wounds.<br/></p><p>If your horse is experiencing photosensitization, it should be stabled during the day and only allowed out at night until severe symptoms have resolved. Because this condition can cause skin tissue to die off, your veterinarian may recommend corticosteroid injections along with preventing flies from affecting your horse.</p><h2>Prognosis for Horses With Sunburn </h2><p>In most cases of sunburn, your horse can recover without much intervention. Limiting its exposure to the sun is key, as an already burned horse can experience more severe burns if allowed in direct sunlight before healing completely. The prognosis for horses with liver disease leading to photosensitivity will depend upon their specific condition, which a veterinarian can determine. Extreme cases of photosensitization can be fatal when a horse undergoes excessive loss of healthy skin tissuesso owners should utilize all available treatment methods to allow for a safe recovery. Thankfully, most horses with photosensitivity issues can return to a healthy state after treatment.</p><h2>How to Prevent Sunburn </h2><h3>Avoid Peak Daylight </h3><p><br/>Preventing sunburn most often means keeping them out of the sun when it's at its strongest. It's important to provide a shady place such as a line of trees or run-in shelter. Some people choose to . This is a strategy used to prevent show horses from getting sun-bleached coats.</p><h3>Apply Sunscreen </h3><p>Baby formula sunblock can be used to protect your horse's vulnerable areas. Your horse will have its head down to graze, so the product will wipe off quickly and need to be reapplied frequently. Products made specifically for horses are brightly colored so owners can see when they've worn off. This might not be the best idea if you're heading to the show ring, however. Inexpensive zinc oxide paste is useful in your equine first aid kit as both sunblock and to help heal any previously irritated skin.</p><h3>Fly Sheets and Masks </h3><p>Fly sheets and masks can help prevent sunburn on your horse. A full mask such as the Absorbine Fly Shield covers your horse from the top of its nose to its ear tips. Pale-colored fly and sun sheets give horses a little protection over their backs. Because these sheets are made with mesh (however, they shouldn't be considered total protection, as some sun rays will get through). Be sure that sheets fit well. A poorly fitting sheet can be irritating, especially over the shoulders and withers.</p>",921
