,url,breadcrumbs,headings,text,word_count
48,https://www.thesprucepets.com/facts-about-horses-1887392,Horses > Horse Ownership Basics,<h1>15 Fascinating Facts About Horses</h1>,"<h1>15 Fascinating Facts About Horses</h1><p>Horses are such fascinating creatures. Even if you never learned to ride one, you could spend your whole life studying them and still have plenty to explore. Here are 15 interesting facts about horses.</p><h2>Horses Sleep Standing Up</h2><p>Yes, horses can sleepstanding up! They sleep laying down too. Learn all about the sleeping habits of horses. Horses must lie down to achieve a full restorative sleep cycle for a minimum of 30 minutes per day to avoid sleep deprivation. There are many factors that influence a horse's ability to lay down to sleep and rest. These factors may be environmental such as weather, available space and comfortable bedding or physical deterrents such as musculoskeletal impediments; ie osteoarthritis.</p><h2>Horses Can't Burp </h2><p>That's right! Horses can't burp, at least not the way humans do. They can't vomit or breathe through their mouths like humans do either. A horse's digestive system is a one-way street, unlike cattle and other ruminants who regurgitate food to re-chew it. Although they have a pretty efficient way of processing the tough fibrous foods that make up their forage, this long, one-directional system can cause problems that result in colic.</p><h2>You Can Estimate a Horse's Age by Its Teeth</h2><p>While you can't tell the exact age of a horse by its teeth, you can estimate its age. Horses need proper equine dental care for their teeth, but sometimes a horse lives longer than its teeth do, so extra care is needed when feeding senior horses.</p><h2>Horses Can Live to Be More Than 30 Years Old</h2><p>One of the most common questions about horses is ""how long does a horse live?"" The answer may surprise you. Knowledge of horse nutrition, horse care, and veterinary medicine has increased. Because of this, just as human life expectancy has increased, so has equine longevity.</p><h2>The American Quarter Horse Is the World's Most Popular Breed</h2><p>Appreciated by beginner riders and professional horsemen alike, the American quarter horse is the world's most popular breed. Learn more about the American quarter horse.</p><h2>(Most) Arabian Horses Have One Less Vertebrae Than Other Breeds</h2><p>The Arabian horse is the foundation of many other light horse breeds. They also possess some unique characteristics. Most Arabian horses have one fewer vertebrae, rib bone, and tail bone than other horses.</p><h2>Horses Are Herbivores</h2><p>Humans are omnivores, lions are carnivores, and horses are herbivores. The way their teeth are formed (grinding molars to break down fibrous plant material), the position of their eyes (face to the side to be on the lookout for predators), and the type of digestive system are all typical characteristics of herbivores.</p><h2>Horses Are Herd Animals</h2><p>Horses in the wild live in small herds, and domestic horses feel more comfortable if they have companions too. It can be quite stressful for a horse to live alone. Companionship for horses may be an equine stablemate or even another species such as a goat, donkey, or mule. Even a dog may become a suitable companion for a horse.</p><h2>Horses Were Domesticated by Humans More Than 3,000 Years Ago </h2><p>Dogs may have become domesticated around 14,000 years ago. Cats became human companions about 8,500 years ago. Humankind's relationship with the horse began a little more recently, around 6,000 years ago, although some evidence has come to light that horses may have been domesticated even earlier.</p><h2>Horses Are Measured in ""Hands""</h2><p>The standard measurement for determining the height of a horse is called a hand. One hand is equal to 4 inches. A pony is an equine under 14.2 hands. The only equines not measured in hands are miniature horses, which are measured in inches or centimeters.</p><h2>Most White Horses Are Actually Gray</h2><p>Most of the white horses that you see were actually a much darker color at birth and gradually turn white. These ""white"" horses may start as bay, chestnut, or almost black. These horses aren't called white, but gray.</p><h2>A Horse's Resting Respiratory Rate Is About 8-14 Breaths per Minute </h2><p>It's important to know the resting pulse and respiration rate of your horse. While the resting respiration rate of a horse can be as low as eight breaths per minute, that can quickly increase with work or distress. Learn your horse's resting pulse and respiration rate (TPR).</p><h2>Horses Are Not Native to North America </h2><p>Every horse on the North American continent is a decedent of European horses. Even the horses that we regard as ""wild"" are actually feral horses, whose ancestors escaped from captivity. Horses disappeared from the Americas more than 11,000 years ago, and there is ample fossil evidence that the horse's ancestors lived here previous to that.</p><h2>A Baby Horse is Called a Foal</h2><p>What is the difference between a filly, a colt, and a foal? It all depends on gender and age. Generally, a foal is a baby horse. After it is weaned from its dam, it is called a weanling. But, horses remain fillies or colts until they are four years of age.</p><h2>The Original ""Horse"" Was the Size of a Golden Retriever </h2><p>The original horse was no larger than a golden retriever. Diminutive  may have looked more like a small goat or deer than a modern-day horse.  lived during the Eocene Epoch about 50 million years ago.</p>",873
49,https://www.thesprucepets.com/how-much-does-it-cost-to-board-a-horse-1886010,Horses > Horse Ownership Basics,<h1>Determining What It May Cost to Board Your Horse</h1>,"<h1>Determining What It May Cost to Board Your Horse</h1><p>Boarding a horsemay seem like an expensive way to keep a horse, but compared to the purchase and upkeep of a property suitable for horses, it may be a little less expensive. For some people, the only way they can keep a horse is to board it at a stable. The cost of boarding your horse can vary greatly. There are many factors that can affect the price of board at a stable, and many stables have more than one level of board available.</p><h2>Location </h2><p>Expect to pay more if the stable is close toor in an urban area. Board may be less expensive in a rural area where fodder is easier to get and space is less limited. Taxes and land costs are higher in urban areas so expect that to be reflected in the cost of the board. There may also be more competition for boarding closer to urban areas, and this supply and demand can send prices upward. Balance the cost of driving and time driving to a stable further away against the higher priced stable closer to you. Stables in areas that are central to horse shows and other equine events will probably be more expensive than those further away.</p><h2>Facilities and Amenities Available </h2><p>Expect to pay more if the stable offers more. Indoor arenas, groomed riding rings, wash racks, trails, jumps, larger stalls, new barns, automatic waters or feeders will all be reflected in the boarding fees. Well-equipped boarding facilities are costly to build and maintain, and this will be reflected in the cost of the board.</p><h2>Services Provided </h2><p>There are many different levels of care available from complete self-care to full board. The more services that are provided, the more expensive board can be. You may have to pay for extra services on top of your regular board bill as well.Your contract should outline exactly what is and is not included in your board price. Examples of extra services are blanketing, handling the horse for veterinarian and farriervisits, extra feeds and supplements, lessons and coaching, in-stable shows and grooming.</p><h2>Self-Care Board </h2><p>With self-care board, expect to supply everything your horse needs but the shelter and fencing. Water should be available, but you might have to provide a trough or buckets. You'll have to purchase and bring in your own feed, including hay and bedding for stalls. Horses may or may not be checked every day, depending upon the agreement you sign. Expect to travel at least once a day to care for your horse and clean stalls. You will have to arrange to be therefor veterinarian and farrier calls. Self-care board situations provide only the facility, but not the actual care of your horse, so that means work for you. Consider your schedule and how you'll manage things like icy roads and bad weather when deciding to take your horse to a self-care boarding stable.</p><h2>Full Board </h2><p>With full board, everything will be supplied. Stalls will be cleaned, the horse will be fed and watered and basic feeds supplied. Supplements may or may not be supplied and included in the cost,but will be fed if you supply them. Horses will be turned out for exercise daily and blanketed (usually an extra cost) according to the weather. Veterinarians and farriers will be arranged by the owner/manager. You will probably have to attend visits from the farrieror vet, or you may end up paying someone else to attend if you can't. Lessons may be included in the cost, or they will be extra. You'll probably want to visit your horse frequently, but you will come across horse owners at these barns that may not see their horses for weeks or even months.</p><h2>Questions to Ask </h2><p>Between self-care board and full board, there is a wide range of services and amenities that stables provide. Before you move in, read the boarding contract and make sure you understand what is and is not included in the cost, what you'll be expected to do, and what extra expenses you might be charged. Some stables charge a few dollars extra per day to blanket horses or feed supplements. Some will look after your horse when the farrier comes but may charge you for the time. So make sure you avoid surprise additions to your board bill by understanding what is provided.</p><h2>Horse Boarding Prices </h2><p>You might find board for as little as a dollar per dayor partial payment in sweat labor. At a very well-appointed stable with lessons included and close to a major city or event grounds, you can expect to pay over $700 a month for board. Shop around. Talk to other horse owners in your area to find a stable you can afford and that you trust to care for your horse.</p>",796
50,https://www.thesprucepets.com/introducing-your-horse-to-pasture-1886474,Horses > Horse Ownership Basics,<h1>Introducing Your Horse to Pasture</h1>,"<h1>Introducing Your Horse to Pasture</h1><p>Considering that grasses are the most natural food sources for a horse, it surprises many people to learn that there is a proper technique for turning a horse out to graze in lush pasture and that problems can occur if you don't do it correctly. If your animal has been eating hay or browsing on sparse pasture all winter, suddenly turning it out onto a very lush pasture can cause colic and laminitis (also called ""founder,"" a painful inflammation of the hooves). Prolonged exposure to too much high carbohydrate grasses can cause metabolic syndromea cluster of clinical problems that often include obesity, along with the potentially life-threatening illnesses of diabetes and cardiovascular disease.</p><p>The key is a gradual transition. If your horse or pony is grazing in the same pasture from the time the ground thaws in early spring, it will be introduced to the new growth of grass in a slow, natural transition. Many people keep herds of ponies this way without a problem.</p><h2>Ponies </h2><p>Many pony breeds evolved in areas of very sparse pastures, such as mountainous and arid regions, where grass didn't grow thickly.In such environments, ponies spent much of their grazing time searching and navigating rugged terrain, and the constant travel provided considerable exercise to balance the eating. But the thickly grassed pastures common in today's environment make grazing too easy for most ponies, causing them to fill up quickly and remain relatively sedentary, as compared to their wild ancestors. For this reason, you must be very careful to introduce ponies very slowly to grass and watch them to make sure they aren't eating too much, too quickly. Allow ponies just a few minutes of grazing when you first introduce to pasture, gradually building up the time spent there. The full transition can take several weeks until you are satisfied that the ponies can spend all day out in pasture.</p><p>It's also possible your ponies will never be able to spend full days in lush pasture. Ponies can gain weight very easily, and you may need to restrict the grazing time to prevent them from gaining weight too quickly to the point of obesity. Founder is very common in ponies, and obesity can lead to problems such as metabolic syndrome and heart disease. To prevent these problems, allow your pony only short periods for lush grazing, with the bulk of their time spent in a much sparser area. Your pony will no doubt try to convince you that it's starving, but you're the best monitor of its actual condition. Most ponies canthrive on sparse rations and don't need any supplements or concentrates.</p><h3>Tip</h3><p>Equine metabolic syndrome is most clearly identified by obesity in a horse or pony, especially around the neck. It often is accompanied by the painful hoof inflammation of laminitis. Losing excess weight can be extremely difficult for a horse with metabolic syndrome, and it may require severe feed restrictions that deny the animal access to all grazing for a period of time. But do not attempt to diagnose metabolic syndrome yourself, as a definitive diagnosis requires lab tests to determine blood glucose levels and rule out PPID (a pituitary disease). Treatment and diet restrictions should be done under the supervision of an equine veterinarian.</p><h2>Horses </h2><p>Laminitis and obesity problems can occur in horses,too. Horses put out on lush pasture can suddenly develop problems, such as colic,as well as longer-term problems, like metabolic syndrome and founder.Introduce your horse gradually, starting with a half-hour and adding about 10 minutes every day, until you can leave your horse in the pasture for the entire day.It's a good idea to feed hay to your horse before turning it out, to prevent it from gorging on lush grass.</p><p>Keep in mind that having a completely empty stomach isn't good either, as this can possibly lead to EGUS (equine gastric ulcer syndrome)which leads to stomach ulcers. A horse's digestive system is made to digest small amounts of food over long periods of time. So, organize your horse's feeding routine so that it's neither feast nor famine.</p><h2>The Bottom Line </h2><p>It's tempting to turn your horse out in the spring and watch it enjoy that beautiful green grass. However, doing so may endanger its health, or even foster potentially fatal diseases such as diabetes and heart disease. Err on the side of caution when introducing your horse to pasture. Go slowly and make sure that your horse or pony doesn't gorge on too much of a good thing.</p>",777
51,https://www.thesprucepets.com/how-to-tell-a-horses-age-by-its-teeth-1887383,Horses > Horse Ownership Basics,<h1>How to Tell a Horse's Age by Its Teeth</h1>,"<h1>How to Tell a Horse's Age by Its Teeth</h1><p>Many people think that you can tell a horse's age by its teeth. This isn't quite true. Horse's teeth aren't like the rings of a tree that show each year's growth. Telling a horse's age by its teeth is not 100 percent accurate, but it will give you an approximate range if you don't know the horse's actual date of birth. The younger the horse, the closer the teeth will match its real age. As horses age, many factors can affect the condition of the teeth and make it more difficult to estimate age. Things like basic maintenance, diet, grazing conditions, vices, and genetics all play a role in how the horse's teeth themselves are aging.</p><h2>Baby Horse Teeth </h2><p>Foals get their first milk or deciduous teeth shortly after birth. The final milk teeth are grown in by the time the foal is about nine months old. The first permanent teeth begin to grow in when the horse is between two and three years old. It's not unusual for a horse owner to find a shed tooth in a feeder or on the ground. The milk teeth are shed gradually, and all of the permanent teeth are grown in by around age five. Milk teeth are paler in color and shorter than permanent teeth.</p><h2>Adult Horse Teeth </h2><p>The eruption times of the upper central incisor (2.5 years), upper middle incisor (3.5 years) and upper corner incisor (4.5 years) for horses under 5 years of age is considered fairly accurate in determining a horses age.</p><p>The new permanent teeth are quite concave on their surfaces and these ""cups"" along with the angle, shape and a groove on the outer vertical surface of the upper corner incisor (UCI) that gradually grows out, called Galvayne's groove, are the indicators of how old a horse might be.</p><p>A ""hook"" located on the rear end of the UCI is often visible at age 6-7 years, and then again at age 11-13 years. Due to this variability in occurrence, it is not considered definitive in determining a horses age.<sup>2</sup></p><p>As the horse wears its teeth by grazing, the concave surfaces are worn flatter. By the time a horse is about 11 years old, it will have worn its teeth flat. How quickly this happens depends on the type of grazing it has available. Horses that graze grass on the sandy ground will wear their teeth flatter than those fed only hay grown on clay type soil.</p><p>At about age 10, the Galvayne's groove begins to appear at the gum line. This groove will continue to grow out so that reaches the entire length of the tooth. By about age 15, the groove will reach half-way down the tooth, and it will reach all the way down the tooth by age 19-20 years. By the time a horse is in its mid-20s the Galvayne's groove begins to disappear from the gum line, and if the horse lives long enough, will disappear completely as the tooth naturally wears away.</p><h2>Senior Horse Teeth </h2><h2>Extra Horse Teeth </h2><p>Some horses may grow wolf teeth and tushes or canines. These are extra teeth that grow in the toothless bar of the horse's mouth between the front teeth and back. Sometimes these teeth may have to be removed if they interfere with the bit or cause discomfort for the horse. These teeth usually come in by the time the horse is five years of age. Some horses will not have them at all, or for some, they may not be a problem.</p><h2>Care of Horse Teeth </h2><p>Because horse's teeth grow throughout most of their lifespan and may not wear evenly, your horse will need to be checked by a veterinarian or equine dentist about once per year. Your horse may need to be floated, removing by filing any sharp edges or hooks that will prevent him from chewing properly and holding a bit or wearing a hackamore comfortably.</p><h2>Detailed Diagrams and Explanations of Horse Teeth </h2><p>While this is a general description of aging horses by their teeth several university agricultural extensions have detailed fact sheets with diagrams that show horse's teeth at every stage of life. The PDF file from the University of Nevada Cooperative Extension is quite good and easy to print out so you can take it to the barn and compare pictures to actual teeth. The University of Missouri has a similar online resource with diagrams and explanations.</p>",756
52,https://www.thesprucepets.com/leg-markings-on-horses-1887398,Horses > Horse Ownership Basics,<h1>Leg Markings on Horses</h1>,"<h1>Leg Markings on Horses</h1><p>Leg markings are areas of white hair that extend up from the hoof on an otherwise the dark-colored horse. There is so much variety in leg markings and so many unique combinations that leg markings are an important way to identify individual horses -- they're important enough that even old horse proverbs mention them. Horses may have four similar white markings on their legs, or the leg markings can be completely different on each leg. For example, a horse may have no white on one leg, a high stocking on another, a coronet on another and a sock on another. Leg and facial markings are sometimes passed on from one generation of horses to the next. For example, Arabian horses of Crabbet bloodlines often have wide white facial markings along with four white stockings. Horses with particularly flashy and eye-catching white on their legs are said to have ""chrome.""</p><h2>What Is Chrome </h2><p>Lots of chrome can present a grooming challenge. For a show, these flashy markings are sometimes tricky to keep clean and there aremany grooming tips to keep them white.</p><h2>Reasons for Accurate Documentation of Markings </h2><p>For breed registration and other official paperwork, you must accurately draw the markings on the documents you will submit. You may also have to write a description, and that means you have to use the right terminology. If your horse were to go missing, it's helpful to have clear photos that show its white markings, a written description, and you may need to be able to describe its markings accurately when giving information.</p><h2>Patterns of Markings </h2><p>Most often, if a horse has white leg markings, the hoof wall will be white too. Anywhere there is a patch of body hair or an ermine mark, there may be a dark stripe down the hoof. As grey horses age, the leg and facial markings may not be as obvious. However, they are still there, because the skin underneath white leg markings is pink, and the skin under the coat color will be grey. The shape of leg markings does not change though, regardless of the age of any colored horse. If a horse was born with four white stockings, the shape of the stockings will remain the same throughout the horse's life.</p><p>Occasionally, you'll see white markings on the legs that the horse wasn't born with. These white marks are from old injuries. Becausethey arepermanent,they too can be used as identifying marks.</p><h2>Coronet </h2><p>A coronet is a band of white hairs around the top of the hoof (the coronet band of the hoof) that does not extend up onto the pastern. If the coronet extends around the whole hoof, the hoof itself will likely be white. If there is a break in the white hairs where there is coat color, the hoof may have a dark stripe below it. If the white hairs only cover a small area just above the coronet band of the hoof, usually at the back the marking is called a heel or partial coronet.</p><h2>Socks </h2><p>Socks extend above the fetlock but not to the knee. Socks stop about half-way up to the canon bone on either the front or back legs. If the sock is solid white around the hoof, the hoof will most likely be white. If there is a patch of coat coloror an ermine just above the hoof, there may be a stripe of dark hoof below.</p><h2>Stockings </h2><p>Stockings extend to the knee or hock and above. They may end in a symmetrical or pattern, or they may extend further up the leg in a jagged ""irregular"" pattern. If they extend well past the knee or hock they are called ""high white.""</p><h2>Boot or Fetlock </h2><p>A boot or fetlock is white that extends up to, but only slightly past the fetlock joint. A partial fetlock means that only a portion of the fetlock joint is covered with white hair.</p><h2>Pastern </h2><p>A pastern marking covers the pastern area but does not extend beyond the fetlock joint.</p><h2>Ermines </h2><p>Ermines are random black spots that appear on white areas on the horse's body. They can appear on the horse's white leg markings, and if they are against the coronet band of the hoof, there may be a stripe of dark hoof wall on an otherwise white hoof. Ermines can also appear on horse's facial markings.</p>",718
