,url,breadcrumbs,headings,text,word_count
126,https://www.thesprucepets.com/puppy-101-back-to-basics-4114144,Dogs > Getting Started > Puppies,<h1>The First 30 Days With Your New Puppy</h1>,"<h1>The First 30 Days With Your New Puppy</h1><p>Getting a new puppy is a very exciting time. You've probably been planning the arrival of your new furry friend for months (or even years!) or you might have fallen in love with an unsuspecting stray pup who is suddenly joining your household. But regardless of the circumstances of the new arrival, the first month with your puppy is a month of changes for everyone involved.</p><h2> Before Bringing Your Puppy Home </h2><p>If you are planning on bringing a new puppy into your home, then you should take some time to prepare for the puppy's arrival. There are a few key things you can purchase and have ready for your puppy ahead of time.</p><p>Place these new puppy items in your home for other people and any other pets you may already have to start adjusting to them. Don't just leave them in a bag until the puppy gets there. This will allow a more gradual change for the household to adapt to.</p><h2> First Day </h2><p>Day one with your new puppy is very exciting, but you'll want to be careful that you don't overwhelm it. If you don't have other dogs, let your puppy safely explore your home. Attach the leash to your puppy's collar and let it drag the leash around behind, while it sniffs out its new territory. Sit on the floor with your puppy and simply observe while it explores, making sure it is out of harm's way at all times. If you have a dog that you need to introduce to your puppy, consider allowing the dogs to meet in neutral territory, such as someone else's front yard.</p><p>Start using your puppy's name when calling it, to get it used to hearing your voice, and every half an hour or so take your puppy outside to go potty. It most likely won't know what to do in the yard, but you should simply say ""go potty"" and then ignore it, while it sniffs. If it does its business, be sure to reward it immediately with verbal praise, a small treat, and some petting. When you aren't watching your puppy, be sure to put it in its crate to keep it safe, and to encourage it not to have any accidents inside the house.</p><h2> 10 Days </h2><p>After a week or so, your puppy will be comfortable in its new home. It will probably be pushing the limits and chewing things it shouldn't be chewing, barking, playing, and having potty accidents in the house.</p><p>Stay consistent with your training and be patient. A puppy wants to please you but it will make mistakes. Continue to praise it when it does the right thing or deter it from doing the wrong thing by distracting it with a toy.</p><p>Your puppy will have claimed its favorite spot in the house. This may be its crate, bed, or under the coffee table, but wherever it is, this spot makes them feel secure and comfortable.</p><p>Make sure your puppy's urine and feces appears normal, as it can be common for puppies to get urinary tract infections and have intestinal parasites. If you haven't done so already, make an appointment with your veterinarian for a full physical examination, vaccinations, a fecal analysis, etc. for your puppy. Vaccinations need to be completed in specific, timed intervals in order for them to be effective, so you won't want to let your puppy get off schedule!</p><p>Try to resist the urge to take your puppy to places where other dogs may be or have been, unless they have finished their vaccination series and your veterinarian has deemed them healthy.</p><h2> 30 Days </h2><p>Your new puppy should have been to the vet at least once for vaccinations, but depending on the age of your puppy, multiple future visits may be necessary to complete its vaccinations. You'll also want to start your puppy on regular preventative medications to prevent or control fleas, ticks, intestinal parasites, and heartworms. These are typically monthly medications, but ask your veterinarian for their recommendation.</p><p>You should discuss spaying or neutering your puppy, microchipping, and pet insurance with your veterinarian as well. Depending on the age, breed, and health of your puppy, your veterinarian may have specific recommendations for these issues.</p><p>Don't panic if you have another dog at home and it isn't getting along with the new puppy just yet. This process can take time and 30 days may not be enough for your older dog to adapt to a young, energetic puppy. If your dog seems to be having a hard time with the youngster, try rewarding your dog with a treat every time the puppy is near. This will help your dog think of the new puppy as a positive thing, not just a nuisance.</p>",795
127,https://www.thesprucepets.com/puppies-and-music-2804574,Dogs > Getting Started > Puppies,<h1>Music Therapy for Your Puppy</h1>,"<h1>Music Therapy for Your Puppy</h1><h2>Calm or Energize Your Pet</h2><p> Dr.</p><p>Puppies and music can be a positive, therapeutic mix. Music can mask scary noises like thunder and fireworks, or upsetting sounds like a trespassing mail deliverer that put your puppy's tail in a twist. It can even be helpful for separation anxiety or ""pep up"" a lethargic pet. The cadence of certain sounds influences the body's natural rhythms and can speed them up and energize the listener, or slow them down to calm them.</p><h2> Music Therapy for Puppies </h2><p>A hyperactive or fearful pet can be soothed with music or distracted with nature sounds like water running from a fountain. Lethargic pets that need to exercise can be energized with chirping squirrel sounds or fast music to get them up and bouncing to the beat.</p><p>Puppies are even more sensitive to sound than people are. Puppy hearing is very acute, so it doesn't have to be loud music to have an effect.</p><p>Sound causes physical changes in the body. Brain waves change with different kinds of sounds-music with a pulse of about 60 beats per minute slows the brain waves so the listener feels more relaxed and peaceful and shifts the consciousness into a more alert state. This rhythm also slows breathing, which calms the mind and improves metabolism.</p><p>Even the heart wants to follow the pulse of the music-faster rhythms energize the listener as their heartbeat increases and blood pressure rises, while slower tempos simply calm them. Listening to music releases endorphins-natural painkillers that are produced by the brain-and reduces the levels of ""stress hormones"" in the blood.</p><h2> Sound Therapy </h2><p>Sound therapy is still considered pretty new. One of the best-known applications is an ultrasound that uses the ""echo"" of high-frequency sound waves to take diagnostic pictures inside the body; doctors even use it to break up kidney stones with vibration instead of surgery. Over the last 20 years, music therapy has become a staple of the human mental health profession and is often used with troubled children and brain-disordered patients. It's also helpful for stress relief for people in general.</p><p>Therapeutic harp music helps relieve pain that drugs don't, soothes an emotional upset, and has become of particular help in hospice situations for human patients. One of the pioneers, Susan Raimond, also promotes the therapeutic effect of harp music on animals. The sound of harp music calms fractious dogs and cats and offers almost a natural soothing effect to help upset animals become quiet, lay down and go to sleep.</p><h2> Helping Puppies With Music </h2><p>The simplest way to treat puppies with music is to put on music or turn on the radio. Choose the music you like-pets seem to respond best to music their owners enjoy because of the bond you share. If you have a favorite music genre you often play, your pet will associate the sound with your presence-so playing that same music when they are alone will remind them of you and help ease problems like separation anxiety.</p><p>Soft music with a slow, steady rhythm helps calm agitated puppies. It can help arthritic pets relax their muscles and increase their range of motion. It takes about 10 or 15 minutes for the music to take effect. Many pets enjoy Mozart or other classical music. New Age, soft jazz, southwest music with flutes and nature sounds, or even ballad-type country music can be soothing. The music should be melodic (not dissonant) and the tempo even and slow. You can play calming music anytime your pet feels stressed-even all day long as a background to help keep them calm.</p><p>Turn up the volume to energize your pet. Uptempo music may amplify the bond between you and your puppy when used during times of high energy and exercise. Moderate to loud music with a more driving beat energizes the emotions. Rock music, even the driving energy of rap may get a pet's tail moving, but any up-tempo music from classical to contemporary has the power to energize. Again, play the music for at least 10 to 15 minutes at a time to get your pet in the right mood and use the time to play with your pup.</p><p>Any music that you play on a regular basis helps your puppy identify that sound with your comforting presence. Even if your puppy doesn't suffer from separation anxiety, familiar music can help if you need to be away from home, because you can play your favorite music to help your pup feel better about your absence.</p>",747
128,https://www.thesprucepets.com/do-puppies-shed-2804792,Dogs > Getting Started > Puppies,<h1>Why Puppies Shed</h1>,"<h1>Why Puppies Shed</h1><h2>How to deal with puppy shedding when the fur flies</h2><p>Shedding can turn into a big, hairy deal, but it's a normal part of living with a puppy. All puppies shed, even the breeds considered to be non-shedding. Anyone who's had to lint-roll their black pants recently knows that this is true of all dogs.</p><p>You don't have to live with drifts of fur and can keep your home and clothing relatively hair-free with a few simple precautions. Here's why dogs shed and what you can do to keep your puppy's coat and skin healthy.</p><h2> Hair Growth Cycle </h2><p>Hair and fur do not grow all the time but are continuously renewed in a cycle of growth, rest, and loss. New hair pushes out the old, resting ones, and this fur loss is called shedding.</p><p>All hair follicles in the skin go through a cycle of active growth, called That's followed by a brief period of shrinkage, during which the hair root loosens. The ending phase, called is the stage in which hairs are shed as they're pushed out and replaced by new, emerging hairs.</p><p>The length of the hair growth period varies from breed to breed. Most dogs have a seasonal shed in the spring and/or during the fall. It's not the temperature that prompts shedding; instead, light exposure, either to the sun or artificial light, determines the amount and timing. More hair is shed during the greatest exposure to light.</p><p>Outdoor dogs living in the northeastern United States shed every year, most heavily in late spring for the several weeks during which daylight increases. However, house pets under constant exposure to artificial light may shed all year long.</p><h2> What About Low-Shedding Puppies? </h2><p>Breeds like poodles and some terriers that are referred to as non-shedding do shed. Instead of the anagen hair-growing phase lasting a short time, their hair grows for years before it's shed and may grow quite long unless clipped.</p><p>These types of coats don't tend to shed all at once. You won't notice clumps of fur coming out because they only lose a few hairs at a time. Because these breeds also tend to have curly coats, lost hairs tangle alongside the growing hairs and don't always end up on the furniture. The fur may turn into long cords, as with the Puli and Komondor breeds, unless kept trimmed.</p><p>Depending on when your puppy was born, it may shed its puppy coat before the regular seasonal shed in the spring or fall. Most puppies lose their baby coat between 6 and 12 months of age as the new adult fur replaces it. This can vary from breed to breed.</p><h2> Shedding Risks </h2><p>Breeds with heavy double coats that shed in clumps are more prone to developing painful mats. These happen when fur is trapped next to the skin, especially in the groin and armpit regions. Mats can create bruises and can lead to hot spots.</p><p>You can't stop shedding, but you can reduce the aggravation to yourself and your pet. Comb and brush it regularly. Thickly furred puppies need daily attention, but short-haired pets also benefit from consistent grooming. Pay particular attention to combing the mat-prone areas behind the dog's ears, beneath its tail, and in the creases of its legs.</p><p>One tool you can use to prevent these issues is the EZ-Groomer, a lightweight, claw-shaped comb that breaks up established mats and removes shed fur. Unlike most other combs or brushes, you can use the EZ-Groomer to comb backward on the pet, for a beneficial effect. This product also is quite economical, in the $10 to $15 range, and comes in two sizes for small to large pets.</p><p>The FURminator won't work on mats but does an extraordinary job removing shed fur. Tiny, shallow, close-fitting teeth pull off 80 to 90 percent of loose hairs. Try grooming your pet with a standard comb or brush, then follow up with the FURminator you'll be shocked at the mountains of lint. This product also comes in different sizes to match your pet but is quite pricey. Make sure you groom your pet outside or in an easy-to-clean area so that you don't create a furry tornado inside the house.</p><p>You don't have to groom your whole puppy in one setting. If you don't have the time or your pet gets impatient, you can spread grooming sessions out over several hours or days to keep it happy. Follow each session with a favorite treat or game to train your puppy to identify grooming with good things. Be sure to comb your puppy thoroughly before you bathe it, which will loosen even more shed fur. Fur removed by grooming won't cause mats or end up on your clothes and furniture. If you aren't able to manage grooming yourself, have it professionally done.</p>",793
129,https://www.thesprucepets.com/puppy-temperature-2804793,Dogs > Getting Started > Puppies,<h1>How to Take Your Puppy's Temperature</h1>,"<h1>How to Take Your Puppy's Temperature</h1><p>Your puppy's temperature refers to the body's warmth as measured by a thermometer. A puppy's normal temperature is a few degrees lower than that of an adult dog until the age of four weeks. Learn how to take a puppy's temperature and when to be concerned about it being high or low.</p><h2> Normal Body Temperature in Puppies </h2><p>A newborn puppy can't regulate body temperature and needs the warmth of its mother and littermates to stay at a healthy temperature. Their own body temperature will change based on their environment, so they can be at risk for getting too hot as well as too cold. The normal temperature for a newborn pup is between 96 to 98 degrees Fahrenheit, and a temperature out of this range can indicate a health problem.</p><p>During the second and third weeks of life, a puppy's body temperature will range from 97 to 100.5 degrees Fahrenheit. In the fourth week, a puppy will have the usual normal body temperature of an adult dog, from 99.5 to 102.5 degrees Fahrenheit.</p><p>If you do need to take your puppy's temperature at home, make sure you learn the proper technique and give your dog lots of treats and positive reinforcement. It will also help to get the dog used to being handled in this way so that when the veterinarian does this in the future, your puppy won't be scared.</p><h2> Fever in Puppies </h2><p>Temperatures higher than normal may be referred to as a fever or hyperthermia depending on the cause.</p><p>Fever is the body's normal defense mechanism to fight infection because a higher than normal body temperature helps the immune system fight viruses and bacteria. Fevers associated with infection may be caused by a wide variety of illnesses or infected wounds, including Parvovirus, Distemper, pneumonia, Kennel cough, ear infections, infected bite wounds, a painful hot spot, or any other source of infection within the body.</p><p>A higher than normal body temperature can also be due to overheating during exercise or to exposure to high temperatures. Puppies and dogs of any age can get heat stroke in this case and will have an abnormally elevated temperature as well as other signs of heat stroke including lethargy, disorientation, diarrhea with blood, or even seizures.</p><p>You should seek a veterinarian's care when your dog's temperature is elevated above 103 degrees Fahrenheit, especially if they have any other concerning signs. At very high temperatures, damage to the dog's internal organs can occur and could even prove to be fatal so it is best not to wait until that point. You can safely help reduce a dog's temperature by placing a cool water-soaked washcloth on your dog and placing them in front of a fan. Don't give your dog any human fever-reducing medications unless directed by your veterinarian as many of these are toxic to dogs.</p><h2> Low Body Temperature in Puppies </h2><p>Hypothermia is body temperature that falls lower than normal. Newborn puppies that squirm away from their littermates or mom can experience a life-threatening drop in body temperature. An orphaned newborn puppy should be kept in an environment of 85 to 90 Fahrenheit for the first week and then 80 degrees Fahrenheit until the fourth week. It is very important to use safe sources of heat to avoid burns to the skin and overheating. Discuss with your veterinarian the most effective ways to keep an orphaned puppy warm.</p><p>Shock also can cause hypothermia due to a number of causes including loss of blood, severe dehydration, or poor circulation. Trauma including a fall, being hit by a car, severe bite wounds, as well as heart failure, or a severe allergic reaction called anaphylaxis, are common causes of shock.</p><p>Low body temperature can also occur from certain drugs, such as anesthetics and sedatives.</p><p>A drop in body temperature also happens with prolonged exposure to extreme cold. Hypothermia can kill young puppies quickly, but any dog can be at risk if it does not have protection from extremely cold weather, which also can cause frostbite. If your dog has a low temperature due to exposure to extreme cold, rewarm your pet slowly over the course of one to four hours, with a goal of reaching a temperature of around 98-99 degrees Fahrenheit. Again, it is important to use an appropriate warming technique to avoid burns or other complications so it is best to see a vet right away if you are concerned about hypothermia.</p><h2> How to Take Your Puppy's Temperature </h2><p>You will need a human rectal thermometer to get a good reading. Ear temperature is unreliable in dogs, and checking how the nose feels is simply an old myth.</p>",789
130,https://www.thesprucepets.com/puppy-vaccinations-1118656,Dogs > Getting Started > Puppies,<h1>Everything You Need to Know About Puppy Vaccinations</h1>,"<h1>Everything You Need to Know About Puppy Vaccinations</h1><p>Vaccines are an essential part of a puppy's health care plan. Certain basic immunizations are essential to keep your puppy from getting sick and prevent the spread of disease.</p><h2> Why Vaccinate Your Puppy? </h2><p>When puppies are born, their immune systems are not fully developed, so they cannot fight diseases as effectively as older dogs. Puppies receive protective antibodies from their mothers through nursing. During the first few hours of a puppy's life, nursing mothers provide an especially antibody-rich milk called colostrum. These antibodies provide puppies with temporary immunity against illness. While the length of this immunity varies from puppy to puppy, it is generally believed that maternal antibodies wane gradually and are gone by 16 weeks of age.</p><p>Enter puppy vaccinations. Vaccines are designed to trigger immune responses and prevent future infection from diseases. All puppies should be administered certain core vaccines which provide immunity against the most dangerous and widespread diseases. 'Core' vaccines are the ones considered most essential for puppies in most geographical locations. Depending on your location and your puppy's environment, non-core vaccines may also be recommended. Talk to your vet about your puppy's risk of exposure to these diseases.</p><h2> How They Work </h2><p>Puppy vaccines are typically first administered at about six to eight weeks of age, then repeated every three to four weeks until the pup is at least four months of age. Some of these vaccines might be given together in one injection that is called a combination vaccine. At your puppy's first veterinary exam, your vet will discuss the schedule of vaccinations and other treatments for your puppy, such as deworming, beginning heartworm prevention, and scheduling a spay or neuter. The vaccine injection itself is typically not painful. Some puppies seem to feel a little pinch or sting while others do not react at all.</p><p>Your veterinarian will need to do an examination before vaccinating your puppy. Note that vaccines are not usually given to a puppy with a fever or other signs of serious illness as the vaccine may not be as effective if the body is fighting another infection, and/or could make the puppy feel worse. </p><p>After a vaccine is administered, immunity is not immediate; it takes up to a few weeks to become effective and this varies between animals. Puppies that still have maternal antibodies will not have as strong of an immune response to a vaccine and therefore will be less protected. There is no way to be certain if a puppy still has maternal antibodies, hence the reason for boosters. Complete immunity is uncertain until about four months of age, or until all puppy boosters are completed. Avoid bringing your puppy to dog parks, walking them outside in public places, or otherwise exposing your puppy to unknown animals until all vaccinations have been given. See the chart below for a typical vaccine schedule.</p><h2> Puppy Vaccine Schedule (Sample): </h2><p>A Note on Adult Boosters</p><p>Most vaccines require a booster within 1 year after the puppy series. After the initial boosters, some vaccines will need to be given annually, and others will only need to be given every 3 years. There is a 3- year rabies vaccine available, for example.</p><h2> Risks </h2><p>There are some risks associated with vaccinations though relatively uncommon. Vaccine reactions and side effects are typically mild and self-limiting. Signs may include pain and swelling at the injection site, lethargy or fever. Severe allergic reactions are rare but can be fatal if left untreated. If your puppy develops hives, facial swelling, difficulty breathing, vomiting, or bloody diarrhea, contact your vet immediately.</p><p>Because vaccinations stimulate the immune system, there is a small risk of developing an autoimmune disorder after vaccines. This is very uncommon when you consider the small number of dogs who develop these conditions versus all of the dogs that are vaccinated. However, autoimmune disorders can be serious and difficult to treat. Autoimmune conditions that may occur include blood disorders, neuromuscular issues, and even skin problems.</p><p>Despite the small chance for potential side effects, the benefits outweigh the risks when it comes to puppy vaccines. Sadly, puppies who are not vaccinated are at high risk for contracting diseases which can be very serious, and often fatal such as Distemper and Parvovirus. However, for adult dogs who received a complete set of puppy vaccines, many vets are embracing protocols that vaccinate less often. Once given annually, many adult vaccinations are now more likely to be recommended every three years since there is evidence that immunity lasts well beyond 1 year in many cases. Some vaccines still require annual boosters to be effective including Bordetella (Kennel Cough), Leptospirosis, and Lyme.</p>",786
