TERM,OUTPUT
weight benches,"<h2>FAQs on weight benches</h2><h3>How do I adjust the weight bench?</h3><p>Each bench will be operated differently. Many use spring-loaded pins to secure the bench and seat into position, while some use a notch and bar for convenience. Make sure to read the owner's manual to learn how your bench operates.</p><h3>What muscles/exercises can I work on using a weight bench?</h3><p>You can work your full body with any weight bench. I strongly encourage finding credible sources or coaches to help you learn how to use a bench to the maximum.</p><h3>Does the bench's weight capacity include my body weight?</h3><p>Yes! It is important to remember this when picking a bench. If your bench has a maximum capacity of 600 pounds and you weigh 200 pounds, the maximum weight you could safely lift would be 400 pounds. Lifting more than the weight capacity could have dire consequences.</p><h3>Can I do bench presses on the weight bench?</h3><p>Yes, this is one of the primary purposes of a weight bench. Note of warning: ensure you have a proper racking system if you plan to use a barbell. Otherwise, you should stick to bands or dumbbells.</p><h3>Can I do decline bench press on the weight bench?</h3><p>Yes, if your bench has a decline setting.</p><h3>Should I buy a flat bench or an adjustable one?</h3><p>This comes down to personal preference. Flat benches are great options, but adjustable benches give you more variety of exercises you can do.</p><h3>What is a foldable weight bench?</h3><p>This is a bench that can fold up for convenient storage.</p><h3>How padded should my bench be?</h3><p>Your bench should have enough padding that you don't feel the metal frame pressing into you. Avoid overly plush or soft benches as they won't offer you a stable platform for lifting.</p><h3>Why use a weight bench?</h3><p>Bodyweight workouts can only get you so far. Eventually, you'll need equipment or weights to achieve results. Using a weight bench allows you to increase your volume, intensity, and variations for your workouts.</p><h3>How much should I bench for my weight?</h3><p>How much someone benches will vary drastically depending on the person's body style, metabolism, gender, and even fitness goals. A solid goal for novice lifters would be to be able to lift the same as their body weight.</p><h3>How to improve bench press weight?</h3><p>One of my favorite programs is the 5/3/1 progressive program as it darn near guarantees results. That being said, there are tons of programs out there for the bench press that could help you blast through plateaus and PRs.</p>"
backpacking meals,"<h2>FAQs about backpacking meals</h2><h3>Why are backpacking meals important?</h3><p>As you journey into the wilderness, whether it's a casual nature walk or a grueling excursion, you need sustenance to fuel yourself; carbs for energy and protein for muscles, etc. Backpacking and hiking meals will provide all of that in a delectable package to ensure you don't get sluggish from hunger out on the trail.</p><h3>How much do backpacking and hiking meals cost?</h3><p>Most meals cost between $10 and $15, with our Best Value winner at $8 to $9 per pouch. Large variety packs are available, mostly running between $120 and $150 per bucket (usually 12 pouches). Military MREs ring in at $40 to $50 for a four-pack and are really for those desperately hunting for that chili mac and cheese spread.</p><h3>How are backpacking and hiking meals prepared?</h3><p>Prepackaged camping food is as mind-numbingly easy to prepare as can be. Do you have hot water? Perfect, you're done. Pour the recommended amount into the pouch, let it stew in its own flavors for the recommended time, and ta-da. MREs include heaters activated by water to warm food while also including beverage mixes, snacks, and toiletries.</p><h3>Are there breakfast items available for morning adventures?</h3><p>You bet your sweet bippy there are. While less common, there are plenty of breakfast items for morning treks, with some companies offering more or less variety. Oatmeal and granola are the most common dishes sold in stores, but breakfast skillets with eggs, veggies, and meats are also available.</p><h3>What are the differences between freeze-dried and dehydrated camping foods?</h3><p>Dehydrating is a simple and ancient method of heating and drying food over some time to evaporate moisture, typically 80 percent or so. It's a cost-effective method that most folks can try through various methods. Freeze-drying is more complex, as food is flash-frozen at low pressure before gradually raising temperatures. This evaporates up to 95 percent of moisture without harsh heat, which may degrade nutritional content.</p><h3>Are backpacking meals healthy?</h3><p>In the sense that they provide hikers with sustenance, fats, and protein to fuel their expeditions, yes, they are quite nutritious and effective and deliver needed energy. But given many products' high-calorie counts and fat content, they can be over-consumed, especially when taken frequently with minimal physical activity. Save your freeze-dried gratin potatoes for when it's time not to be a couch potato.</p>"
snow boots for women,"<h2>FAQs on snow boots for women</h2><h3>Why do you need snow boots?</h3><p>Unless you are looking to be one of the 1,000,000 people who are injured each year due to falls on snow and ice, yes, you need snow boots if it regularly gets below freezing in your neck of the woods. Even if your area doesn't receive a lot of annual snowfall, It's definitely comforting to know that you can simply pull your trusty snow boots out of the closet to dig out your driveway in comfort after Snowmageddon hits.</p><h3>Can I use my hiking boots as snow boots?</h3><p>Because of their sticky treads and ankle support, hiking boots can be a great alternative to a full snow boot as long as they are insulated and waterproof. Since hiking boots generally only extend over the ankle and tend to have a wider opening at the top, I'd recommend buying leg gaiters to attach to your hiking boots to help keep the snow out. Leg gaiters can add up to 10 inches of waterproof material to your shins and calves and can cost as little as $15.</p><h3>Are snow boots good for hiking?</h3><p>Generally speaking, snow boots are not great for hiking long distances, although you can probably get away with wearing them to comfortably walk your dog around the block. But be aware that waterproofing and insulation can cause the feet to sweat, which means wearing them for extended periods without good socks can actually make your feet feel colder, regardless of the boot's temperature rating.</p><h3>How should snow boots fit?</h3><p>Snow boots are designed to fit snugly around the calf and shin to keep moisture out. While having a zipper for easy on/off access may appeal to you, note that a zipper makes it harder to keep moisture out. Choose a boot with an easy-to-use lacing system to ensure your boots are comfortable and also secure. Finally, ensure you choose snow boots that have enough room in the toe box (generally a thumb's length to the end of the boot) to allow your toes to wiggle and expand. This will promote heat circulation inside of your boots to keep your toes warm. Most experts recommend going a size up from your regular shoe size to ensure you have room to wear a good pair of wool socks.</p>"
hiking boots,"<h2>FAQs on hiking boots</h2><h3> Should hiking boots be a size bigger than your usual shoe?</h3><p>Sizing is personal. Generally speaking, order hiking boots the same way you order running shoes or work boots, keeping an eye out for brands that run large, small, narrow, or wide. The only caveat I'd offer is that people who hike in thick wool socks might need to account for the extra material by going one half-size up. There are plenty of modern hiking socks that can keep you warm and dry without being bulky, so this is a matter of personal taste.</p><h3> Do hiking boots stretch?</h3><p>Leather boots will break in to become more supple and adjust to the shape of your foot. I wouldn't go so far as to say they stretch, though. Most hiking boots use a combination of synthetic materials, though, so you can expect your hiking boots to fit basically the same throughout their service life.</p><h3> Can I wear hiking boots for regular walking?</h3><p>Absolutely. Being over-geared is a lot less problematic than being under-geared. Because of their price, I wouldn't recommend buying hiking boots specifically for walking, but there's no reason you couldn't lace up your hiking boots for a walk every now and then between camping trips. In fact, that's a great way to break them in.</p><h3> Do I need to spend a lot of money on hiking boots?</h3><p>Not necessarily. Most of us can have a blast with an entry-level or midrange pair of hiking boots. Plenty of up-and-coming manufacturers and established brands offer affordable hiking boots that pack a ton of value. That being said, if you're planning on climbing a 14er or hiking one of the National Scenic Trails you need to invest in something that's up to the challenge.</p><h3> How long should hiking boots last?</h3><p>Hiking boot life is probably best measured in miles, not years. Even then, there can be a huge amount of variation depending on the type of terrain you cover, the amount of weight you carry, and the amount of moisture your boots are exposed to. If you start with a quality item and take care of your boots, you can expect to get several hiking seasons out of them. At that point, rotate them into duty for yard work to stretch your dollar even further.</p>"
recumbent exercise bikes,"<h2>FAQs on recumbent exercise bikes</h2><h3>Who should use a recumbent bike?</h3><p>In fairness, anyone can use a recumbent exercise bike, from rookies to professionals. If you had to boil it down to a specific group, however, they're especially favored by the physically impaired in need of a machine that minimizes fatigue and risk of injury. Elderly, physical therapy patients and overweight individuals are prime examples of those who would benefit due to the design's inherent lack of stress on joints and bones.</p><h3>How long should you work out on a recumbent bike?</h3><p>Depending on your style of routine, the recommended duration may vary. Typically, high-intensity workouts favoring rapid calorie burning can be accomplished within 15 to 30 minutes. Those attempting to maintain a steady pace at a steady heart rate can press on for an hour or more depending on your own limits.</p><h3>Can you lose weight using a recumbent bike?</h3><p>Like any form of cardio, you can very much lose weight on a recumbent. It's all a matter of diet and workout intensity. Typically, higher intensity bursts of cardio may result in greater weight loss in a shorter time than longer, less strenuous routines.</p><h3>Should you stretch before riding a recumbent bike?</h3><p>As with any workout, you should always stretch no matter what. Even with the lessened strain of a recumbent, you're still engaging in some form of resistance training and could risk pulling something, especially if you decide to ramp up resistance levels. Do yourself a favor and stretch before and after your workout.</p><h3>Is a recumbent bike good cardio exercise?</h3><p>Yes, it can be effective just like any other form of cardio. It just depends on your exact use case and what your routine is. As professionals will preach, the same methodology applies: Higher intensity, short bursts will result in more calories burned quicker. Steady, continuous pedaling at a reasonable resistance may promote lower body muscle development and cardiovascular endurance.</p><h3>What is the difference between upright and recumbent exercise bikes?</h3><p>A recumbent exercise bike sports a laid-back, relaxed seating position that eases the spine and tailbone as you're not on a saddle hunching over handlebars. You're sitting in a more conventional chair-like position with legs outstretched, reducing strain on your joints, making recumbents ideal for physically-impaired athletes or those simply wanting to reduce the chance of injury.</p>"
shooting mats,"<h2>FAQs about shooting mats</h2><h3>What are shooting mats used for?</h3><p>Shooting mats allow hunters, recreational shooters, and military personnel to set up a shooting position in austere conditions where the ground may be wet, muddy, sandy, or covered in other undesirable material (e.g., coyote dung in the high deserts of Arizona).</p><h3>Why do you need to preload your bipod?</h3><p>Preloading a bipod is when the shooter ""leans in"" to the rifle, pressing forward with their entire body against the bipod to minimize the effect of the recoil impulse and the tendency for the rifle to jump off target after a shot. Done correctly, this allows the shooter to retain the sight picture during and after the shot, and substantially reduces the time required for a follow-up shot if necessary. Some shooting mats include ridges or straps to secure the feet of the bipod so that they don't slip when the bipod is preloaded. This feature is a ""nice-to-have"" rather than a ""must-have"" as the bipod can be preloaded effectively by using rubberized or spiked bipod feet or placing a small weight (e.g., sandbag) in front of the bipod.</p><h3>In what environment will you mainly be using the shooting mat?</h3><p>Generally speaking, shooting mats are used either on hard surfaces at established shooting facilities (concrete pads, gravel, etc) or in the backcountry on bare ground, which may also be wet, muddy, or sandy. The shooting mat keeps the shooter and their gear dry, clean, and reasonably comfortable.</p><h3>Can I stake down the shooting mat?</h3><p>Yes, many shooting mats have either grommets or stake loops in the corners to secure the mat during windy conditions.</p><h3>Can I use a shooting mat in wet environments?</h3><p>Absolutely! In wet environments, a quality mat makes the shooting experience more comfortable and improves the ability of the shooter to focus on the fundamentals: sight picture, breathing control, and the surprise trigger break.</p><h3>What else can I use a shooting mat for?</h3><p>Shooting mats are handy for a multitude of uses. I keep one in my truck for when I have to repair or maintain my truck. A shooting mat can also double as a ground cloth for camping or even as a small picnic blanket for lunch by the stream. Padded shooting mats can even replace closed-cell foam or inflatable sleeping mattresses when camping.</p>"
hiking pants for women,"<h2>FAQs on hiking pants for women</h2><h3>What's the best fabric for hiking pants for women?</h3><p>Freedom of movement is essential, which means you should look for hiking pants with a high nylon and elastic content. The beauty is that these materials are not only stretchy, but they are also breathable, moisture-wicking, and can also help you regulate your body temperature.</p><h3>What extra features of hiking pants for women do you need?</h3><p>Pockets, pockets, and more pockets. Seriously, hiking pants need to be functional, but to maximize your comfort, look for pants with zippers for venting, a built-in belt or loops, a gusseted crotch, and articulated knees.</p><h3>Do I need hiking pants, outdoor pants, functional pants, or trekking pants?</h3><p>Good question with a simple answer: A good pair of hiking pants can serve many purposes, including hiking, climbing, and mountaineering.</p><h3>What insulation should my hiking pants have?</h3><p>It depends on what activities you have planned. If you are doing things in the winter, softshell pants often come with a fleece lining to help insulate you. The beauty of hiking pants is that base layers can be worn underneath for added protection from the cold.</p><h3>How do waterproof finishes differ for hiking pants?</h3><p>There is no such thing as waterproof clothing. Exposure to the elements and washing will diminish the amount of water resistance your outdoor clothing provides. The good news is that you can restore their water resistance between washes by applying beeswax or water resistance sprays.</p><h3>What practical details should hiking pants have?</h3><p>If you want pants that will offer maximum mobility without dragging you down, look for hiking trousers made from stretchy nylon fabric with leg zippers for venting, crotch gusseting, articulated knee darts. Nylon fabric will help move moisture away from your skin to keep you warm and dry while gussets and knee darts will ensure you can move through the most challenging terrain with ease.</p><h3>What hiking pants should I wear in the summer?</h3><p>Unless I plan to go bushwacking, I tend to wear running shorts but always carry my Patagonia Torrentshell 3L Pants for rain and wind protection and an extra layer of warmth in a pinch. However, quick-drying, lightweight Outdoor Research Ferrosi Pants are an excellent option for summer hikes, and have an elastic cinch cord at the cuff for additional venting and breathability.</p>"
backpacking sleeping bags,"<h2>FAQs on backpacking sleeping bags</h2><h3>How do you pack a sleeping bag in a backpack?</h3><p>The best way to pack a sleeping bag is to invert it and stuff it into a compression stuff sack to smash it to the smallest possible mass. Place lighter items like sleeping bags at the bottom of your pack and heavier items higher up between your shoulders. Make sure you put down insulated bags in a waterproof stuff sack or waterproof the main compartment of your backpack with a large leaf bag.</p><h3>What's the best size sleeping bag for backpacking?</h3><p>Get the one that matches your height most closely. Most mid- and high-end bag manufacturers offer their bags in regular (up to 72 inches) or long (up to 78 inches). Some offer small or short variants (around 66 inches), and some premium manufacturers even offer small, regular, and large girth size options. Other high-end manufacturers offer made-to-order custom bags.</p><h3>How heavy should a backpacking sleeping bag be?</h3><p>Look for the lightest bag that meets your desired temperature range. Most good three-season bags weigh less than two pounds, and good four-season bags weigh less than three pounds.</p><h3>What's the difference between a backpacking and camping sleeping bag?</h3><p>Backpacking bags are much lighter, more compressible, and more efficient in terms of warmth-to-weight ratios due to high power (800+) down fill, thin high-tensile shell material, and mummy-shaped form-fitting design.</p><h3>How is down fill power measured?</h3><p>Down is measured by fill power - how much loft and volume it provides per ounce. It's a relative measure of down quality in terms of fluffiness. Fill power is a measure of how many cubic inches of loft that one ounce of down produces. For instance, 650 fill power down means one ounce by weight will provide 650 cubic inches of loft and thus dead trapped air. Similarly, one ounce of 800 fill power down will provide an additional 150 cubic inches of loft - more insulation for the same weight. The higher the number, the higher the quality. Note that you need to combine fill power with fill weight to determine how warm a sleeping bag is because a bag with 10 ounces of 600 fill down won't be nearly as warm as a bag with 10 ounces of 800 fill down.</p>"
weighted vests,"<h2>FAQs on weighted vests</h2><p>A weighted vest will help your fitness by increasing the level of exertion required to complete a given task. If you'd like a working example, do a set of 10 bodyweight squats. Not too hard, right? Now grab a 25-pound weight (or something approximate) and do another 10 squats. Pretty big difference. The increased excretion helps to burn more calories and build more muscle, which are the two primary goals of working out in the first place.</p><p>This depends a lot on your current level of fitness and your overall fitness goals, but a good rule of thumb for the average person is about 10 percent of your current body weight as a maximum.</p><p>Yes. Should you? Well, that's a different story. Again, this is completely dependent on your goals and your current fitness, not to mention what you do all day. If you work at a desk all day or sit around watching bad daytime TV, it's probably not worth the effort. Also, if you're not used to a weighted vest, you shouldn't jump right into wearing it all day long. Work your way up to longer periods and, even then, allow yourself some time away from it, if for no other reason than to let your skin breathe. Many soldiers wear their vest for long periods of time, just in the normal course of work, but then again most of us end up with bad backs and knees.</p><p>Yes, but the vest is only part of the answer. A weighted vest will help you burn more calories in whatever activity you're doing, but keep in mind that weight loss is primarily diet-driven. If calories burnt is greater than calories consumed, you'll lose weight. Long story short, you can't up your food intake to match your exertion.</p><p>You can perform pretty much any type of exercise in a weighted vest, but you want to make sure you're smart about what you're doing. For example, running with large amounts of weight can be detrimental to your back and joints, especially if you don't build up appropriately. High impact, repetitious activities might be better served with lower weights and a good long build-up period.</p>"
camping stoves,"<h2>FAQs on camping stoves</h2><p>The stove that is best is one that you can get a proper pot or pan on top of, has sufficient BTU output, can simmer, and has enough of a flame distribution to avoid hot spots and scorching. Generally, these are car camping/basecamp stoves.</p><p>Most stoves I've inspected are pretty simple. For backpacking stoves, I prefer the integrated canister stoves like the JetBoil MiniMo and Zip. For car camping stoves, I prefer the two-burner three-sided windscreen models like the Camp Chef Everest 2X or Coleman Classic. In almost every case, someone has done a YouTube video on how to operate them.</p><p>It depends. If traveling by foot and backpack, get a backpacking stove. By car? Then get a car camping stove. If by air, check to see what the airline will allow aboard and what fuels are available at your destination. They typically don't let you fly with fuel.</p><p>Not typically. Some require you to change a small part of the burner depending on the fuel. If so, it's not hard.</p><p>Ok, I didn't want to, but I quickly researched this, and don't fully understand what this event is about. I saw kids with backpacks on the website, so keep it small and simple like the JetBoil Zip. That is if you like them. If not, get them the biggest, heaviest stove to carry around.</p><p>For backpacking, the JetBoil Zip is hard to beat. Also, check out the MSR PocketRocket Deluxe. For car camping stoves, check out the Camp Chef Everest 2X.</p><p>I don't advise it, especially not inside a tent. You could asphyxiate, which is bad. These stoves put out carbon monoxide which can kill you if you inhale too much of it.</p><p>Almost all just screw on.</p><p>It depends. The more BTUs it puts out, the more fuel it uses.</p><p>No. We do NOT recommend this as they put out carbon monoxide, which is colorless and odorless and can kill you or give you brain damage. Also, your tent could catch fire and you could burn to death - a horrible, melted nylon-coated, flaming death.</p>"
cabin tents,"<h2>FAQs on cabin tents</h2><h3>How do you set up a cabin tent?</h3><p>Most cabin tents are very similar in setup, and consist of poles and rods (often fiberglass) that create a frame to support the outer fabric. Stakes are used to secure the tent to the ground, and more stakes used with guylines to help spread out windows and the rainfly. Be sure to follow the directions provided by the tent makers. When you get a new tent (or are gifted a used one), always set it up completely at home before using it for camping. You don't want to find out that there's a huge gash in it, during a rainstorm while on vacation</p><h3>What is the purpose of a cabin tent?</h3><p>A cabin tent is a great way for a family or group of people to camp together at an established or easy to get to camp site. They're designed to be much larger and a little more sturdy than dome tents, which are smaller and designed to be carried into more remote locations.</p><h3>Are cabin tents waterproof?</h3><p>This varies from tent to tent, but many are not actually waterproof. Most are ""water resistant"", so they can hold up to a light rain for a while, but will eventually start to leak. Always check the tent's product page when you buy to understand what kind of waterproofing/resistance your tent has. A waterproof rainfly (which is often, but not always, included) is a great way to increase a tent's ability to keep out precipitation.</p><h3>Do cabin tents lose their waterproofing?</h3><p>Yes. The amount of use and type of weather you expose your tent to will have an impact on how often you should re-waterproof it. It might seem a little counter-intuitive, but if you find yourself often camping in areas that expose your tent to little rain but lots of direct sunlight, you'll need to re-waterproof it before too long. The sunlight can actually break down or dry out the tent's waterproofing. For regular use, think about applying a waterproofing agent every couple of years.</p>"
