TERM,OUTPUT
folding tables,"<h2>FAQs on Folding Tables</h2><h3>How much do folding tables cost?</h3><p>Folding tables are generally very affordable, costing between $30 and $50 for a 6- to 8-foot table. However, you may find that some manufacturers offer free shipping or in-store pickup if you buy more than one item from them.</p><h3>What size folding table should I get?</h3><p>The best thing to do is measure your space and then add a little extra room for chairs and stools around the table. If you have kids, consider getting a foldable playpen or stand-up booster seat to keep them off the ground while they're eating. That said, don't skimp on quality. Buy a sturdy, stable table with plenty of space for food, drinks, and gear. Make sure it can support at least 300 pounds before you take it anywhere important.</p><h3>How much do folding tables cost?</h3><p>Pricing will vary depending on the various features of the folding table, however; expect to spend between $65 and $400 for a 30-inch x 72-inch rectangular table and between $80 and $475 for a 60-inch round table. This does not include shipping. Volume discounts may be available on orders of 10 or more tables.</p><p>If you consider folding tables an investment and hope to purchase replacement tables less often, consider purchasing a higher-end table. You will spend more upfront, but you will likely spend less in the long run. Look for tables will a minimum 10-year warranty.</p><h3>How do I know which table is the best fit for my property?</h3><p>If your property hosts a lot of events and requires quick room turnover, durability is one of the most important considerations in a folding table. You want to make sure you have tables that can stand up to heavy use as well as being dropped and rolled over rough surfaces. The tabletop edge design and corner construction are also important. Look for an impact-resistant tabletop that won't be damaged by accidental dropping.</p><p>In addition, look for longevity in the tabletop surface. Look for commercial-grade laminate that can withstand contact with hot objects as well as being scratch-resistant. More durable laminate means you will spend less on maintenance like refinishing and sanding.</p><p>Also, take table weight into consideration, especially for high-turn areas. Look for features such as a table leg locking mechanism which will make setup and takedown easier.</p><h3>Which folding tables are the easiest to clean and disinfect?</h3><p>Linenless tables are very easy to clean and disinfect using common wipes and sprays. Plus, linen tablecloths are more likely to absorb germs and bacteria.</p><p>When purchasing plastic folding tables, look for ones with a smooth finish which is easier to sanitize.</p><h3>What should I look for in folding table carts?</h3><p>Look for durable carts that are easy to load, unload, and maneuver. Purchase table carts that are designed to avoid scratching tables during loading and unloading.</p><p>The dimensions of a cart when loaded is also important. You want to make sure it can fit through the doorways of your facility and that they will fit inside your storage area.</p><h3>How do I choose between rectangular and round folding tables?</h3><p>Both types of tables have benefits and it really depends on the size and capacity of your facility as well as what type of events you host most often.</p><p>Rectangular tables are often used for multi-purpose needs such as community events, food service, dining, and training. Round tables are most often used for banquets, weddings, and other formal dining occasions.</p>"
ballistic glasses,"<h2>FAQs on Ballistic Glasses</h2><h3>What is the difference between ballistic and non-ballistic?</h3><p>Ballistic glasses are designed to deflect or stop a direct hit from an assault rifle, while non-ballistic glasses are not designed to do that. However, both types of glasses can help protect your eyes from injury if you're involved in hand-to-hand combat or if there's debris flying around. Make sure you wear eye protection at all times.</p><h3>What is ballistic-rated?</h3><p>In the world of safety eyewear, ballistics means military-grade impact protection. This standard differs quite a lot from that of safety eyewear for civilians. Ballistic-rated eyewear is designed and tested to survive the military's high-speed impact and fragmentation standards.</p><h3>How do I know if glasses have a ballistic rating?</h3><p>Three standards are used to test the ability of glasses or goggles to shield a wearers eyes from fragments or small projectiles. The civilian standard is ANSI Z87.1 with a high-impact rating and ballistic specification. The U.S. Military standard includes MIL-PRF-31013. Eyewear that meets these standards is ballistic-rated.</p><h3>Do glasses count as eye protection shooting?</h3><p>Unless prescription glasses have been specially designed to be safety glasses, they cannot be used as protective eye gear.</p><h3>Can a car break through bullet proof glass?</h3><p>Bullets shot from the inside of an armored car are able to penetrate the bulletproof glass because they strike the polycarbonate layer first with more focused energy. The brittle glass layer then breaks outward allowing the bullet to pass through with minor energy loss.</p><h3>Do tinted lenses improve shooting glasses?</h3><p>Tinting can improve a wearers ability to perceive contrast and depth under different light conditions. Many military sunglasses have gray or smoke lenses to preserve color accuracy in bright sunlight. Yellow or orange lenses are popular for shooting glasses because this eyewear enhances contrast and the visibility of orange targets.</p><h3>Can I get ballistic safety glasses with clear lenses?</h3><p>Clear ballistic safety glasses only provide protection or vision correction with prescription lenses. Ballistic-rated glasses with clear lenses are the best choice for shooting in low light or dark conditions. Ballistic glasses with clear lenses may be worn as standard eyewear in environments with elevated levels of eye safety hazards.</p><h3>Should I use military sunglasses for shooting?</h3><p>If you will be outside, it is a good idea to wear sunglasses to protect your eyes from UV and to reduce glare (improving safety). It is also a good idea to wear protective eyewear that is rated for ballistic uses. Our military eye protection options fit these needs perfectly.</p><h3>Does my military eyewear need to be ANSI rated?</h3><p>The short answer is that, no, military eye protection does not need to be ANSI-rated. However, many ballistic sunglasses are also ANSI-rated. This indicates that they have met another standard for safety and protection.</p>"
mag pouches for plate carriers,"<h2>FAQs about Mag Pouches</h2><h3>What are mag pouches?</h3><p>Pouches provide security in storing your magazines and ammo with ease and safety. Ammo pouches can be used with rifles, shotguns, and grenade launchers, making them the perfect versatile tool for carrying the necessary accessories for your weapons.</p><h3>What is the most comfortable way to carry a firearm?</h3><p>The answer to this question depends heavily on your lifestyle and what you intend to carry. For concealed carry, I prefer an ankle holster with a good cover garment like a boot or skirt.</p><h3>How much does a magazine pouch cost?</h3><p>Mag Pouches are available in a variety of materials, finishes, and sizes. The price will vary depending on the material used, the size, and whether it's made in the USA or overseas. Most manufacturers offer free shipping within the US, so expect to pay for the privilege of being able to walk around with loaded magazines in your pocket. If you're looking to save some money, look at used items on sites.</p><h3>Can I wear a magazine carrier with my business suit?</h3><p>Yes, but you'll want to make sure it's not too tight, otherwise you risk losing valuable contents if you bump into something hard. Make sure you practice wearing it with your work pants before going to a company event. That said, there are times when it's appropriate to rock a magazine carrier with your suit. For instance, if you're a corrections officer, you might wear one while carrying a gun that day. But, if you're a doctor, you might wear it while carrying a stapler or pair of scissors. It depends on the job you do.</p><h3>What are mag pouches made of?</h3><p>The nylon used in mag pouches is either Ballistic nylon or Cordura nylon.As a material it's a dual-layered polymer nylon fabric with a textile membrane. This allows the whole mag pouch to 'breathe'. The retention of the nylon mag pouches is based on its light material design.</p><h3>Are kydex mag pouches good?</h3><p>Top reviews from the United States</p><p>These things are awesome. you can use the metal sig mags with these and the mags don't move at all. This inside is more of a rubber as opposed to a kydex/plastic. Excellent holsters.</p><h3>What should you have on your plate carrier?</h3><p>At the bare minimum, you should have mag pouches and an Individual First Aid Kit (IFAK). Anything in addition to that will depend on your job and the mission.</p><h3>How many mags do you carry on your plate carrier?</h3><p>The typical loadout for infantry is around six rifle magazines. Again, this depends on your job and mission. SWAT or Special Forces may carry more ammo while Motor T carries less</p><h3>What mag pouches do the military use?</h3><p>The standard-issue mag pouches depend on the branch. Each branch has its preference depending on its mission.</p><h3>Are mag pouches universal?</h3><p>No. Some are capable of carrying many different types of rifle or pistol magazines. Most are specifically designed for certain styles of magazines, though.</p>"
karambit knives,"<h2>FAQs on Karambit Knives</h2><h3>What are karambit knives good for?</h3><p>The use of a karambit can enhance the efficiency and/or safety of nearly any chore or task. They make a great dive knife, as they can cut lines, hosing, and tubing with a single pass, no sawing required. They're equally useful in technical rope rescue and other safety scenarios.</p><h3>Why is the karambit so popular?</h3><p>Karambit combat knives have become popular among modern martial artists mainly because of the increasing interest practitioners are showing in the Indonesian fighting arts and the subsequent proliferation of schools that teach them, karambit combat knives have started finding their way into the mainstream.</p><h3>What is the difference between a karambit and an Eickhoff?</h3><p>The Eickhoff is a fixed-bladesuite, no-tapered-edge version of the karambit. The karambit has tapered edges and a slightly more aggressive blade shape than the Eickhoff. The karambit's popularity in the United States is due to its ease of use and availability as a folding knife.</p><h3>Are karambits actually good for self-defense?</h3><p>Ideal for Self-Defense<br />For an experienced owner, the Karambit gives considerable advantage over the opponent. In combat, compared to the classic knife, it is easier to control and provides more options for attack and escape. Thanks to its shape it is also safer.</p><h3>Is a karambit a tactical knife?</h3><p>Because of their curved blades and finger holes, karambit knives make amazing tactical and combat tools. Karambits are available in various varieties, including folding knives, fixed blades, neck knives, and automatics. You can never go wrong with a karambit knife for your tactical and combat needs.</p><h3>Are karambit knives legal to carry?</h3><p>Generally, yes. Karambits are regulated at the state level and while each state's laws can vary, most allow utility, work and functional blades that have a blade length of 3"""" or less or that are specifically designed for hunting or agricultural use.</p><h3>Why do karambits have a hole?</h3><p>Knives with finger holes can improve your grip and many are easier to deploy. They also simply look cool and unique. The design of the ancient blade continues to inspire knifemakers today as they modernize the design of karambit knives.</p><h3>Who uses karambits?</h3><p>The karambit or kerambit (as used in Indonesian), kurambik or karambiak (both from the Minangkabau language) is a small Indonesian curved knife resembling a claw from Minangkabau people of West Sumatra. The karambit is one of the weapons commonly used in pencak silat and Filipino martial arts.</p><h3>How dangerous are karambit knives?</h3><p>Karambit knives are not inherently dangerous, but they can be used for defensive purposes or for certain types of offensive strikes. If you're not comfortable with your karambit's intended use, it's probably best to keep it sheathed or locked away from access by children or unauthorized users. That said, if you're looking to do some serious damage, a karambit is a great choice.</p><h3>Is a karambit a practical weapon?</h3><p>Yes. Anyone who says a karambit is a practical EDC knife is lying to you. Yes, it can be used for normal daily tasks, but anything with a blade can be used for virtually any task if you are resourceful enough.</p>"
duffel bags,"<h2>FAQs about Duffel Bags</h2><h3>Why do people use duffel bags?</h3><p>Duffel Bag Benefits<br />They are spacious and lightweight, often made of durable materials, like canvas or ballistic nylon. Thanks to their soft construction, you can take advantage of every nook and cranny when packing and check them in or carry on, depending on size.</p><h3>What is the purpose of duffel bag?</h3><p>A duffel bag, duffle bag, or kit bag is a large bag made of either natural or synthetic fabric (typically canvas), historically with a top closure using a drawstring. Generally a duffel bag is used by non-commissioned personnel in the military, and for travel, sports and recreation by civilians.</p><h3>What size do you need?</h3><p>The best answer to this question is """"whatever fits your gear inside of it,"""" but if you're like me, I tend to go with a 40-liter pack. That's enough for all my camping and work gear, plus room for everything else I might want to take on a trip.</p><h3>What is the difference between a gym bag and a duffel bag?</h3><p>A gym bag is typically hard-bottomed and sometimes has a rectangular base. A duffel bag on the other hand has an open structure. The lack of rigidity in their design differentiates the two when it comes to storing and carrying bulkier objects.</p><h3>Are duffle bags bad for your back?</h3><p>Heavy backpacks or bags can lead to back problems and poor posture even shoulder problems and headaches. We're carrying more baggage around than ever before and by baggage we don't mean the emotional weight of traumas past and present.</p><h3>How much does a duffel bag weigh?</h3><p>A good quality duffel weighs between 10 and 15 pounds depending on the materials used. The lighter duty versions can be as little as 7 pounds while the heavier duty models weigh in at around 17 pounds. If you are carrying more than one item of gear, you may want to look at getting two or three smaller bags that attach together to form a larger load-carrying system. This will help distribute the weight across several items and reduce fatigue on long treks.</p><h3>Can I Put My Duffel Bag in the Washing Machine?</h3><p>If your duffel bag is made from durable cloth or nylon, your bag is safe to put in the washing machine. Make it easy for yourself, and don't stress about having to hand wash. Just make sure you wash with cold water and air dry to avoid shrinking or warping fabric.</p><h3>Are Duffel Bags Safe to Put In the Dryer?</h3><p>If you want to put your duffel bag in a dryer, there's a right way to approach this. First, when you put it inside, include a couple of towels before running it on a regular cycle in your washing machine. Make sure that you use towels in a similar colour so that no colour bleeding will occur. Putting your duffel bag in the dryer on its own can be too harsh, and it might ruin the material of your bag.</p>"
down jackets,"<h2>FAQs on Down Jackets</h2><h3>Why do they call it down jacket?</h3><p>A down jacket is a jacket which has been insulated with the soft and warm under feathers from duck or geese. Down is a fantastic insulator as the loft (or fluffiness) of down creates thousands of tiny air pockets which trap warm air and retain heat, thus helping to keep the wearer very warm in cold winter weather.</p><h3>Is a down jacket the warmest?</h3><p>In short, absolutely. Down jackets made of goose down (the smaller, fluffier feathers underneath the harder exterior feathers) are pound for pound the best insulation against cold temperatures, according to NY Daily News.</p><h3>What is a down jacket good for?</h3><p>Down is a soft, heat-trapping fluff from ducks or geese that keeps them warm in the wild. Down jackets use this natural material as insulation because it's great at locking in warmth.</p><h3>Are down jackets water resistant?</h3>Don't wear a down jacket during rain. Remember, down jackets are not waterproof. They are only splashproof. If they are exposed to water for a long time, they will lose their fluffiness. They are made of feathers, after all.</p><h3>Do down jackets go flat?</h3><p>Over time, the feathers and down insulation in a garment can get packed down and become flat, making the fibres thinner and more likely to penetrate seams or a lining. Luckily, you can make your old down jacket new again with a simple wash, although it's essential to follow proper washing directions for down products.</p><h3>Do you wash down jackets?</h3><p>Machine-washing a down jacket. Use a down-specific soap or detergent. Skip the spin cycle. It's better for your down jacket to drip dry and/or use a tumble dryer.</p><h3>How often should you wash your down jacket?</h3><p>Not only are down products easy to wash, but they should be washed at least once or twice a year. Look for the label. Despite my inability to find a care label, most items should have one.</p><h3>How do you wear a down jacket?</h3><p>Down jackets are designed to be worn loose and over your regular clothes, so the most important thing is to make sure you have a good fit. Make sure the sleeves are long enough to cover your wrists, but not too long that they flutter in the breeze.</p><h3>What's the difference between insulated and non-insulated?</h3><p>Insulation adds warmth without adding bulk, making it perfect for outdoor activities like skiing or snowboarding. It also helps resist moisture, keeping you warm and dry while wearing less clothing than a non-insulated jacket would require. The downside of insulation is that it does add weight to the jacket, which may cause you to overheat if you're not careful. If you plan on doing strenuous activity in the cold, then an insulated jacket is a great investment. Otherwise, stick with a non-insulated option.</p>"
compression socks,"<h2>FAQs on Compression Socks</h2><h3>How tight should my compression sock be?</h3><p>Your compression sock should feel snug but not constricting. The best way to find the right fit is to try a few pairs of your favorite athletic or workout gear and see how they fit. If you're used to tight jeans, then stick with that size.</p><h3>How to measure compression socks size?</h3><ul><li>Step 1: Measure the circumference of the ankle at the narrowest part of the ankle, just above the ankle bone.</li><li>Step 2: Measure the circumference of the calf at the widest part of the calf.</li><li>Step 3: Measure the length of the calf. The measure is taken on the outside of the leg, by measuring from the floor up to the bend of the knee.</li><li>Step 4: Use the above compression sock size chart to determine your size.</li><li>Step 5: Ensure that the sock band lies flat and that the top of the band sits 2 finger widths below the crease of the knee. Never pull the sock up into the crease behind your knee as this may limit the circulation.</li></ul><h3>What do compression socks do for me?</h3><p>Compression socks help maintain body heat and promote circulation by compressing blood vessels and veins, which helps move more oxygen throughout your body. They also reduce muscle fatigue and can help prevent shin splints during long runs.</p><p>Compression socks are great for any activity where you need extra support in your legs, especially when wearing shorts or short-length pants. They're also great for women who want to avoid panty lines while running or working out in the gym. For those looking to tone up, compression socks can help increase muscle mass and improve vascularity, making them an excellent choice for a full-body workout.</p><h3>How long does it take for compression socks to work?</h3><p>For best results, put on your compression garment first thing in the morning. This is when your limbs are the least swollen. Visible improvement in the appearance of your veins can take up to six weeks to see.</p><h3>When should you wear compression socks?</h3><p>You can wear your compression socks all day by putting them on when getting dressed in the morning, and take them off before bed (unless your doctor advises otherwise).</p><h3>Can I wear compression socks all day?</h3><p>Yes, although most experts recommend no longer than 30 minutes at a time. If you're going to be sitting for extended periods, it's probably best to go without compression socks. Also, if you have varicose veins, don't wear them all day long. You could wind up with a painful spider vein breakout.</p><p>Stick to shorter bursts of activity and take frequent breaks from sitting to stretch your legs out. If you're a desk jockey, you might want to invest in a pair of thigh-high stockings to keep your legs warm and supported while working at a computer.</p><h3>What are the negative effects of compression socks?</h3><p>Can cause itching, redness, and irritation. Compression socks can aggravate skin irritation and also cause itching. When compression socks are improperly fitted, redness and temporary dents in your skin may appear on your legs at the edge of the sock's fabric. </p>"
chest rigs,"<h2>FAQs on Chest Rigs</h2><h3>Who invented chest rigs?</h3><p>While the Rhodesians are often credited with creating the chest rig during their Bush War, it was the Chinese Communists that first fielded them during the Viet Nam conflict. The size and curvature of AK-47 style magazines denied the use of belt-mounted carrying systems.</p><h3>What does a chest rig do?</h3><p>Chest rigs are a form of tactical gear storage that is mounted on the chest. These can be worn on top of a tactical vest, and sometimes come as a part of them. As we mentioned above one of the major benefits of chest rigs is that they allow you to carry a lot of tactical equipment, whilst keeping your hands free.</p><h3>What should be in a chest rig?</h3><p>The point of wearing a chest rig is to carry ammo and gear, which is done with the use of pouches. Most rigs will have at least a couple of rifle magazine pouches and one or two multi-purpose pouches. Other models will have pistol magazine pouches, radio pouches, or any number of utility pouches.</p><h3>How heavy is a chest rig?</h3><p>The weight of 660 gr / 1.45 lbs. is about standard for all chest rigs, and you won't have a problem of it being too heavy when you fill up the included pouches (unless you load it up with too many additional MOLLE pouches).</p><h3>What is the best type of chest rig?</h3><p>The most common type of chest rig is the power rack style, which uses a bar or bands to secure your arms and legs in place while you lift. Power racks are versatile and can be used for a variety of exercises, but they do require access to a power rack, so if you don't have one at home, it may not be an option.</p><h3>What is a micro chest rig?</h3><p>Quite simply, It's a small scale and low profile Chest Rig with a hot-swappable magazine insert system that allows carriage of Pistol, Subgun, Assault and Battle Rifle magazines.</p><h3>How do you set up a chest rig?</h3><p>Once you've got your rig and the items to go in it sorted, you'll need to fix it up.</p><p>In a nutshell, so the rig fits correctly and feels comfortable with the load compact and readily accessible. At the same time, so the weight is minimal, and well balanced.</p><h3>How much do chest rigs cost?</h3><ul><li>Budget chest rigs go for less than $75, but normally trade features and standards for affordable prices.</li><li>Mid-range chest rigs run to $150, but generally offer more features and improved quality.</li><li>Any more north a price and we're talking top-of-the-line chest rigs.</li></ul>"
