TERM,OUTPUT
weightlifting gloves,"<h2>FAQs about weightlifting gloves</h2><h3>Should you wear gloves when lifting weights?</h3><p>No, for the majority of lifters out there. Folks who have sensitive skin, sensory issues, or jobs that require an obvious lack of calluses have legitimate reasons to wear workout gloves. Men’s Health does a great job of explaining this in more detail. </p><h3>Do gloves help with deadlift?</h3><p>They can, but don’t rely solely on gloves to complete the lift. Focus your accessory work on the forearms and grip strength with lifts like rack pulls or just hanging from the pullup bar. The gloves will only protect your hands from getting torn up.</p><h3>Are weight lifting gloves cheating?</h3><p>No more than wearing running shoes would be. If you need to wear gloves to work out consistently, then keep on wearing them. </p><h3>Do weight lifting gloves prevent calluses?</h3><p>Yes, which is why most people wear them. If you’re a heavy sweater, I’d encourage using a little baby powder to prevent blisters that could turn into calluses. </p>"
citizen watches,"<h2>FAQs about Citizen watches</h2><h3>How accurate is a Citizen automatic watch?</h3><p>Citizen automatic watches in the 8000-series are rated to plus or minus 20 seconds per day, but usually perform much better, especially if you regulate them.</p><h3>Are Citizen watches waterproof? </h3><p>Citizen watches aren’t waterproof, since the preferred term is “water-resistant.” Nothing is truly waterproof. However, all of the watches on this list feature a good level of water resistance, and both of the Promaster divers are officially certified for SCUBA diving. Additionally, Citizen is credited with making the deepest-rated solar watch ever.</p><h3>Are Citizen watches high-end?</h3><p>Citizen has some great high-end watches. The Caliber 0100 is on par with any Swiss watch you put it against, at the very least, and the newer automatic variant, the Series 8, seeks to recapture the performance luxury market.</p><h3>Are Citizen watches better than Rolex?</h3><p>I don’t know any Rolex watches that keep time to within a second per year. Then again, they’ve never tried.</p>"
hiking shorts,"<h2>FAQs about hiking shots</h2><h3>What should you not wear while hiking?</h3><p>Avoid tight pants, leggings, or other pants or shorts that stick to your skin. Jeans and thick fabric is also a bad idea, as is clothing that is 100 percent cotton or silk. </p><h3>Is it better to hike in pants or shorts?</h3><p>Shorts are fine if you’re planning a day hike in warm weather on a trail that’s rated easy to moderately difficult. However, shorts provide less protection on rugged trails, in inclement weather, and on longer hikes in which the conditions are more challenging or less predictable. </p><h3>Why do thru-hikers wear shorts?</h3><p>Some hikers prefer to wear shorts because they are cooler and provide more mobility than pants. </p><h3>How do you keep ticks off when hiking?</h3><p>One way to avoid ticks is to wear insect repellent. You can also spray your clothing and gear with the insecticide permethrin. If you wear light-colored clothing, ticks will also be easier to spot so you can remove them.</p>"
camping pillows,"<h2>FAQs about camping pillows</h2><h3>Can you use regular pillows for camping?</h3><p>You can use regular pillows for camping, and some people do. The problem is regular pillows are not designed to be used in an outdoor environment and are much more prone to soiling, staining, and ruin. They also are not very packable for backpackers.</p><h3>How do I wash my camping pillow?</h3><p>It depends on the camping pillow. Some have removable covers that are machine-washable. Some must be hand-washed and air-dried. It’s always best to check the manufacturer’s instructions to be sure.</p><h3>How do you keep a pillow on a sleeping pad?</h3><p>Many camping pillows have a contoured design that allows them to be used inside a sleeping bag hood, and keeps the pillow centered over the shoulders and neck. Some manufacturers may include non-slip fabric to prevent pillows from sliding.</p><h3>Are camping pillows worth it?</h3><p>Absolutely. Many camping pillows provide remarkable support and comfort using materials designed to survive the use and abuse of camping outdoors.</p>"
canvas backpacks,"<h2>FAQs about canvas backpacks</h2><h3>Are canvas backpacks waterproof?</h3><p>Canvas backpacks are water–resistant, not waterproof. However, a waxed canvas backpack improves water resistance by filling in the gaps between the fibers. </p><h3>Is canvas the most durable material for backpacks?</h3><p>Honestly, no. In testing, nylon was more abrasion-resistant, while being lighter, Additionally, canvas tends to be more flammable than nylon. That said, canvas is still a rugged material, and you can rest assured that a canvas backpack will serve you well. </p><h3>How do you keep canvas backpacks clean?</h3><p>Canvas backpacks can be cleaned by spot-washing the affected area with some hot soapy water. They should not, however, be placed in a washing machine.</p>"
battle ropes,"<h2>FAQs about battle ropes</h2><h3>How do you anchor battle ropes?</h3><p>All you need is something to hold the center of the rope still while you use each end. That can be a purpose-built anchor attached to a post or something like a heavy sandbag placed over the rope.</p><h3>Are battle ropes for cardio or strength training?</h3><p>Battle ropes are used for high-intensity training that can improve muscular strength, endurance, and power. You’ll be using compound movements that translate to real-world fitness in a wide range of applications.</p><h3>What muscles do battle ropes work?</h3><p>Because battle ropes require compound movements, you’ll be using several muscle groups. They’re primarily designed to activate the arms, chest, shoulders, and upper back. In order to maintain a stable platform, you’ll need to maintain tension in your legs and core, as well.</p>"
military socks,"<h2>FAQs about military socks</h2><h3>What are the best military socks?</h3><p>The best military socks depend on your environment and usage. More cushioning is better for long-term heavy-duty usage, but thinner socks breathe better. Cotton is better for dry, hot environments, but not great if there’s a chance of water. This list will help you choose accordingly.</p><h3>Why do soldiers need specific socks?</h3><p>Wet and dirty feet can literally kill you in a tactical environment. Wet socks cause peeled, rotting skin, and can facilitate the growth of fungus, germs, and other infections. Military boots are also taller than hiking boots, to keep out dirt, insects, and other debris, meaning that ankle socks are a no-go. Because of this, specialized socks are necessary.</p><h3>Do Marines wear black socks?</h3><p>Always have, always will.</p>"
camping mugs,"<h2>FAQs about camping mugs</h2><h3>Can I cook with an enamel mug?</h3><p>Absolutely. An enamel mug is designed to take a direct flame, which is why they’ve been so popular with campers for decades. The uninsulated metal ensures a quick heat transfer, but be sure to move it around a bit just to avoid warping, especially if your mug is old. </p><h3>What are BPAs and why do they matter when buying a mug?</h3><p>BPA stands for bisphenol A. It’s a chemical found in certain types of plastic material. Why it matters to campers is that some storage products containing BPA have been found to seep into the food and liquids they carried. While studies are still ongoing, there is a correlation between known BPA consumption and negative effects on the brain and prostate glands of babies and young children. Additionally, new studies have shown there may also be a connection between the ingestion of BPA and heart issues. This is why most non-metal mugs will explicitly state they are BPA-free. </p>"
running shoes for women,"<h2>FAQs on running shoes for women</h2><h3>If I have flat feet, is there a certain type of running shoe I should buy?</h3><p>Absolutely. If you have verified that you have flat feet by visiting a running store or doing a wet footprint test, you should probably consider purchasing neutral shoes.</p><h3>Does a more expensive shoe make it a better one?</h3><p>Absolutely not, and the Saucony Cohesion 12 is a great example of how a less expensive shoe can actually rival the performance of pricier options for comfort, cushioning, and design. Shoe preference is also highly subjective since every body and foot is unique, so do your research and don’t be afraid to test out different shoes on a treadmill at the running store before you buy a pair. And don’t forget that shoes are like cars — the previous year’s model always goes on sale at some point.</p><h3>What can I do to bring the cost of new running shoes down?</h3><p>Manufacturers rarely develop technology that is so incredible in a given year that it’s worth paying more for a new year’s shoe model. Search for the previous model online and you will be sure to save up to 60 percent. </p>"
duffel bags,"<h2>FAQs on duffel bags</h2><h3>What’s the biggest duffel bag size?</h3><p>There is a limit to sizing, but the Eberlestock Hercules is 192 liters and the largest I’ve been able to find. </p><h3>How big is an Army duffle bag?</h3><p>Sea bags like the Rothco G.I. Canvas duffel are typically 38L x 22W x 22D inches.</p><h3>How do you secure a military duffle bag?</h3><p>Old-school sea bags have a metal loop that you can put a padlock through. </p><h3>Are Army duffle bags waterproof?</h3><p>No, the canvas is treated to be weather-resistant though. </p><h3>What are Army duffel bags made of?</h3><p>Sea bags are made from a durable cotton canvas. </p>"
compact binoculars,"<h2>FAQs on compact binoculars</h2><h3>What do the numbers on binoculars mean?</h3><p>Binoculars are numbered based on magnification power and size of the objective lens. A pair marked 8×26 would make the image you see appear eight times larger than it is and use a lens that’s 26 millimeters in diameter.</p><h3>Why is it hard to see through my binoculars?</h3><p>Binoculars need to be adjusted to your eyes to work properly. Set the eyecups directly in front of each eye, find proper eye relief (distance between the binoculars and your eyes), and focus based on viewing distance.</p><h3>Can I use binoculars with glasses?</h3><p>Absolutely! Adjustable eyecups make it possible to tweak binoculars to match your eyes. Some binoculars are better at this than others, and Best Binocular Reviews has a great article on how to make your binoculars and glasses work together.</p>"
pull up bars,"<h2>FAQs about pull-up bars</h2><h3>Do pull-up bars damage walls?</h3><p>You can seriously damage your walls by installing a pull-up bar incorrectly. Check your installation manual and invest in helpful tools like a stud finder, drill, and the correct hardware for your specific pull-up bar and mounting surface to avoid any problems. </p><h3>Do no-screw pull-up bars work?</h3><p>Yes, but some are better than others. Doorway pull-up bars that use leverage to grip the door frame are more secure than bars that press against the inside of the doorway. </p><h3>Are pull-up bars safe at home?</h3><p>If you buy a quality pull-up bar and install it correctly, you shouldn’t have any problems (unless someone catches you kipping).</p><h3>Are pull-up bars worth it?</h3><p>Pull-ups are one of the best bodyweight exercises for overall fitness. Even if you don’t go all-in on a home gym, getting your own pull-up bar can be a great way to boost your athletic performance.</p>"
ankle weights,"<h2>FAQs about ankle weights</h2><h3>Can ankle weights be used when running or walking?</h3><p>No. Medical professionals advise against wearing ankle weights while running or walking. They say it can strain your ankle joints or cause muscle imbalance. Overall, you increase the risk of injuring your hips, back, and knees if you wear them for those activities. If you do want extra resistance during cardio, they recommend wearing a weighted vest instead. </p><h3>How heavy should my ankle weights be?</h3><p>Most experts recommend using ankle weights that weigh one to three percent of your body weight. However, ankle weights are often available weighing anywhere from one to 10 pounds. </p><h3>What’s the best way to use ankle weights?</h3><p>Ankle weight exercises are typically limited to lower body and core workouts, but the additional weight will make pull-ups and chin-ups more challenging as well. Additionally, physical therapists like to use ankle weights to improve the walking gait in older adults or rehabbing patients who suffered a stroke.</p>"
aviator sunglasses,"<h2>FAQs about aviator sunglasses</h2><h3>How much do aviator sunglasses cost?</h3><p>You can find knock-offs online or at your local gas station for a few bucks, but they’ll fall apart almost immediately. The aviator shades on this gear guide cost between $40 and $250 (at full MSRP).</p><h3>Do women wear aviators?</h3><p>Yes, and they should because everyone deserves to look this cool.</p><h3>What face shape looks good with aviator sunglasses?</h3><p>According to the people at Esquire (who are far more style-conscious than I am), traditional, teardrop aviators look best on diamond- and heart-shaped faces. I’d argue that anyone and everyone looks good in aviators. </p><h3>Are expensive aviator sunglasses really better?</h3><p>Sunglasses aren’t complicated, but build quality does matter. High-end sunglasses benefit from better materials and manufacturing techniques than cheap ones, though how much that’s worth is up to you.</p><h3>What’s the best way to clean aviator sunglasses?</h3><p>All About Vision has a step-by-step guide to cleaning glasses, but it boils down to gentle soap and a soft, lint-free cloth.</p>"
headlamps,"<h2>FAQs on headlamps</h2><h3>How many lumens should a good headlamp have?</h3><p>If you need to read a map or move around a campsite, a basic headlamp with around 200 lumens is sufficient. Action sports require you to see further ahead as you increase speed, so a headlamp with 750 to 1,000 lumens might be a better option.</p><h3>What headlamps do the military use?</h3><p>Although some units may issue headlamps, most service members buy their own for use in the field. Headlamps designed for camping are the most popular because they’re durable, long-lasting, and can be easily switched from white light to other colors like red and green.</p><h3>Why do some headlamps have different color lenses?</h3><p>White lights are by far the most common because they produce true-to-life colors. Other hues––usually red or green––are used to preserve our night vision. They also don’t carry as far, which is more discreet in a tactical environment.</p>"
camping gear,"<h2>FAQs on camping gear</h2><p>[Length: up to 50 words per FAQ.] </p><h3>Should I buy a two- or three-person tent for my partner and me?</h3><p>It depends on whether that extra room is worth carrying extra weight. Typically, I recommend going with a larger two-person tent.</p><h3>Aren’t mummy bags tight and uncomfortable to sleep in?</h3><p>They can be if you get one that’s too tight a fit. It’s important to test the sleeping bag you purchase before you take it to the field. </p><h3>Do I need to filter/treat the water? I hear it’s safe to drink out of the river/lake.</h3><p>Yes. I recommend filtering or treating all water that doesn’t come from a potable tap. In some countries, I recommend filtering or treating the tap water as well.</p><h3>Should I get the MSR Whisperlite or Dragonfly stove?</h3><p>Neither. I recommend the JetBoil family of stoves.</p><h3>Can I just buy a smaller backpack and strap more to the outside if I need to?</h3><p>You can, but everything strapped to the outside of your pack is more likely to detach and get lost. If you are climbing in vertical terrain, you’ll want to keep your gear in your pack to avoid dropping it on other people and to keep the weight closer to your center of gravity.</p><h3>Should I take packaged or real food?</h3><p>I prefer taking as much real food into the backcountry as possible, but watch the weight because it adds up fast. I typically carry real food for the first few days and then shift to dehydrated meals as the trip goes on. </p><h3>Is it worth the weight to take hiking poles?</h3><p>Hell yes. Trekking poles are worth their weight in gold when traveling over uneven terrain as they provide additional balance and keep you from busting your ass while wearing a heavy pack. They can also help prevent you from injury, serve as poles for setting up a tarp, or even as splints for immobilizing injured arms and legs.   </p><h3>Should I buy pots for cooking over an open fire or cooking on a stove?</h3><p>More pots equals more weight carried. If you’re car camping, sure. Go ahead. When backpacking, I prefer integrated stove-pot combos like the JetBoil.</p><h3>Pillow or no pillow?</h3><p>Always. An inflatable pillow weighs next to nothing and provides additional comfort to help you get a better night’s sleep.</p><h3>Should I pack a warm jacket?</h3><p>Yes. You should always pack an insulating layer — preferably one made from synthetic materials that will continue to insulate when damp. You should carry it every time you venture into the backcountry no matter the season. You should carry it in case you need it, or in case you come across an injured person who is at risk of a cold injury. Always take a warming layer.</p>"
swimming goggles,"<h2>FAQs on swimming goggles</h2><h3>How do you keep swimming goggles from fogging?</h3><p>Swimming goggles, safety glasses, and any other form of eye protection that doesn’t allow for airflow will be susceptible to fog. Some goggles will feature a proprietary anti-fog coating, but I have never found these to be very effective. Instead, using a good anti-fog compound such as Cat Crap has worked for me in the past.</p><h3>How do you clean swimming goggles?</h3><p>After every use, you should rinse your goggles in fresh water, which will prevent the chlorine from degrading the coating on your goggles, making the rubber brittle, and leaving residue on your goggle. Doing this will prolong the lifespan of your goggles.</p><h3>Can I wear swimming goggles after LASIK?</h3><p>Once fully healed from LASIK, there should be no issue with swimming with goggles. However, consult your optometrist with this question, as we don’t have any doctors on staff that I know of.</p><h3>How do you remove scratches from swim goggles?</h3><p>Depending on the severity of the scratches, and whether or not you have a mirrored coating on your goggles, you may be able to use a compound like Polywatch to buff out some scratches. However, this may not make the goggles as clear as they were before.</p><h3>How do you adjust swimming goggles?</h3><p>Your goggles should be snug, but not overly tight, and should stay on even when diving into the water, pushing off of the wall of the pool, or in heavy surf when in open water. For competitive swimmers, wearing your goggles underneath a swim cap may help with maintaining fit, and other swimmers may find it helpful to change out the nosepiece of their goggles.</p><h3>Can I wear contacts with swimming goggles?</h3><p>You can, however, many swimmers who require corrective lenses instead prefer to wear prescription swim goggles to avoid the possibility of chlorine infiltration under their contacts, which could cause far worse irritation than against the naked eye. </p><h3>How do you assemble swimming goggles?</h3><p>This mostly applies to Swedish swimming goggles, since most swimming goggles require little to no set up. Swedish goggles need to be adjusted for your eye width by lengthening or shortening the string that connects the goggles over the bridge of your nose, and then the rubber straps need to be adjusted. To properly size the straps, whether you use rubber straps or bungees, you’ll run the straps through the goggles once on each side, giving you an open end and a closed end. Tie off the open end or use a bungee gather, if using bungees, and adjust the tightness until the goggles feel secure on your head. Try the fit of the goggles underwater, and continue to adjust the length of the nose string and rubber straps until you achieve a secure fit, even in the most vigorous water conditions.</p>"
garmin watches,"<h2>FAQs about Garmin watches</h2><h3>How much does a Garmin watch cost?</h3><p>The entry-level Forerunner 245 Music has an MSRP of $349.99, and prices go all the way up to $1,599.99 for the loaded tactix 7 Pro Ballistics Edition. </p><h3>Are Garmin watches worth it?</h3><p>Garmin does a great job of offering watches at a wide range of prices so you can pay for only the features you need. No matter which one you buy, you’ll get a segment-leading product that’s trusted around the world.</p><h3>Are Garmin watches compatible with iPhones?</h3><p>Yes, although some add-on apps are only compatible with Android devices.</p><h3>Are Garmin watches waterproof?</h3><p>The Forerunner 245 Music has a water-resistance rating of 50 meters. All the other watches on this list have a waterproof rating of 100 meters.</p>"
water purification tablets,"<h2>FAQs about water purification tablets</h2><h3>How long do water purification tablets last?</h3><p>They last until the expiration date, so check them. Most last a few years. </p><h3>What is the best chemical to purify water?</h3><p>Hands down, it’s chlorine dioxide because it nukes viruses, bacteria, Giardia, and Cryptosporidium.</p><h3>Does boiling water remove chlorine?</h3><p>Yes, if you boil it for 15 to 20 minutes.</p>"
camping chairs,"<h2>FAQs on camping chairs</h2><h3>Is a camping chair the same as a beach chair?</h3><p>No, beach chairs are typically lower to the ground and feature bars or wide pads to prevent the chair from sinking into the sand. You could use your camping chair on the beach if you want, though.</p><h3>Can camping chairs get wet?</h3><p>Yes, depending on the type of material. However, it could impact the durability and longevity of your camping chair, not to mention make your butt soggy.</p><h3>Do weight limits on camping chairs matter?</h3><p>Absolutely! At least for big guys like me. </p><h3>Do I need a camping chair? </h3><p>Not necessarily. If you can sit on a rock, a stump, or the ground for hours at a time without aches, pains, or losing circulation, then go right ahead. </p><h3>How much do camping chairs cost? </h3><p>Camping chairs are typically priced around $30-60. Deal surfers can probably find chairs under $30, but premium chairs can cost $100 or more. </p><h3>How do I wash my camping chair? </h3><p>Start by shaking off any loose dirt. Then use some soap, water, and a coarse bristled brush to target any tough stains. Set it out to air dry before stowing it away. </p>"
camping hammocks,"<h2>FAQs on camping hammocks</h2><h3>Are hammocks good for side-sleepers?</h3><p>Yes, hammocks can be just as good for side-sleepers as they are for those that sleep on their backs. Consider sleeping at a diagonal and give your hammock 30 degrees of slack at each end, or get a hammock with a flat, fixed frame.</p><h3>How do I choose a hammock?</h3><p>Before picking out a hammock, first identify what features matter to you and what you will be using the hammock for, whether that be backpacking, car camping, or lounging in a park — and then go from there.</p><h3>Are hammocks bad for your back?</h3><p>As long as you set your hammock up right, sleeping this way can actually provide more support for your back than sleeping in a bed, where you toss and turn throughout the night.</p>"
chronograph watches,"<h2>FAQs about chronograph watches</h2><h3>What is a chronograph watch?</h3><p>A chronograph watch is essentially a wrist-mounted stopwatch that measures, at the very least, seconds. It will usually feature a start and stop pusher, as well as a reset pusher. More sophisticated chronographs will feature the ability to track split times, and some may feature specialized bezels to measure units over time.</p><h3>What is the difference between a chronograph and a chronometer?</h3><p>The question of chronograph vs. chronometer is the difference between the stopwatch complication that is a chronograph, and a watch being rated minus four to plus six seconds per day.</p><h3>Why do chronograph watches cost so much?</h3><p>Chronographs are more complicated and require more effort to make them reliable and accurate. Due to this, they always cost more than equivalent quality watches that are less complex.</p><h3>How long do chronograph watches last?</h3><p>Chronograph watches will burn through their spring power reserve or battery at a faster rate than their conventional watch counterparts, and experience more parts wear over time. Don’t leave the chronograph running, and get your watch serviced every three to seven years.</p>"
